"No.","Time","D_Time","Source","Destination","Protocol","Length","Sequence num","Ack number","data len","Info"
"1","0.000000s","0.000000s","192.168.0.41","192.168.0.42","TCP","74","0","","","51063 > http [SYN] Seq=0 Win=29200 Len=0 MSS=1460 SACK_PERM=1 TSval=372350678 TSecr=0 WS=128"
"2","0.000066s","0.000066s","192.168.0.42","192.168.0.41","TCP","74","0","1","","http > 51063 [SYN, ACK] Seq=0 Ack=1 Win=28960 Len=0 MSS=1460 SACK_PERM=1 TSval=137288129 TSecr=372350678 WS=128"
"15","0.000178s","0.000112s","192.168.0.41","192.168.0.42","TCP","66","1","1","","51063 > http [ACK] Seq=1 Ack=1 Win=29312 Len=0 TSval=372350678 TSecr=137288129"
"224","0.002995s","0.002817s","192.168.0.41","192.168.0.42","TCP","1514","1","1","1448","[TCP segment of a reassembled PDU]"
"225","0.003022s","0.000027s","192.168.0.42","192.168.0.41","TCP","66","1","1449","","http > 51063 [ACK] Seq=1 Ack=1449 Win=31872 Len=0 TSval=137288130 TSecr=372350679"
"226","0.003032s","0.000010s","192.168.0.41","192.168.0.42","TCP","1514","1449","1","1448","[TCP segment of a reassembled PDU]"
"227","0.003048s","0.000016s","192.168.0.42","192.168.0.41","TCP","66","1","2897","","http > 51063 [ACK] Seq=1 Ack=2897 Win=34816 Len=0 TSval=137288130 TSecr=372350679"
"228","0.003050s","0.000002s","192.168.0.41","192.168.0.42","TCP","1514","2897","1","1448","[TCP segment of a reassembled PDU]"
"229","0.003060s","0.000010s","192.168.0.42","192.168.0.41","TCP","66","1","4345","","http > 51063 [ACK] Seq=1 Ack=4345 Win=37760 Len=0 TSval=137288130 TSecr=372350679"
"230","0.003063s","0.000003s","192.168.0.41","192.168.0.42","TCP","1514","4345","1","1448","[TCP segment of a reassembled PDU]"
"231","0.003072s","0.000009s","192.168.0.42","192.168.0.41","TCP","66","1","5793","","http > 51063 [ACK] Seq=1 Ack=5793 Win=40576 Len=0 TSval=137288130 TSecr=372350679"
"232","0.003074s","0.000002s","192.168.0.41","192.168.0.42","TCP","1514","5793","1","1448","[TCP segment of a reassembled PDU]"
"233","0.003085s","0.000011s","192.168.0.42","192.168.0.41","TCP","66","1","7241","","http > 51063 [ACK] Seq=1 Ack=7241 Win=43520 Len=0 TSval=137288130 TSecr=372350679"
"234","0.003088s","0.000003s","192.168.0.41","192.168.0.42","TCP","1514","7241","1","1448","[TCP segment of a reassembled PDU]"
"235","0.003100s","0.000012s","192.168.0.42","192.168.0.41","TCP","66","1","8689","","http > 51063 [ACK] Seq=1 Ack=8689 Win=46336 Len=0 TSval=137288130 TSecr=372350679"
"236","0.003103s","0.000003s","192.168.0.41","192.168.0.42","TCP","1514","8689","1","1448","[TCP segment of a reassembled PDU]"
"237","0.003114s","0.000011s","192.168.0.42","192.168.0.41","TCP","66","1","10137","","http > 51063 [ACK] Seq=1 Ack=10137 Win=49280 Len=0 TSval=137288130 TSecr=372350679"
"239","0.003125s","0.000011s","192.168.0.41","192.168.0.42","TCP","1514","10137","1","1448","[TCP segment of a reassembled PDU]"
"240","0.003134s","0.000009s","192.168.0.42","192.168.0.41","TCP","66","1","11585","","http > 51063 [ACK] Seq=1 Ack=11585 Win=52224 Len=0 TSval=137288130 TSecr=372350679"
"241","0.003137s","0.000003s","192.168.0.41","192.168.0.42","TCP","1514","11585","1","1448","[TCP segment of a reassembled PDU]"
"242","0.003149s","0.000012s","192.168.0.42","192.168.0.41","TCP","66","1","13033","","http > 51063 [ACK] Seq=1 Ack=13033 Win=55040 Len=0 TSval=137288130 TSecr=372350679"
"244","0.003159s","0.000010s","192.168.0.41","192.168.0.42","TCP","1514","13033","1","1448","[TCP segment of a reassembled PDU]"
"245","0.003169s","0.000010s","192.168.0.42","192.168.0.41","TCP","66","1","14481","","http > 51063 [ACK] Seq=1 Ack=14481 Win=57984 Len=0 TSval=137288130 TSecr=372350679"
"246","0.003172s","0.000003s","192.168.0.41","192.168.0.42","TCP","1514","14481","1","1448","[TCP segment of a reassembled PDU]"
"247","0.003182s","0.000010s","192.168.0.42","192.168.0.41","TCP","66","1","15929","","http > 51063 [ACK] Seq=1 Ack=15929 Win=60928 Len=0 TSval=137288130 TSecr=372350679"
"248","0.003185s","0.000003s","192.168.0.41","192.168.0.42","TCP","1514","15929","1","1448","[TCP segment of a reassembled PDU]"
"249","0.003197s","0.000012s","192.168.0.42","192.168.0.41","TCP","66","1","17377","","http > 51063 [ACK] Seq=1 Ack=17377 Win=63744 Len=0 TSval=137288130 TSecr=372350679"
"250","0.003247s","0.000050s","192.168.0.41","192.168.0.42","TCP","1514","17377","1","1448","[TCP segment of a reassembled PDU]"
"251","0.003258s","0.000011s","192.168.0.41","192.168.0.42","TCP","1514","18825","1","2896","[TCP segment of a reassembled PDU]"
"252","0.003264s","0.000006s","192.168.0.41","192.168.0.42","TCP","1514","20273","1","4344","[TCP segment of a reassembled PDU]"
"253","0.003272s","0.000008s","192.168.0.42","192.168.0.41","TCP","66","1","18825","","http > 51063 [ACK] Seq=1 Ack=18825 Win=66688 Len=0 TSval=137288130 TSecr=372350679"
"254","0.003281s","0.000009s","192.168.0.42","192.168.0.41","TCP","66","1","20273","","http > 51063 [ACK] Seq=1 Ack=20273 Win=69504 Len=0 TSval=137288130 TSecr=372350679"
"255","0.003289s","0.000008s","192.168.0.41","192.168.0.42","TCP","1514","21721","1","2896","[TCP segment of a reassembled PDU]"
"256","0.003295s","0.000006s","192.168.0.42","192.168.0.41","TCP","66","1","21721","","http > 51063 [ACK] Seq=1 Ack=21721 Win=72448 Len=0 TSval=137288130 TSecr=372350679"
"257","0.003295s","0.000000s","192.168.0.41","192.168.0.42","TCP","1514","23169","1","2896","[TCP segment of a reassembled PDU]"
"258","0.003303s","0.000008s","192.168.0.42","192.168.0.41","TCP","66","1","23169","","http > 51063 [ACK] Seq=1 Ack=23169 Win=75392 Len=0 TSval=137288130 TSecr=372350679"
"259","0.003303s","0.000000s","192.168.0.41","192.168.0.42","TCP","1514","24617","1","2896","[TCP segment of a reassembled PDU]"
"260","0.003309s","0.000006s","192.168.0.41","192.168.0.42","TCP","1514","26065","1","4344","[TCP segment of a reassembled PDU]"
"261","0.003309s","0.000000s","192.168.0.42","192.168.0.41","TCP","66","1","24617","","http > 51063 [ACK] Seq=1 Ack=24617 Win=78208 Len=0 TSval=137288130 TSecr=372350679"
"262","0.003316s","0.000007s","192.168.0.42","192.168.0.41","TCP","66","1","26065","","http > 51063 [ACK] Seq=1 Ack=26065 Win=81152 Len=0 TSval=137288130 TSecr=372350679"
"263","0.003324s","0.000008s","192.168.0.42","192.168.0.41","TCP","66","1","27513","","http > 51063 [ACK] Seq=1 Ack=27513 Win=84096 Len=0 TSval=137288130 TSecr=372350679"
"264","0.003411s","0.000087s","192.168.0.41","192.168.0.42","TCP","1514","27513","1","1448","[TCP segment of a reassembled PDU]"
"265","0.003425s","0.000014s","192.168.0.42","192.168.0.41","TCP","66","1","28961","","http > 51063 [ACK] Seq=1 Ack=28961 Win=86912 Len=0 TSval=137288130 TSecr=372350679"
"266","0.003429s","0.000004s","192.168.0.41","192.168.0.42","TCP","1514","28961","1","1448","[TCP segment of a reassembled PDU]"
"267","0.003441s","0.000012s","192.168.0.42","192.168.0.41","TCP","66","1","30409","","http > 51063 [ACK] Seq=1 Ack=30409 Win=89856 Len=0 TSval=137288130 TSecr=372350679"
"268","0.003444s","0.000003s","192.168.0.41","192.168.0.42","TCP","1514","30409","1","1448","[TCP segment of a reassembled PDU]"
"269","0.003453s","0.000009s","192.168.0.42","192.168.0.41","TCP","66","1","31857","","http > 51063 [ACK] Seq=1 Ack=31857 Win=92672 Len=0 TSval=137288130 TSecr=372350679"
"270","0.003455s","0.000002s","192.168.0.41","192.168.0.42","TCP","1514","31857","1","1448","[TCP segment of a reassembled PDU]"
"271","0.003465s","0.000010s","192.168.0.42","192.168.0.41","TCP","66","1","33305","","http > 51063 [ACK] Seq=1 Ack=33305 Win=95616 Len=0 TSval=137288130 TSecr=372350679"
"272","0.003468s","0.000003s","192.168.0.41","192.168.0.42","TCP","1514","33305","1","1448","[TCP segment of a reassembled PDU]"
"273","0.003478s","0.000010s","192.168.0.42","192.168.0.41","TCP","66","1","34753","","http > 51063 [ACK] Seq=1 Ack=34753 Win=98560 Len=0 TSval=137288130 TSecr=372350679"
"274","0.003480s","0.000002s","192.168.0.41","192.168.0.42","TCP","1514","34753","1","1448","[TCP segment of a reassembled PDU]"
"275","0.003492s","0.000012s","192.168.0.42","192.168.0.41","TCP","66","1","36201","","http > 51063 [ACK] Seq=1 Ack=36201 Win=101376 Len=0 TSval=137288130 TSecr=372350679"
"276","0.003494s","0.000002s","192.168.0.41","192.168.0.42","TCP","1514","36201","1","1448","[TCP segment of a reassembled PDU]"
"277","0.003504s","0.000010s","192.168.0.42","192.168.0.41","TCP","66","1","37649","","http > 51063 [ACK] Seq=1 Ack=37649 Win=104320 Len=0 TSval=137288130 TSecr=372350679"
"278","0.003507s","0.000003s","192.168.0.41","192.168.0.42","TCP","1514","37649","1","1448","[TCP segment of a reassembled PDU]"
"279","0.003517s","0.000010s","192.168.0.42","192.168.0.41","TCP","66","1","39097","","http > 51063 [ACK] Seq=1 Ack=39097 Win=107264 Len=0 TSval=137288130 TSecr=372350679"
"280","0.003520s","0.000003s","192.168.0.41","192.168.0.42","TCP","1514","39097","1","1448","[TCP segment of a reassembled PDU]"
"281","0.003529s","0.000009s","192.168.0.42","192.168.0.41","TCP","66","1","40545","","http > 51063 [ACK] Seq=1 Ack=40545 Win=110080 Len=0 TSval=137288130 TSecr=372350679"
"282","0.003532s","0.000003s","192.168.0.41","192.168.0.42","TCP","1514","40545","1","1448","[TCP segment of a reassembled PDU]"
"283","0.003542s","0.000010s","192.168.0.42","192.168.0.41","TCP","66","1","41993","","http > 51063 [ACK] Seq=1 Ack=41993 Win=113024 Len=0 TSval=137288130 TSecr=372350679"
"284","0.003544s","0.000002s","192.168.0.41","192.168.0.42","TCP","1514","41993","1","1448","[TCP segment of a reassembled PDU]"
"285","0.003554s","0.000010s","192.168.0.42","192.168.0.41","TCP","66","1","43441","","http > 51063 [ACK] Seq=1 Ack=43441 Win=115840 Len=0 TSval=137288130 TSecr=372350679"
"286","0.003556s","0.000002s","192.168.0.41","192.168.0.42","TCP","1514","43441","1","1448","[TCP segment of a reassembled PDU]"
"287","0.003568s","0.000012s","192.168.0.42","192.168.0.41","TCP","66","1","44889","","http > 51063 [ACK] Seq=1 Ack=44889 Win=118784 Len=0 TSval=137288130 TSecr=372350679"
"288","0.003571s","0.000003s","192.168.0.41","192.168.0.42","TCP","1514","44889","1","1448","[TCP segment of a reassembled PDU]"
"289","0.003580s","0.000009s","192.168.0.42","192.168.0.41","TCP","66","1","46337","","http > 51063 [ACK] Seq=1 Ack=46337 Win=121728 Len=0 TSval=137288130 TSecr=372350679"
"290","0.003583s","0.000003s","192.168.0.41","192.168.0.42","TCP","1514","46337","1","1448","[TCP segment of a reassembled PDU]"
"291","0.003593s","0.000010s","192.168.0.42","192.168.0.41","TCP","66","1","47785","","http > 51063 [ACK] Seq=1 Ack=47785 Win=124544 Len=0 TSval=137288130 TSecr=372350679"
"292","0.003595s","0.000002s","192.168.0.41","192.168.0.42","TCP","1514","47785","1","1448","[TCP segment of a reassembled PDU]"
"293","0.003605s","0.000010s","192.168.0.42","192.168.0.41","TCP","66","1","49233","","http > 51063 [ACK] Seq=1 Ack=49233 Win=127488 Len=0 TSval=137288130 TSecr=372350679"
"294","0.003607s","0.000002s","192.168.0.41","192.168.0.42","TCP","1514","49233","1","1448","[TCP segment of a reassembled PDU]"
"295","0.003617s","0.000010s","192.168.0.42","192.168.0.41","TCP","66","1","50681","","http > 51063 [ACK] Seq=1 Ack=50681 Win=130432 Len=0 TSval=137288130 TSecr=372350679"
"296","0.003628s","0.000011s","192.168.0.41","192.168.0.42","TCP","1514","50681","1","1448","[TCP segment of a reassembled PDU]"
"297","0.003642s","0.000014s","192.168.0.42","192.168.0.41","TCP","66","1","52129","","http > 51063 [ACK] Seq=1 Ack=52129 Win=133248 Len=0 TSval=137288130 TSecr=372350679"
"298","0.003648s","0.000006s","192.168.0.41","192.168.0.42","TCP","1514","52129","1","1448","[TCP segment of a reassembled PDU]"
"299","0.003659s","0.000011s","192.168.0.42","192.168.0.41","TCP","66","1","53577","","http > 51063 [ACK] Seq=1 Ack=53577 Win=136192 Len=0 TSval=137288130 TSecr=372350679"
"320","0.003770s","0.000111s","192.168.0.41","192.168.0.42","TCP","1514","53577","1","1448","[TCP segment of a reassembled PDU]"
"321","0.003778s","0.000008s","192.168.0.42","192.168.0.41","TCP","66","1","55025","","http > 51063 [ACK] Seq=1 Ack=55025 Win=139008 Len=0 TSval=137288130 TSecr=372350679"
"322","0.003782s","0.000004s","192.168.0.41","192.168.0.42","TCP","1514","55025","1","1448","[TCP segment of a reassembled PDU]"
"323","0.003793s","0.000011s","192.168.0.42","192.168.0.41","TCP","66","1","56473","","http > 51063 [ACK] Seq=1 Ack=56473 Win=141952 Len=0 TSval=137288130 TSecr=372350679"
"324","0.003795s","0.000002s","192.168.0.41","192.168.0.42","TCP","1514","56473","1","1448","[TCP segment of a reassembled PDU]"
"325","0.003806s","0.000011s","192.168.0.42","192.168.0.41","TCP","66","1","57921","","http > 51063 [ACK] Seq=1 Ack=57921 Win=144896 Len=0 TSval=137288130 TSecr=372350679"
"326","0.003808s","0.000002s","192.168.0.41","192.168.0.42","TCP","1514","57921","1","1448","[TCP segment of a reassembled PDU]"
"327","0.003818s","0.000010s","192.168.0.42","192.168.0.41","TCP","66","1","59369","","http > 51063 [ACK] Seq=1 Ack=59369 Win=147712 Len=0 TSval=137288130 TSecr=372350679"
"328","0.003828s","0.000010s","192.168.0.41","192.168.0.42","TCP","1514","59369","1","1448","[TCP segment of a reassembled PDU]"
"329","0.003838s","0.000010s","192.168.0.42","192.168.0.41","TCP","66","1","60817","","http > 51063 [ACK] Seq=1 Ack=60817 Win=150656 Len=0 TSval=137288130 TSecr=372350679"
"330","0.003847s","0.000009s","192.168.0.41","192.168.0.42","TCP","1514","60817","1","1448","[TCP segment of a reassembled PDU]"
"331","0.003854s","0.000007s","192.168.0.41","192.168.0.42","TCP","1514","62265","1","2896","[TCP segment of a reassembled PDU]"
"332","0.003860s","0.000006s","192.168.0.41","192.168.0.42","TCP","1514","63713","1","4344","[TCP segment of a reassembled PDU]"
"333","0.003862s","0.000002s","192.168.0.42","192.168.0.41","TCP","66","1","62265","","http > 51063 [ACK] Seq=1 Ack=62265 Win=153600 Len=0 TSval=137288130 TSecr=372350679"
"334","0.003866s","0.000004s","192.168.0.41","192.168.0.42","TCP","1514","65161","1","4344","[TCP segment of a reassembled PDU]"
"335","0.003871s","0.000005s","192.168.0.41","192.168.0.42","TCP","1514","66609","1","5792","[TCP segment of a reassembled PDU]"
"336","0.003871s","0.000000s","192.168.0.42","192.168.0.41","TCP","66","1","63713","","http > 51063 [ACK] Seq=1 Ack=63713 Win=156416 Len=0 TSval=137288130 TSecr=372350679"
"337","0.003875s","0.000004s","192.168.0.41","192.168.0.42","TCP","1514","68057","1","5792","[TCP segment of a reassembled PDU]"
"338","0.003879s","0.000004s","192.168.0.42","192.168.0.41","TCP","66","1","65161","","http > 51063 [ACK] Seq=1 Ack=65161 Win=159360 Len=0 TSval=137288130 TSecr=372350679"
"339","0.003881s","0.000002s","192.168.0.41","192.168.0.42","TCP","1514","69505","1","5792","[TCP segment of a reassembled PDU]"
"340","0.003886s","0.000005s","192.168.0.42","192.168.0.41","TCP","66","1","66609","","http > 51063 [ACK] Seq=1 Ack=66609 Win=162176 Len=0 TSval=137288130 TSecr=372350679"
"341","0.003885s","- 0.000001s","192.168.0.41","192.168.0.42","HTTP","924","70953","1","5202","POST / HTTP/1.0  (text/plain)"
"342","0.003892s","0.000007s","192.168.0.42","192.168.0.41","TCP","66","1","68057","","http > 51063 [ACK] Seq=1 Ack=68057 Win=165120 Len=0 TSval=137288130 TSecr=372350679"
"343","0.003900s","0.000008s","192.168.0.42","192.168.0.41","TCP","66","1","69505","","http > 51063 [ACK] Seq=1 Ack=69505 Win=168064 Len=0 TSval=137288130 TSecr=372350679"
"344","0.003906s","0.000006s","192.168.0.42","192.168.0.41","TCP","66","1","70953","","http > 51063 [ACK] Seq=1 Ack=70953 Win=170880 Len=0 TSval=137288130 TSecr=372350679"
"345","0.003914s","0.000008s","192.168.0.42","192.168.0.41","TCP","66","1","71811","","http > 51063 [ACK] Seq=1 Ack=71811 Win=173824 Len=0 TSval=137288130 TSecr=372350679"
"365","0.004025s","0.000111s","192.168.0.42","192.168.0.41","HTTP","406","1","71811","340","HTTP/1.1 200 OK  (text/html)"
"371","0.004128s","0.000103s","192.168.0.42","192.168.0.41","TCP","66","341","71811","","http > 51063 [FIN, ACK] Seq=341 Ack=71811 Win=173824 Len=0 TSval=137288130 TSecr=372350679"
"392","0.004280s","0.000152s","192.168.0.41","192.168.0.42","TCP","66","71811","341","","51063 > http [ACK] Seq=71811 Ack=341 Win=30336 Len=0 TSval=372350679 TSecr=137288130"
"5276","0.041364s","0.037084s","192.168.0.41","192.168.0.42","TCP","66","71811","342","","51063 > http [ACK] Seq=71811 Ack=342 Win=30336 Len=0 TSval=372350689 TSecr=137288130"
"7742","0.061086s","0.019722s","192.168.0.41","192.168.0.42","TCP","66","71811","342","","51063 > http [FIN, ACK] Seq=71811 Ack=342 Win=30336 Len=0 TSval=372350693 TSecr=137288130"
"7743","0.061092s","0.000006s","192.168.0.42","192.168.0.41","TCP","66","342","71812","","http > 51063 [ACK] Seq=342 Ack=71812 Win=173824 Len=0 TSval=137288144 TSecr=372350693"
