"No.","Time","D_Time","Source","Destination","Protocol","Length","Sequence num","Ack number","data len","Calculated window size","Info"
"2","12.242008s","0.000000s","192.168.0.41","192.168.0.42","TCP","74","0","","","29200","33947 > 49200 [SYN] Seq=0 Win=29200 Len=0 MSS=1460 SACK_PERM=1 TSval=127201307 TSecr=0 WS=128"
"3","12.242224s","0.000216s","192.168.0.42","192.168.0.41","TCP","74","0","1","","28960","49200 > 33947 [SYN, ACK] Seq=0 Ack=1 Win=28960 Len=0 MSS=1460 SACK_PERM=1 TSval=4226904 TSecr=127201307 WS=128"
"4","12.242252s","0.000028s","192.168.0.41","192.168.0.42","TCP","66","1","1","","29312","33947 > 49200 [ACK] Seq=1 Ack=1 Win=29312 Len=0 TSval=127201307 TSecr=4226904"
"5","12.242277s","0.000025s","192.168.0.41","192.168.0.42","TCP","1514","1","1","1448","29312","33947 > 49200 [ACK] Seq=1 Ack=1 Win=29312 Len=1448 TSval=127201307 TSecr=4226904"
"6","12.242292s","0.000015s","192.168.0.41","192.168.0.42","TCP","1514","1449","1","2896","29312","33947 > 49200 [ACK] Seq=1449 Ack=1 Win=29312 Len=1448 TSval=127201307 TSecr=4226904"
"7","12.242306s","0.000014s","192.168.0.41","192.168.0.42","TCP","1514","2897","1","4344","29312","33947 > 49200 [ACK] Seq=2897 Ack=1 Win=29312 Len=1448 TSval=127201307 TSecr=4226904"
"8","12.242321s","0.000015s","192.168.0.41","192.168.0.42","TCP","1514","4345","1","5792","29312","33947 > 49200 [ACK] Seq=4345 Ack=1 Win=29312 Len=1448 TSval=127201307 TSecr=4226904"
"9","12.242335s","0.000014s","192.168.0.41","192.168.0.42","TCP","1514","5793","1","7240","29312","33947 > 49200 [ACK] Seq=5793 Ack=1 Win=29312 Len=1448 TSval=127201307 TSecr=4226904"
"10","12.242349s","0.000014s","192.168.0.41","192.168.0.42","TCP","1514","7241","1","8688","29312","33947 > 49200 [ACK] Seq=7241 Ack=1 Win=29312 Len=1448 TSval=127201307 TSecr=4226904"
"11","12.242362s","0.000013s","192.168.0.41","192.168.0.42","TCP","1514","8689","1","10136","29312","33947 > 49200 [ACK] Seq=8689 Ack=1 Win=29312 Len=1448 TSval=127201307 TSecr=4226904"
"12","12.242376s","0.000014s","192.168.0.41","192.168.0.42","TCP","1514","10137","1","11584","29312","33947 > 49200 [ACK] Seq=10137 Ack=1 Win=29312 Len=1448 TSval=127201307 TSecr=4226904"
"13","12.242390s","0.000014s","192.168.0.41","192.168.0.42","TCP","1514","11585","1","13032","29312","33947 > 49200 [ACK] Seq=11585 Ack=1 Win=29312 Len=1448 TSval=127201307 TSecr=4226904"
"14","12.242403s","0.000013s","192.168.0.41","192.168.0.42","TCP","1514","13033","1","14480","29312","33947 > 49200 [ACK] Seq=13033 Ack=1 Win=29312 Len=1448 TSval=127201307 TSecr=4226904"
"15","12.242495s","0.000092s","192.168.0.42","192.168.0.41","TCP","66","1","1449","","31872","49200 > 33947 [ACK] Seq=1 Ack=1449 Win=31872 Len=0 TSval=4226904 TSecr=127201307"
"16","12.242510s","0.000015s","192.168.0.41","192.168.0.42","TCP","1514","14481","1","14480","29312","33947 > 49200 [PSH, ACK] Seq=14481 Ack=1 Win=29312 Len=1448 TSval=127201307 TSecr=4226904"
"17","12.242514s","0.000004s","192.168.0.41","192.168.0.42","TCP","1514","15929","1","15928","29312","33947 > 49200 [ACK] Seq=15929 Ack=1 Win=29312 Len=1448 TSval=127201307 TSecr=4226904"
"18","12.242519s","0.000005s","192.168.0.42","192.168.0.41","TCP","66","1","2897","","34816","49200 > 33947 [ACK] Seq=1 Ack=2897 Win=34816 Len=0 TSval=4226904 TSecr=127201307"
"19","12.242525s","0.000006s","192.168.0.41","192.168.0.42","TCP","1514","17377","1","15928","29312","33947 > 49200 [ACK] Seq=17377 Ack=1 Win=29312 Len=1448 TSval=127201307 TSecr=4226904"
"20","12.242528s","0.000003s","192.168.0.41","192.168.0.42","TCP","1514","18825","1","17376","29312","33947 > 49200 [ACK] Seq=18825 Ack=1 Win=29312 Len=1448 TSval=127201307 TSecr=4226904"
"21","12.242531s","0.000003s","192.168.0.42","192.168.0.41","TCP","66","1","4345","","37760","49200 > 33947 [ACK] Seq=1 Ack=4345 Win=37760 Len=0 TSval=4226904 TSecr=127201307"
"22","12.242537s","0.000006s","192.168.0.41","192.168.0.42","TCP","1514","20273","1","17376","29312","33947 > 49200 [ACK] Seq=20273 Ack=1 Win=29312 Len=1448 TSval=127201307 TSecr=4226904"
"23","12.242540s","0.000003s","192.168.0.41","192.168.0.42","TCP","1514","21721","1","18824","29312","33947 > 49200 [ACK] Seq=21721 Ack=1 Win=29312 Len=1448 TSval=127201307 TSecr=4226904"
"24","12.242543s","0.000003s","192.168.0.42","192.168.0.41","TCP","66","1","5793","","40576","49200 > 33947 [ACK] Seq=1 Ack=5793 Win=40576 Len=0 TSval=4226904 TSecr=127201307"
"25","12.242548s","0.000005s","192.168.0.41","192.168.0.42","TCP","1514","23169","1","18824","29312","33947 > 49200 [ACK] Seq=23169 Ack=1 Win=29312 Len=1448 TSval=127201307 TSecr=4226904"
"26","12.242551s","0.000003s","192.168.0.41","192.168.0.42","TCP","1514","24617","1","20272","29312","33947 > 49200 [ACK] Seq=24617 Ack=1 Win=29312 Len=1448 TSval=127201307 TSecr=4226904"
"27","12.242555s","0.000004s","192.168.0.42","192.168.0.41","TCP","66","1","7241","","43520","49200 > 33947 [ACK] Seq=1 Ack=7241 Win=43520 Len=0 TSval=4226904 TSecr=127201307"
"28","12.242559s","0.000004s","192.168.0.41","192.168.0.42","TCP","1514","26065","1","20272","29312","33947 > 49200 [ACK] Seq=26065 Ack=1 Win=29312 Len=1448 TSval=127201307 TSecr=4226904"
"29","12.242563s","0.000004s","192.168.0.41","192.168.0.42","TCP","1514","27513","1","21720","29312","33947 > 49200 [PSH, ACK] Seq=27513 Ack=1 Win=29312 Len=1448 TSval=127201307 TSecr=4226904"
"30","12.242566s","0.000003s","192.168.0.42","192.168.0.41","TCP","66","1","8689","","46336","49200 > 33947 [ACK] Seq=1 Ack=8689 Win=46336 Len=0 TSval=4226904 TSecr=127201307"
"31","12.242574s","0.000008s","192.168.0.42","192.168.0.41","TCP","66","1","10137","","49280","49200 > 33947 [ACK] Seq=1 Ack=10137 Win=49280 Len=0 TSval=4226904 TSecr=127201307"
"32","12.242579s","0.000005s","192.168.0.42","192.168.0.41","TCP","66","1","11585","","52224","49200 > 33947 [ACK] Seq=1 Ack=11585 Win=52224 Len=0 TSval=4226904 TSecr=127201307"
"33","12.242583s","0.000004s","192.168.0.42","192.168.0.41","TCP","66","1","13033","","55040","49200 > 33947 [ACK] Seq=1 Ack=13033 Win=55040 Len=0 TSval=4226904 TSecr=127201307"
"34","12.242585s","0.000002s","192.168.0.41","192.168.0.42","TCP","1514","28961","1","17376","29312","33947 > 49200 [ACK] Seq=28961 Ack=1 Win=29312 Len=1448 TSval=127201307 TSecr=4226904"
"35","12.242586s","0.000001s","192.168.0.42","192.168.0.41","TCP","66","1","14481","","57984","49200 > 33947 [ACK] Seq=1 Ack=14481 Win=57984 Len=0 TSval=4226904 TSecr=127201307"
"36","12.242595s","0.000009s","192.168.0.41","192.168.0.42","TCP","1514","30409","1","17376","29312","33947 > 49200 [ACK] Seq=30409 Ack=1 Win=29312 Len=1448 TSval=127201307 TSecr=4226904"
"37","12.242633s","0.000038s","192.168.0.42","192.168.0.41","TCP","66","1","14481","","57984","49200 > 33947 [FIN, ACK] Seq=1 Ack=14481 Win=57984 Len=0 TSval=4226904 TSecr=127201307"
"38","12.242640s","0.000007s","192.168.0.41","192.168.0.42","TCP","1514","31857","1","18824","29312","33947 > 49200 [ACK] Seq=31857 Ack=1 Win=29312 Len=1448 TSval=127201307 TSecr=4226904"
"39","12.242645s","0.000005s","192.168.0.41","192.168.0.42","TCP","1514","33305","1","20272","29312","33947 > 49200 [ACK] Seq=33305 Ack=1 Win=29312 Len=1448 TSval=127201307 TSecr=4226904"
"40","12.242657s","0.000012s","192.168.0.41","192.168.0.42","TCP","1514","34753","1","21720","29312","33947 > 49200 [ACK] Seq=34753 Ack=1 Win=29312 Len=1448 TSval=127201307 TSecr=4226904"
"41","12.242667s","0.000010s","192.168.0.41","192.168.0.42","TCP","1514","36201","1","23168","29312","33947 > 49200 [ACK] Seq=36201 Ack=1 Win=29312 Len=1448 TSval=127201307 TSecr=4226904"
"42","12.242679s","0.000012s","192.168.0.41","192.168.0.42","TCP","1514","37649","1","24616","29312","33947 > 49200 [ACK] Seq=37649 Ack=1 Win=29312 Len=1448 TSval=127201307 TSecr=4226904"
"43","12.242686s","0.000007s","192.168.0.41","192.168.0.42","TCP","1514","39097","1","26064","29312","33947 > 49200 [ACK] Seq=39097 Ack=1 Win=29312 Len=1448 TSval=127201307 TSecr=4226904"
"44","12.242698s","0.000012s","192.168.0.41","192.168.0.42","TCP","1514","40545","1","27512","29312","33947 > 49200 [ACK] Seq=40545 Ack=1 Win=29312 Len=1448 TSval=127201307 TSecr=4226904"
"45","12.242707s","0.000009s","192.168.0.41","192.168.0.42","TCP","1514","41993","1","28960","29312","33947 > 49200 [ACK] Seq=41993 Ack=1 Win=29312 Len=1448 TSval=127201307 TSecr=4226904"
"46","12.242715s","0.000008s","192.168.0.42","192.168.0.41","TCP","66","2","15929","","60928","49200 > 33947 [ACK] Seq=2 Ack=15929 Win=60928 Len=0 TSval=4226904 TSecr=127201307"
"47","12.242720s","0.000005s","192.168.0.42","192.168.0.41","TCP","66","2","17377","","63744","49200 > 33947 [ACK] Seq=2 Ack=17377 Win=63744 Len=0 TSval=4226904 TSecr=127201307"
"48","12.242724s","0.000004s","192.168.0.42","192.168.0.41","TCP","66","2","18825","","66688","49200 > 33947 [ACK] Seq=2 Ack=18825 Win=66688 Len=0 TSval=4226904 TSecr=127201307"
"49","12.242727s","0.000003s","192.168.0.42","192.168.0.41","TCP","66","2","20273","","69504","49200 > 33947 [ACK] Seq=2 Ack=20273 Win=69504 Len=0 TSval=4226904 TSecr=127201307"
"50","12.242730s","0.000003s","192.168.0.42","192.168.0.41","TCP","66","2","21721","","72448","49200 > 33947 [ACK] Seq=2 Ack=21721 Win=72448 Len=0 TSval=4226904 TSecr=127201307"
"51","12.242734s","0.000004s","192.168.0.41","192.168.0.42","TCP","1514","43441","2","23168","29312","33947 > 49200 [ACK] Seq=43441 Ack=2 Win=29312 Len=1448 TSval=127201307 TSecr=4226904"
"52","12.242740s","0.000006s","192.168.0.41","192.168.0.42","TCP","1514","44889","2","24616","29312","33947 > 49200 [ACK] Seq=44889 Ack=2 Win=29312 Len=1448 TSval=127201307 TSecr=4226904"
"53","12.242755s","0.000015s","192.168.0.41","192.168.0.42","TCP","1514","46337","2","26064","29312","33947 > 49200 [ACK] Seq=46337 Ack=2 Win=29312 Len=1448 TSval=127201307 TSecr=4226904"
"54","12.242763s","0.000008s","192.168.0.41","192.168.0.42","TCP","1514","47785","2","27512","29312","33947 > 49200 [ACK] Seq=47785 Ack=2 Win=29312 Len=1448 TSval=127201307 TSecr=4226904"
"55","12.242763s","0.000000s","192.168.0.42","192.168.0.41","TCP","66","2","23169","","75392","49200 > 33947 [ACK] Seq=2 Ack=23169 Win=75392 Len=0 TSval=4226904 TSecr=127201307"
"56","12.242768s","0.000005s","192.168.0.42","192.168.0.41","TCP","66","2","24617","","78208","49200 > 33947 [ACK] Seq=2 Ack=24617 Win=78208 Len=0 TSval=4226904 TSecr=127201307"
"57","12.242773s","0.000005s","192.168.0.41","192.168.0.42","TCP","1514","49233","2","26064","29312","33947 > 49200 [ACK] Seq=49233 Ack=2 Win=29312 Len=1448 TSval=127201307 TSecr=4226904"
"58","12.242780s","0.000007s","192.168.0.41","192.168.0.42","TCP","1514","50681","2","27512","29312","33947 > 49200 [ACK] Seq=50681 Ack=2 Win=29312 Len=1448 TSval=127201307 TSecr=4226904"
"59","12.242795s","0.000015s","192.168.0.41","192.168.0.42","TCP","1514","52129","2","28960","29312","33947 > 49200 [PSH, ACK] Seq=52129 Ack=2 Win=29312 Len=1448 TSval=127201307 TSecr=4226904"
"60","12.242803s","0.000008s","192.168.0.41","192.168.0.42","TCP","1514","53577","2","30408","29312","33947 > 49200 [PSH, ACK] Seq=53577 Ack=2 Win=29312 Len=1448 TSval=127201307 TSecr=4226904"
"61","12.242813s","0.000010s","192.168.0.41","192.168.0.42","TCP","1514","55025","2","31856","29312","33947 > 49200 [ACK] Seq=55025 Ack=2 Win=29312 Len=1448 TSval=127201307 TSecr=4226904"
"62","12.242823s","0.000010s","192.168.0.41","192.168.0.42","TCP","1514","56473","2","33304","29312","33947 > 49200 [ACK] Seq=56473 Ack=2 Win=29312 Len=1448 TSval=127201307 TSecr=4226904"
"63","12.242840s","0.000017s","192.168.0.41","192.168.0.42","TCP","1514","57921","2","34752","29312","33947 > 49200 [ACK] Seq=57921 Ack=2 Win=29312 Len=1448 TSval=127201307 TSecr=4226904"
"64","12.242849s","0.000009s","192.168.0.41","192.168.0.42","TCP","1514","59369","2","36200","29312","33947 > 49200 [PSH, ACK] Seq=59369 Ack=2 Win=29312 Len=1448 TSval=127201307 TSecr=4226904"
"65","12.242864s","0.000015s","192.168.0.41","192.168.0.42","TCP","1514","60817","2","37648","29312","33947 > 49200 [ACK] Seq=60817 Ack=2 Win=29312 Len=1448 TSval=127201307 TSecr=4226904"
"66","12.242876s","0.000012s","192.168.0.41","192.168.0.42","TCP","1514","62265","2","39096","29312","33947 > 49200 [ACK] Seq=62265 Ack=2 Win=29312 Len=1448 TSval=127201307 TSecr=4226904"
"67","12.242954s","0.000078s","192.168.0.42","192.168.0.41","TCP","66","2","26065","","81152","49200 > 33947 [ACK] Seq=2 Ack=26065 Win=81152 Len=0 TSval=4226904 TSecr=127201307"
"68","12.242964s","0.000010s","192.168.0.41","192.168.0.42","TCP","1514","63713","2","39096","29312","33947 > 49200 [ACK] Seq=63713 Ack=2 Win=29312 Len=1448 TSval=127201307 TSecr=4226904"
"69","12.242968s","0.000004s","192.168.0.41","192.168.0.42","TCP","1514","65161","2","40544","29312","33947 > 49200 [ACK] Seq=65161 Ack=2 Win=29312 Len=1448 TSval=127201307 TSecr=4226904"
"70","12.242972s","0.000004s","192.168.0.42","192.168.0.41","TCP","66","2","27513","","84096","49200 > 33947 [ACK] Seq=2 Ack=27513 Win=84096 Len=0 TSval=4226904 TSecr=127201307"
"71","12.242978s","0.000006s","192.168.0.41","192.168.0.42","TCP","1514","66609","2","40544","29312","33947 > 49200 [ACK] Seq=66609 Ack=2 Win=29312 Len=1448 TSval=127201307 TSecr=4226904"
"72","12.242981s","0.000003s","192.168.0.41","192.168.0.42","TCP","1514","68057","2","41992","29312","33947 > 49200 [ACK] Seq=68057 Ack=2 Win=29312 Len=1448 TSval=127201307 TSecr=4226904"
"73","12.242984s","0.000003s","192.168.0.42","192.168.0.41","TCP","66","2","28961","","86912","49200 > 33947 [ACK] Seq=2 Ack=28961 Win=86912 Len=0 TSval=4226904 TSecr=127201307"
"74","12.242989s","0.000005s","192.168.0.41","192.168.0.42","TCP","1514","69505","2","41992","29312","33947 > 49200 [ACK] Seq=69505 Ack=2 Win=29312 Len=1448 TSval=127201307 TSecr=4226904"
"75","12.242992s","0.000003s","192.168.0.41","192.168.0.42","TCP","1514","70953","2","43440","29312","33947 > 49200 [ACK] Seq=70953 Ack=2 Win=29312 Len=1448 TSval=127201307 TSecr=4226904"
"76","12.242996s","0.000004s","192.168.0.42","192.168.0.41","TCP","66","2","30409","","89856","49200 > 33947 [ACK] Seq=2 Ack=30409 Win=89856 Len=0 TSval=4226904 TSecr=127201307"
"77","12.243001s","0.000005s","192.168.0.41","192.168.0.42","TCP","1514","72401","2","43440","29312","33947 > 49200 [ACK] Seq=72401 Ack=2 Win=29312 Len=1448 TSval=127201307 TSecr=4226904"
"78","12.243004s","0.000003s","192.168.0.41","192.168.0.42","TCP","1514","73849","2","44888","29312","33947 > 49200 [ACK] Seq=73849 Ack=2 Win=29312 Len=1448 TSval=127201307 TSecr=4226904"
"79","12.243008s","0.000004s","192.168.0.42","192.168.0.41","TCP","66","2","31857","","92672","49200 > 33947 [ACK] Seq=2 Ack=31857 Win=92672 Len=0 TSval=4226904 TSecr=127201307"
"80","12.243012s","0.000004s","192.168.0.41","192.168.0.42","TCP","1514","75297","2","44888","29312","33947 > 49200 [ACK] Seq=75297 Ack=2 Win=29312 Len=1448 TSval=127201307 TSecr=4226904"
"81","12.243015s","0.000003s","192.168.0.41","192.168.0.42","TCP","1514","76745","2","46336","29312","33947 > 49200 [ACK] Seq=76745 Ack=2 Win=29312 Len=1448 TSval=127201307 TSecr=4226904"
"82","12.243018s","0.000003s","192.168.0.42","192.168.0.41","TCP","66","2","33305","","95616","49200 > 33947 [ACK] Seq=2 Ack=33305 Win=95616 Len=0 TSval=4226904 TSecr=127201307"
"83","12.243023s","0.000005s","192.168.0.41","192.168.0.42","TCP","1514","78193","2","46336","29312","33947 > 49200 [ACK] Seq=78193 Ack=2 Win=29312 Len=1448 TSval=127201307 TSecr=4226904"
"84","12.243026s","0.000003s","192.168.0.41","192.168.0.42","TCP","1514","79641","2","47784","29312","33947 > 49200 [ACK] Seq=79641 Ack=2 Win=29312 Len=1448 TSval=127201307 TSecr=4226904"
"85","12.243029s","0.000003s","192.168.0.42","192.168.0.41","TCP","66","2","34753","","98560","49200 > 33947 [ACK] Seq=2 Ack=34753 Win=98560 Len=0 TSval=4226904 TSecr=127201307"
"86","12.243034s","0.000005s","192.168.0.41","192.168.0.42","TCP","1514","81089","2","47784","29312","33947 > 49200 [ACK] Seq=81089 Ack=2 Win=29312 Len=1448 TSval=127201307 TSecr=4226904"
"87","12.243037s","0.000003s","192.168.0.41","192.168.0.42","TCP","1514","82537","2","49232","29312","33947 > 49200 [ACK] Seq=82537 Ack=2 Win=29312 Len=1448 TSval=127201307 TSecr=4226904"
"88","12.243041s","0.000004s","192.168.0.42","192.168.0.41","TCP","66","2","36201","","101376","49200 > 33947 [ACK] Seq=2 Ack=36201 Win=101376 Len=0 TSval=4226904 TSecr=127201307"
"89","12.243046s","0.000005s","192.168.0.41","192.168.0.42","TCP","1514","83985","2","49232","29312","33947 > 49200 [ACK] Seq=83985 Ack=2 Win=29312 Len=1448 TSval=127201307 TSecr=4226904"
"90","12.243050s","0.000004s","192.168.0.42","192.168.0.41","TCP","66","2","37649","","104320","49200 > 33947 [ACK] Seq=2 Ack=37649 Win=104320 Len=0 TSval=4226904 TSecr=127201307"
"91","12.243055s","0.000005s","192.168.0.41","192.168.0.42","TCP","1514","85433","2","49232","29312","33947 > 49200 [ACK] Seq=85433 Ack=2 Win=29312 Len=1448 TSval=127201307 TSecr=4226904"
"92","12.243059s","0.000004s","192.168.0.42","192.168.0.41","TCP","66","2","39097","","107264","49200 > 33947 [ACK] Seq=2 Ack=39097 Win=107264 Len=0 TSval=4226904 TSecr=127201307"
"93","12.243064s","0.000005s","192.168.0.41","192.168.0.42","TCP","1514","86881","2","49232","29312","33947 > 49200 [ACK] Seq=86881 Ack=2 Win=29312 Len=1448 TSval=127201307 TSecr=4226904"
"94","12.243068s","0.000004s","192.168.0.42","192.168.0.41","TCP","66","2","40545","","110080","49200 > 33947 [ACK] Seq=2 Ack=40545 Win=110080 Len=0 TSval=4226904 TSecr=127201307"
"95","12.243073s","0.000005s","192.168.0.41","192.168.0.42","TCP","1514","88329","2","49232","29312","33947 > 49200 [ACK] Seq=88329 Ack=2 Win=29312 Len=1448 TSval=127201307 TSecr=4226904"
"96","12.243077s","0.000004s","192.168.0.42","192.168.0.41","TCP","66","2","41993","","113024","49200 > 33947 [ACK] Seq=2 Ack=41993 Win=113024 Len=0 TSval=4226904 TSecr=127201307"
"97","12.243082s","0.000005s","192.168.0.41","192.168.0.42","TCP","1514","89777","2","49232","29312","33947 > 49200 [ACK] Seq=89777 Ack=2 Win=29312 Len=1448 TSval=127201307 TSecr=4226904"
"98","12.243086s","0.000004s","192.168.0.42","192.168.0.41","TCP","66","2","43441","","115840","49200 > 33947 [ACK] Seq=2 Ack=43441 Win=115840 Len=0 TSval=4226904 TSecr=127201307"
"99","12.243091s","0.000005s","192.168.0.41","192.168.0.42","TCP","1514","91225","2","49232","29312","33947 > 49200 [ACK] Seq=91225 Ack=2 Win=29312 Len=1448 TSval=127201307 TSecr=4226904"
"100","12.243095s","0.000004s","192.168.0.42","192.168.0.41","TCP","66","2","44889","","118784","49200 > 33947 [ACK] Seq=2 Ack=44889 Win=118784 Len=0 TSval=4226904 TSecr=127201307"
"101","12.243100s","0.000005s","192.168.0.41","192.168.0.42","TCP","1514","92673","2","49232","29312","33947 > 49200 [ACK] Seq=92673 Ack=2 Win=29312 Len=1448 TSval=127201307 TSecr=4226904"
"102","12.243103s","0.000003s","192.168.0.42","192.168.0.41","TCP","66","2","46337","","121728","49200 > 33947 [ACK] Seq=2 Ack=46337 Win=121728 Len=0 TSval=4226904 TSecr=127201307"
"103","12.243108s","0.000005s","192.168.0.41","192.168.0.42","TCP","1514","94121","2","49232","29312","33947 > 49200 [ACK] Seq=94121 Ack=2 Win=29312 Len=1448 TSval=127201307 TSecr=4226904"
"104","12.243112s","0.000004s","192.168.0.42","192.168.0.41","TCP","66","2","47785","","124544","49200 > 33947 [ACK] Seq=2 Ack=47785 Win=124544 Len=0 TSval=4226904 TSecr=127201307"
"105","12.243117s","0.000005s","192.168.0.41","192.168.0.42","TCP","1514","95569","2","49232","29312","33947 > 49200 [ACK] Seq=95569 Ack=2 Win=29312 Len=1448 TSval=127201307 TSecr=4226904"
"106","12.243123s","0.000006s","192.168.0.42","192.168.0.41","TCP","66","2","49233","","127488","49200 > 33947 [ACK] Seq=2 Ack=49233 Win=127488 Len=0 TSval=4226904 TSecr=127201307"
"107","12.243127s","0.000004s","192.168.0.41","192.168.0.42","TCP","1514","97017","2","49232","29312","33947 > 49200 [ACK] Seq=97017 Ack=2 Win=29312 Len=1448 TSval=127201307 TSecr=4226904"
"108","12.243132s","0.000005s","192.168.0.42","192.168.0.41","TCP","66","2","50681","","130432","49200 > 33947 [ACK] Seq=2 Ack=50681 Win=130432 Len=0 TSval=4226904 TSecr=127201307"
"109","12.243137s","0.000005s","192.168.0.41","192.168.0.42","TCP","1514","98465","2","49232","29312","33947 > 49200 [ACK] Seq=98465 Ack=2 Win=29312 Len=1448 TSval=127201307 TSecr=4226904"
"110","12.243140s","0.000003s","192.168.0.41","192.168.0.42","TCP","1514","99913","2","50680","29312","33947 > 49200 [PSH, ACK] Seq=99913 Ack=2 Win=29312 Len=1448 TSval=127201307 TSecr=4226904"
"111","12.243147s","0.000007s","192.168.0.42","192.168.0.41","TCP","66","2","52129","","133248","49200 > 33947 [ACK] Seq=2 Ack=52129 Win=133248 Len=0 TSval=4226904 TSecr=127201307"
"112","12.243153s","0.000006s","192.168.0.42","192.168.0.41","TCP","66","2","53577","","136192","49200 > 33947 [ACK] Seq=2 Ack=53577 Win=136192 Len=0 TSval=4226904 TSecr=127201307"
"113","12.243156s","0.000003s","192.168.0.42","192.168.0.41","TCP","66","2","55025","","139008","49200 > 33947 [ACK] Seq=2 Ack=55025 Win=139008 Len=0 TSval=4226904 TSecr=127201307"
"114","12.243158s","0.000002s","192.168.0.42","192.168.0.41","TCP","66","2","56473","","141952","49200 > 33947 [ACK] Seq=2 Ack=56473 Win=141952 Len=0 TSval=4226904 TSecr=127201307"
"115","12.243161s","0.000003s","192.168.0.42","192.168.0.41","TCP","66","2","57921","","144896","49200 > 33947 [ACK] Seq=2 Ack=57921 Win=144896 Len=0 TSval=4226904 TSecr=127201307"
"116","12.243164s","0.000003s","192.168.0.42","192.168.0.41","TCP","66","2","59369","","147712","49200 > 33947 [ACK] Seq=2 Ack=59369 Win=147712 Len=0 TSval=4226904 TSecr=127201307"
"117","12.243167s","0.000003s","192.168.0.42","192.168.0.41","TCP","66","2","60817","","150656","49200 > 33947 [ACK] Seq=2 Ack=60817 Win=150656 Len=0 TSval=4226904 TSecr=127201307"
"118","12.243170s","0.000003s","192.168.0.42","192.168.0.41","TCP","66","2","62265","","153600","49200 > 33947 [ACK] Seq=2 Ack=62265 Win=153600 Len=0 TSval=4226904 TSecr=127201307"
"119","12.243173s","0.000003s","192.168.0.42","192.168.0.41","TCP","66","2","63713","","156416","49200 > 33947 [ACK] Seq=2 Ack=63713 Win=156416 Len=0 TSval=4226904 TSecr=127201307"
"120","12.243177s","0.000004s","192.168.0.42","192.168.0.41","TCP","66","2","65161","","159360","49200 > 33947 [ACK] Seq=2 Ack=65161 Win=159360 Len=0 TSval=4226904 TSecr=127201307"
"121","12.243180s","0.000003s","192.168.0.42","192.168.0.41","TCP","66","2","66609","","160128","49200 > 33947 [ACK] Seq=2 Ack=66609 Win=160128 Len=0 TSval=4226904 TSecr=127201307"
"122","12.243183s","0.000003s","192.168.0.42","192.168.0.41","TCP","66","2","68057","","159104","49200 > 33947 [ACK] Seq=2 Ack=68057 Win=159104 Len=0 TSval=4226904 TSecr=127201307"
"123","12.243193s","0.000010s","192.168.0.41","192.168.0.42","TCP","1514","101361","2","34752","29312","33947 > 49200 [PSH, ACK] Seq=101361 Ack=2 Win=29312 Len=1448 TSval=127201307 TSecr=4226904"
"124","12.243205s","0.000012s","192.168.0.41","192.168.0.42","TCP","1514","102809","2","36200","29312","33947 > 49200 [ACK] Seq=102809 Ack=2 Win=29312 Len=1448 TSval=127201307 TSecr=4226904"
"125","12.243220s","0.000015s","192.168.0.41","192.168.0.42","TCP","1514","104257","2","37648","29312","33947 > 49200 [ACK] Seq=104257 Ack=2 Win=29312 Len=1448 TSval=127201307 TSecr=4226904"
"126","12.243232s","0.000012s","192.168.0.41","192.168.0.42","TCP","1514","105705","2","39096","29312","33947 > 49200 [ACK] Seq=105705 Ack=2 Win=29312 Len=1448 TSval=127201307 TSecr=4226904"
"127","12.243238s","0.000006s","192.168.0.42","192.168.0.41","TCP","66","2","69505","","158208","49200 > 33947 [ACK] Seq=2 Ack=69505 Win=158208 Len=0 TSval=4226904 TSecr=127201307"
"128","12.243243s","0.000005s","192.168.0.41","192.168.0.42","TCP","1514","107153","2","39096","29312","33947 > 49200 [ACK] Seq=107153 Ack=2 Win=29312 Len=1448 TSval=127201307 TSecr=4226904"
"129","12.243243s","0.000000s","192.168.0.42","192.168.0.41","TCP","66","2","70953","","157184","49200 > 33947 [ACK] Seq=2 Ack=70953 Win=157184 Len=0 TSval=4226904 TSecr=127201307"
"130","12.243247s","0.000004s","192.168.0.42","192.168.0.41","TCP","66","2","72401","","156288","49200 > 33947 [ACK] Seq=2 Ack=72401 Win=156288 Len=0 TSval=4226904 TSecr=127201307"
"131","12.243250s","0.000003s","192.168.0.42","192.168.0.41","TCP","66","2","73849","","155264","49200 > 33947 [ACK] Seq=2 Ack=73849 Win=155264 Len=0 TSval=4226904 TSecr=127201307"
"132","12.243252s","0.000002s","192.168.0.41","192.168.0.42","TCP","1514","108601","2","36200","29312","33947 > 49200 [ACK] Seq=108601 Ack=2 Win=29312 Len=1448 TSval=127201307 TSecr=4226904"
"133","12.243263s","0.000011s","192.168.0.41","192.168.0.42","TCP","1514","110049","2","37648","29312","33947 > 49200 [ACK] Seq=110049 Ack=2 Win=29312 Len=1448 TSval=127201307 TSecr=4226904"
"134","12.243277s","0.000014s","192.168.0.41","192.168.0.42","TCP","1514","111497","2","39096","29312","33947 > 49200 [ACK] Seq=111497 Ack=2 Win=29312 Len=1448 TSval=127201307 TSecr=4226904"
"135","12.243286s","0.000009s","192.168.0.41","192.168.0.42","TCP","1514","112945","2","40544","29312","33947 > 49200 [ACK] Seq=112945 Ack=2 Win=29312 Len=1448 TSval=127201307 TSecr=4226904"
"136","12.243292s","0.000006s","192.168.0.41","192.168.0.42","TCP","1514","114393","2","41992","29312","33947 > 49200 [ACK] Seq=114393 Ack=2 Win=29312 Len=1448 TSval=127201307 TSecr=4226904"
"137","12.243300s","0.000008s","192.168.0.41","192.168.0.42","TCP","1514","115841","2","43440","29312","33947 > 49200 [ACK] Seq=115841 Ack=2 Win=29312 Len=1448 TSval=127201307 TSecr=4226904"
"138","12.243304s","0.000004s","192.168.0.41","192.168.0.42","TCP","1514","117289","2","44888","29312","33947 > 49200 [ACK] Seq=117289 Ack=2 Win=29312 Len=1448 TSval=127201307 TSecr=4226904"
"139","12.243312s","0.000008s","192.168.0.41","192.168.0.42","TCP","1514","118737","2","46336","29312","33947 > 49200 [ACK] Seq=118737 Ack=2 Win=29312 Len=1448 TSval=127201307 TSecr=4226904"
"140","12.243319s","0.000007s","192.168.0.41","192.168.0.42","TCP","1514","120185","2","47784","29312","33947 > 49200 [ACK] Seq=120185 Ack=2 Win=29312 Len=1448 TSval=127201307 TSecr=4226904"
"141","12.243326s","0.000007s","192.168.0.41","192.168.0.42","TCP","1514","121633","2","49232","29312","33947 > 49200 [ACK] Seq=121633 Ack=2 Win=29312 Len=1448 TSval=127201307 TSecr=4226904"
"142","12.243332s","0.000006s","192.168.0.41","192.168.0.42","TCP","1514","123081","2","50680","29312","33947 > 49200 [ACK] Seq=123081 Ack=2 Win=29312 Len=1448 TSval=127201307 TSecr=4226904"
"143","12.243341s","0.000009s","192.168.0.41","192.168.0.42","TCP","1514","124529","2","52128","29312","33947 > 49200 [ACK] Seq=124529 Ack=2 Win=29312 Len=1448 TSval=127201307 TSecr=4226904"
"144","12.243444s","0.000103s","192.168.0.42","192.168.0.41","TCP","66","2","75297","","154368","49200 > 33947 [ACK] Seq=2 Ack=75297 Win=154368 Len=0 TSval=4226904 TSecr=127201307"
"145","12.243454s","0.000010s","192.168.0.41","192.168.0.42","TCP","1514","125977","2","52128","29312","33947 > 49200 [ACK] Seq=125977 Ack=2 Win=29312 Len=1448 TSval=127201307 TSecr=4226904"
"146","12.243459s","0.000005s","192.168.0.42","192.168.0.41","TCP","66","2","76745","","153344","49200 > 33947 [ACK] Seq=2 Ack=76745 Win=153344 Len=0 TSval=4226904 TSecr=127201307"
"147","12.243464s","0.000005s","192.168.0.41","192.168.0.42","TCP","1514","127425","2","52128","29312","33947 > 49200 [PSH, ACK] Seq=127425 Ack=2 Win=29312 Len=1448 TSval=127201307 TSecr=4226904"
"148","12.243469s","0.000005s","192.168.0.42","192.168.0.41","TCP","66","2","78193","","152448","49200 > 33947 [ACK] Seq=2 Ack=78193 Win=152448 Len=0 TSval=4226904 TSecr=127201307"
"149","12.243473s","0.000004s","192.168.0.41","192.168.0.42","TCP","1514","128873","2","52128","29312","33947 > 49200 [ACK] Seq=128873 Ack=2 Win=29312 Len=1448 TSval=127201307 TSecr=4226904"
"150","12.243486s","0.000013s","192.168.0.42","192.168.0.41","TCP","66","2","83985","","148480","49200 > 33947 [ACK] Seq=2 Ack=83985 Win=148480 Len=0 TSval=4226904 TSecr=127201307"
"151","12.243492s","0.000006s","192.168.0.41","192.168.0.42","TCP","1514","130321","2","47784","29312","33947 > 49200 [ACK] Seq=130321 Ack=2 Win=29312 Len=1448 TSval=127201307 TSecr=4226904"
"152","12.243496s","0.000004s","192.168.0.41","192.168.0.42","TCP","1514","131769","2","49232","29312","33947 > 49200 [ACK] Seq=131769 Ack=2 Win=29312 Len=1448 TSval=127201307 TSecr=4226904"
"153","12.243498s","0.000002s","192.168.0.41","192.168.0.42","TCP","1514","133217","2","50680","29312","33947 > 49200 [ACK] Seq=133217 Ack=2 Win=29312 Len=1448 TSval=127201307 TSecr=4226904"
"154","12.243501s","0.000003s","192.168.0.41","192.168.0.42","TCP","1514","134665","2","52128","29312","33947 > 49200 [ACK] Seq=134665 Ack=2 Win=29312 Len=1448 TSval=127201307 TSecr=4226904"
"155","12.243529s","0.000028s","192.168.0.42","192.168.0.41","TCP","66","2","95569","","158208","49200 > 33947 [ACK] Seq=2 Ack=95569 Win=158208 Len=0 TSval=4226904 TSecr=127201307"
"156","12.243537s","0.000008s","192.168.0.41","192.168.0.42","TCP","1514","136113","2","41992","29312","33947 > 49200 [ACK] Seq=136113 Ack=2 Win=29312 Len=1448 TSval=127201307 TSecr=4226904"
"157","12.243540s","0.000003s","192.168.0.41","192.168.0.42","TCP","1514","137561","2","43440","29312","33947 > 49200 [ACK] Seq=137561 Ack=2 Win=29312 Len=1448 TSval=127201307 TSecr=4226904"
"158","12.243556s","0.000016s","192.168.0.41","192.168.0.42","TCP","1514","139009","2","44888","29312","33947 > 49200 [ACK] Seq=139009 Ack=2 Win=29312 Len=1448 TSval=127201307 TSecr=4226904"
"159","12.243560s","0.000004s","192.168.0.41","192.168.0.42","TCP","1514","140457","2","46336","29312","33947 > 49200 [ACK] Seq=140457 Ack=2 Win=29312 Len=1448 TSval=127201308 TSecr=4226904"
"160","12.243563s","0.000003s","192.168.0.41","192.168.0.42","TCP","1514","141905","2","47784","29312","33947 > 49200 [ACK] Seq=141905 Ack=2 Win=29312 Len=1448 TSval=127201308 TSecr=4226904"
"161","12.243566s","0.000003s","192.168.0.41","192.168.0.42","TCP","1514","143353","2","49232","29312","33947 > 49200 [ACK] Seq=143353 Ack=2 Win=29312 Len=1448 TSval=127201308 TSecr=4226904"
"162","12.243569s","0.000003s","192.168.0.41","192.168.0.42","TCP","1514","144801","2","50680","29312","33947 > 49200 [ACK] Seq=144801 Ack=2 Win=29312 Len=1448 TSval=127201308 TSecr=4226904"
"163","12.243571s","0.000002s","192.168.0.41","192.168.0.42","TCP","1514","146249","2","52128","29312","33947 > 49200 [ACK] Seq=146249 Ack=2 Win=29312 Len=1448 TSval=127201308 TSecr=4226904"
"164","12.243589s","0.000018s","192.168.0.42","192.168.0.41","TCP","66","2","104257","","152448","49200 > 33947 [ACK] Seq=2 Ack=104257 Win=152448 Len=0 TSval=4226904 TSecr=127201307"
"165","12.243598s","0.000009s","192.168.0.41","192.168.0.42","TCP","1514","147697","2","44888","29312","33947 > 49200 [ACK] Seq=147697 Ack=2 Win=29312 Len=1448 TSval=127201308 TSecr=4226904"
"166","12.243602s","0.000004s","192.168.0.41","192.168.0.42","TCP","1514","149145","2","46336","29312","33947 > 49200 [ACK] Seq=149145 Ack=2 Win=29312 Len=1448 TSval=127201308 TSecr=4226904"
"167","12.243604s","0.000002s","192.168.0.41","192.168.0.42","TCP","1514","150593","2","47784","29312","33947 > 49200 [PSH, ACK] Seq=150593 Ack=2 Win=29312 Len=1448 TSval=127201308 TSecr=4226904"
"168","12.243611s","0.000007s","192.168.0.42","192.168.0.41","TCP","66","2","114393","","145536","49200 > 33947 [ACK] Seq=2 Ack=114393 Win=145536 Len=0 TSval=4226904 TSecr=127201307"
"169","12.243622s","0.000011s","192.168.0.41","192.168.0.42","TCP","1514","152041","2","39096","29312","33947 > 49200 [ACK] Seq=152041 Ack=2 Win=29312 Len=1448 TSval=127201308 TSecr=4226904"
"170","12.243631s","0.000009s","192.168.0.41","192.168.0.42","TCP","1514","153489","2","40544","29312","33947 > 49200 [ACK] Seq=153489 Ack=2 Win=29312 Len=1448 TSval=127201308 TSecr=4226904"
"171","12.243639s","0.000008s","192.168.0.41","192.168.0.42","TCP","1514","154937","2","41992","29312","33947 > 49200 [ACK] Seq=154937 Ack=2 Win=29312 Len=1448 TSval=127201308 TSecr=4226904"
"172","12.243643s","0.000004s","192.168.0.42","192.168.0.41","TCP","66","2","117289","","143616","49200 > 33947 [ACK] Seq=2 Ack=117289 Win=143616 Len=0 TSval=4226904 TSecr=127201307"
"173","12.243647s","0.000004s","192.168.0.41","192.168.0.42","TCP","1514","156385","2","40544","29312","33947 > 49200 [ACK] Seq=156385 Ack=2 Win=29312 Len=1448 TSval=127201308 TSecr=4226904"
"174","12.243728s","0.000081s","192.168.0.41","192.168.0.42","TCP","1514","157833","2","41992","29312","33947 > 49200 [ACK] Seq=157833 Ack=2 Win=29312 Len=1448 TSval=127201308 TSecr=4226904"
"175","12.243732s","0.000004s","192.168.0.42","192.168.0.41","TCP","66","2","125977","","162176","49200 > 33947 [ACK] Seq=2 Ack=125977 Win=162176 Len=0 TSval=4226905 TSecr=127201307"
"176","12.243734s","0.000002s","192.168.0.41","192.168.0.42","TCP","1514","159281","2","34752","29312","33947 > 49200 [ACK] Seq=159281 Ack=2 Win=29312 Len=1448 TSval=127201308 TSecr=4226904"
"177","12.243736s","0.000002s","192.168.0.42","192.168.0.41","TCP","66","2","127425","","165120","49200 > 33947 [ACK] Seq=2 Ack=127425 Win=165120 Len=0 TSval=4226905 TSecr=127201307"
"178","12.243738s","0.000002s","192.168.0.41","192.168.0.42","TCP","1514","160729","2","34752","29312","33947 > 49200 [ACK] Seq=160729 Ack=2 Win=29312 Len=1448 TSval=127201308 TSecr=4226904"
"179","12.243740s","0.000002s","192.168.0.42","192.168.0.41","TCP","66","2","128873","","168064","49200 > 33947 [ACK] Seq=2 Ack=128873 Win=168064 Len=0 TSval=4226905 TSecr=127201307"
"180","12.243743s","0.000003s","192.168.0.41","192.168.0.42","TCP","1514","162177","2","34752","29312","33947 > 49200 [ACK] Seq=162177 Ack=2 Win=29312 Len=1448 TSval=127201308 TSecr=4226904"
"181","12.243743s","0.000000s","192.168.0.42","192.168.0.41","TCP","66","2","130321","","170880","49200 > 33947 [ACK] Seq=2 Ack=130321 Win=170880 Len=0 TSval=4226905 TSecr=127201307"
"182","12.243747s","0.000004s","192.168.0.41","192.168.0.42","TCP","1514","163625","2","34752","29312","33947 > 49200 [ACK] Seq=163625 Ack=2 Win=29312 Len=1448 TSval=127201308 TSecr=4226904"
"183","12.243751s","0.000004s","192.168.0.41","192.168.0.42","TCP","1514","165073","2","36200","29312","33947 > 49200 [ACK] Seq=165073 Ack=2 Win=29312 Len=1448 TSval=127201308 TSecr=4226904"
"184","12.243755s","0.000004s","192.168.0.41","192.168.0.42","TCP","1514","166521","2","37648","29312","33947 > 49200 [ACK] Seq=166521 Ack=2 Win=29312 Len=1448 TSval=127201308 TSecr=4226904"
"185","12.243765s","0.000010s","192.168.0.41","192.168.0.42","TCP","1514","167969","2","39096","29312","33947 > 49200 [ACK] Seq=167969 Ack=2 Win=29312 Len=1448 TSval=127201308 TSecr=4226904"
"186","12.243771s","0.000006s","192.168.0.41","192.168.0.42","TCP","1514","169417","2","40544","29312","33947 > 49200 [ACK] Seq=169417 Ack=2 Win=29312 Len=1448 TSval=127201308 TSecr=4226904"
"187","12.243784s","0.000013s","192.168.0.41","192.168.0.42","TCP","1514","170865","2","41992","29312","33947 > 49200 [ACK] Seq=170865 Ack=2 Win=29312 Len=1448 TSval=127201308 TSecr=4226905"
"188","12.243787s","0.000003s","192.168.0.41","192.168.0.42","TCP","1514","172313","2","43440","29312","33947 > 49200 [ACK] Seq=172313 Ack=2 Win=29312 Len=1448 TSval=127201308 TSecr=4226905"
"189","12.243791s","0.000004s","192.168.0.41","192.168.0.42","TCP","1514","173761","2","44888","29312","33947 > 49200 [ACK] Seq=173761 Ack=2 Win=29312 Len=1448 TSval=127201308 TSecr=4226905"
"190","12.243796s","0.000005s","192.168.0.41","192.168.0.42","TCP","1514","175209","2","46336","29312","33947 > 49200 [ACK] Seq=175209 Ack=2 Win=29312 Len=1448 TSval=127201308 TSecr=4226905"
"191","12.243801s","0.000005s","192.168.0.41","192.168.0.42","TCP","1514","176657","2","47784","29312","33947 > 49200 [ACK] Seq=176657 Ack=2 Win=29312 Len=1448 TSval=127201308 TSecr=4226905"
"192","12.243804s","0.000003s","192.168.0.41","192.168.0.42","TCP","1514","178105","2","49232","29312","33947 > 49200 [ACK] Seq=178105 Ack=2 Win=29312 Len=1448 TSval=127201308 TSecr=4226905"
"193","12.243812s","0.000008s","192.168.0.41","192.168.0.42","TCP","1514","179553","2","50680","29312","33947 > 49200 [ACK] Seq=179553 Ack=2 Win=29312 Len=1448 TSval=127201308 TSecr=4226905"
"194","12.243822s","0.000010s","192.168.0.41","192.168.0.42","TCP","1514","181001","2","52128","29312","33947 > 49200 [ACK] Seq=181001 Ack=2 Win=29312 Len=1448 TSval=127201308 TSecr=4226905"
"195","12.243830s","0.000008s","192.168.0.41","192.168.0.42","TCP","1514","182449","2","53576","29312","33947 > 49200 [ACK] Seq=182449 Ack=2 Win=29312 Len=1448 TSval=127201308 TSecr=4226905"
"196","12.243949s","0.000119s","192.168.0.42","192.168.0.41","TCP","66","2","131769","","173824","49200 > 33947 [ACK] Seq=2 Ack=131769 Win=173824 Len=0 TSval=4226905 TSecr=127201307"
"197","12.243956s","0.000007s","192.168.0.41","192.168.0.42","TCP","1514","183897","2","53576","29312","33947 > 49200 [ACK] Seq=183897 Ack=2 Win=29312 Len=1448 TSval=127201308 TSecr=4226905"
"198","12.243959s","0.000003s","192.168.0.41","192.168.0.42","TCP","1514","185345","2","55024","29312","33947 > 49200 [ACK] Seq=185345 Ack=2 Win=29312 Len=1448 TSval=127201308 TSecr=4226905"
"199","12.243963s","0.000004s","192.168.0.42","192.168.0.41","TCP","66","2","133217","","176768","49200 > 33947 [ACK] Seq=2 Ack=133217 Win=176768 Len=0 TSval=4226905 TSecr=127201307"
"200","12.243968s","0.000005s","192.168.0.41","192.168.0.42","TCP","1514","186793","2","55024","29312","33947 > 49200 [ACK] Seq=186793 Ack=2 Win=29312 Len=1448 TSval=127201308 TSecr=4226905"
"201","12.243972s","0.000004s","192.168.0.42","192.168.0.41","TCP","66","2","134665","","179584","49200 > 33947 [ACK] Seq=2 Ack=134665 Win=179584 Len=0 TSval=4226905 TSecr=127201307"
"202","12.243977s","0.000005s","192.168.0.41","192.168.0.42","TCP","1514","188241","2","55024","29312","33947 > 49200 [ACK] Seq=188241 Ack=2 Win=29312 Len=1448 TSval=127201308 TSecr=4226905"
"203","12.243981s","0.000004s","192.168.0.42","192.168.0.41","TCP","66","2","136113","","182528","49200 > 33947 [ACK] Seq=2 Ack=136113 Win=182528 Len=0 TSval=4226905 TSecr=127201307"
"204","12.243986s","0.000005s","192.168.0.41","192.168.0.42","TCP","1514","189689","2","55024","29312","33947 > 49200 [ACK] Seq=189689 Ack=2 Win=29312 Len=1448 TSval=127201308 TSecr=4226905"
"205","12.243989s","0.000003s","192.168.0.42","192.168.0.41","TCP","66","2","137561","","185344","49200 > 33947 [ACK] Seq=2 Ack=137561 Win=185344 Len=0 TSval=4226905 TSecr=127201307"
"206","12.243994s","0.000005s","192.168.0.41","192.168.0.42","TCP","1514","191137","2","55024","29312","33947 > 49200 [ACK] Seq=191137 Ack=2 Win=29312 Len=1448 TSval=127201308 TSecr=4226905"
"207","12.244007s","0.000013s","192.168.0.42","192.168.0.41","TCP","66","2","139009","","188288","49200 > 33947 [ACK] Seq=2 Ack=139009 Win=188288 Len=0 TSval=4226905 TSecr=127201307"
"208","12.244012s","0.000005s","192.168.0.41","192.168.0.42","TCP","1514","192585","2","55024","29312","33947 > 49200 [ACK] Seq=192585 Ack=2 Win=29312 Len=1448 TSval=127201308 TSecr=4226905"
"209","12.244016s","0.000004s","192.168.0.42","192.168.0.41","TCP","66","2","140457","","191232","49200 > 33947 [ACK] Seq=2 Ack=140457 Win=191232 Len=0 TSval=4226905 TSecr=127201307"
"210","12.244020s","0.000004s","192.168.0.41","192.168.0.42","TCP","1514","194033","2","55024","29312","33947 > 49200 [ACK] Seq=194033 Ack=2 Win=29312 Len=1448 TSval=127201308 TSecr=4226905"
"211","12.244024s","0.000004s","192.168.0.42","192.168.0.41","TCP","66","2","141905","","194048","49200 > 33947 [ACK] Seq=2 Ack=141905 Win=194048 Len=0 TSval=4226905 TSecr=127201308"
"212","12.244028s","0.000004s","192.168.0.41","192.168.0.42","TCP","1514","195481","2","55024","29312","33947 > 49200 [ACK] Seq=195481 Ack=2 Win=29312 Len=1448 TSval=127201308 TSecr=4226905"
"213","12.244032s","0.000004s","192.168.0.42","192.168.0.41","TCP","66","2","143353","","196992","49200 > 33947 [ACK] Seq=2 Ack=143353 Win=196992 Len=0 TSval=4226905 TSecr=127201308"
"214","12.244037s","0.000005s","192.168.0.41","192.168.0.42","TCP","1514","196929","2","55024","29312","33947 > 49200 [ACK] Seq=196929 Ack=2 Win=29312 Len=1448 TSval=127201308 TSecr=4226905"
