"No.","Time","Delta time","Source","Destination","Protocol","Length","Window size value","Info"
"1298","1.530005","0.000005","10.1.2.2","10.3.8.2","TCP","74","14600","44187 > 50000 [SYN] Seq=0 Win=14600 Len=0 MSS=1460 SACK_PERM=1 TSval=382 TSecr=0 WS=8"
"1303","1.531019","0.000442","10.3.8.2","10.1.2.2","TCP","74","14280","50000 > 44187 [SYN, ACK] Seq=0 Ack=1 Win=14280 Len=0 MSS=1460 SACK_PERM=1 TSval=382 TSecr=382 WS=8"
"1304","1.531019","0.000000","10.1.2.2","10.3.8.2","TCP","74","1825","44187 > 50000 [ACK] Seq=1 Ack=1 Win=14600 Len=0 TSval=382 TSecr=382"
"1306","1.531024","0.000000","10.1.2.2","10.3.8.2","TCP","586","1825","44187 > 50000 [PSH, ACK] Seq=1 Ack=1 Win=14600 Len=512 TSval=382 TSecr=382"
"1307","1.531071","0.000047","10.1.2.2","10.3.8.2","TCP","1502","1825","44187 > 50000 [PSH, ACK] Seq=513 Ack=1 Win=14600 Len=1428 TSval=382 TSecr=382"
"1308","1.531192","0.000121","10.1.2.2","10.3.8.2","TCP","1502","1825","44187 > 50000 [PSH, ACK] Seq=1941 Ack=1 Win=14600 Len=1428 TSval=382 TSecr=382"
"1309","1.531312","0.000120","10.1.2.2","10.3.8.2","TCP","1502","1825","44187 > 50000 [PSH, ACK] Seq=3369 Ack=1 Win=14600 Len=1428 TSval=382 TSecr=382"
"1310","1.531432","0.000120","10.1.2.2","10.3.8.2","TCP","1502","1825","44187 > 50000 [PSH, ACK] Seq=4797 Ack=1 Win=14600 Len=1428 TSval=382 TSecr=382"
"1311","1.531552","0.000120","10.1.2.2","10.3.8.2","TCP","1502","1825","44187 > 50000 [PSH, ACK] Seq=6225 Ack=1 Win=14600 Len=1428 TSval=382 TSecr=382"
"1312","1.531672","0.000120","10.1.2.2","10.3.8.2","TCP","1502","1825","44187 > 50000 [PSH, ACK] Seq=7653 Ack=1 Win=14600 Len=1428 TSval=382 TSecr=382"
"1313","1.531792","0.000120","10.1.2.2","10.3.8.2","TCP","1502","1825","44187 > 50000 [PSH, ACK] Seq=9081 Ack=1 Win=14600 Len=1428 TSval=382 TSecr=382"
"1314","1.531912","0.000120","10.1.2.2","10.3.8.2","TCP","1502","1825","44187 > 50000 [PSH, ACK] Seq=10509 Ack=1 Win=14600 Len=1428 TSval=382 TSecr=382"
"1315","1.532033","0.000121","10.1.2.2","10.3.8.2","TCP","1502","1825","44187 > 50000 [PSH, ACK] Seq=11937 Ack=1 Win=14600 Len=1428 TSval=382 TSecr=382"
"1666","1.732000","0.055389","10.1.2.2","10.3.8.2","TCP","586","1825","[TCP Retransmission] 44187 > 50000 [PSH, ACK] Seq=1 Ack=1 Win=14600 Len=512 TSval=433 TSecr=382"
"1672","1.733164","0.000383","10.3.8.2","10.1.2.2","TCP","62","1721","50000 > 44187 [ACK] Seq=1 Ack=513 Win=13768 Len=0 TSval=433 TSecr=433"
"1673","1.733164","0.000000","10.1.2.2","10.3.8.2","TCP","1502","1825","[TCP Retransmission] 44187 > 50000 [PSH, ACK] Seq=513 Ack=1 Win=14600 Len=1428 TSval=433 TSecr=433"
"1675","1.733285","0.000027","10.1.2.2","10.3.8.2","TCP","1502","1825","[TCP Retransmission] 44187 > 50000 [PSH, ACK] Seq=1941 Ack=1 Win=14600 Len=1428 TSval=433 TSecr=433"
"1681","1.734677","0.000581","10.3.8.2","10.1.2.2","TCP","62","1543","50000 > 44187 [ACK] Seq=1 Ack=1941 Win=12344 Len=0 TSval=433 TSecr=433"
"1682","1.734677","0.000000","10.1.2.2","10.3.8.2","TCP","1502","1825","[TCP Retransmission] 44187 > 50000 [PSH, ACK] Seq=3369 Ack=1 Win=14600 Len=1428 TSval=433 TSecr=433"
"1684","1.734797","0.000115","10.1.2.2","10.3.8.2","TCP","1502","1825","[TCP Retransmission] 44187 > 50000 [PSH, ACK] Seq=4797 Ack=1 Win=14600 Len=1428 TSval=433 TSecr=433"
"1686","1.734922","0.000005","10.3.8.2","10.1.2.2","TCP","62","1365","50000 > 44187 [ACK] Seq=1 Ack=3369 Win=10920 Len=0 TSval=433 TSecr=433"
"1687","1.734964","0.000042","10.1.2.2","10.3.8.2","TCP","1502","1825","[TCP Retransmission] 44187 > 50000 [PSH, ACK] Seq=6225 Ack=1 Win=14600 Len=1428 TSval=433 TSecr=433"
"1689","1.735084","0.000037","10.1.2.2","10.3.8.2","TCP","1502","1825","[TCP Retransmission] 44187 > 50000 [PSH, ACK] Seq=7653 Ack=1 Win=14600 Len=1428 TSval=433 TSecr=433"
"1693","1.736256","0.000921","10.3.8.2","10.1.2.2","TCP","62","1187","50000 > 44187 [ACK] Seq=1 Ack=4797 Win=9496 Len=0 TSval=433 TSecr=433"
"1694","1.736256","0.000000","10.1.2.2","10.3.8.2","TCP","1502","1825","[TCP Retransmission] 44187 > 50000 [PSH, ACK] Seq=9081 Ack=1 Win=14600 Len=1428 TSval=434 TSecr=433"
"1696","1.736376","0.000057","10.1.2.2","10.3.8.2","TCP","1502","1825","[TCP Retransmission] 44187 > 50000 [PSH, ACK] Seq=10509 Ack=1 Win=14600 Len=1428 TSval=434 TSecr=433"
"1698","1.736502","0.000005","10.3.8.2","10.1.2.2","TCP","62","1009","50000 > 44187 [ACK] Seq=1 Ack=6225 Win=8072 Len=0 TSval=433 TSecr=433"
"1699","1.736544","0.000042","10.1.2.2","10.3.8.2","TCP","1502","1825","[TCP Retransmission] 44187 > 50000 [PSH, ACK] Seq=11937 Ack=1 Win=14600 Len=1428 TSval=434 TSecr=433"
"1704","1.736911","0.000237","10.3.8.2","10.1.2.2","TCP","62","831","50000 > 44187 [ACK] Seq=1 Ack=7653 Win=6648 Len=0 TSval=434 TSecr=433"
"1705","1.737154","0.000243","10.3.8.2","10.1.2.2","TCP","62","730","50000 > 44187 [ACK] Seq=1 Ack=9081 Win=5840 Len=0 TSval=434 TSecr=433"
"1710","1.738024","0.000021","10.3.8.2","10.1.2.2","TCP","62","730","50000 > 44187 [ACK] Seq=1 Ack=10509 Win=5840 Len=0 TSval=434 TSecr=434"
"1713","1.738290","0.000201","10.3.8.2","10.1.2.2","TCP","62","730","50000 > 44187 [ACK] Seq=1 Ack=11937 Win=5840 Len=0 TSval=434 TSecr=434"
"1714","1.738533","0.000243","10.3.8.2","10.1.2.2","TCP","62","730","50000 > 44187 [ACK] Seq=1 Ack=13365 Win=5840 Len=0 TSval=434 TSecr=434"
"1715","1.738533","0.000000","10.1.2.2","10.3.8.2","TCP","1502","1825","44187 > 50000 [PSH, ACK] Seq=13365 Ack=1 Win=14600 Len=1428 TSval=434 TSecr=434"
"1716","1.738653","0.000120","10.1.2.2","10.3.8.2","TCP","1502","1825","44187 > 50000 [PSH, ACK] Seq=14793 Ack=1 Win=14600 Len=1428 TSval=434 TSecr=434"
"1717","1.738773","0.000120","10.1.2.2","10.3.8.2","TCP","1502","1825","44187 > 50000 [PSH, ACK] Seq=16221 Ack=1 Win=14600 Len=1428 TSval=434 TSecr=434"
"1718","1.738893","0.000120","10.1.2.2","10.3.8.2","TCP","1502","1825","44187 > 50000 [PSH, ACK] Seq=17649 Ack=1 Win=14600 Len=1428 TSval=434 TSecr=434"
"1725","1.740287","0.000898","10.3.8.2","10.1.2.2","TCP","62","730","50000 > 44187 [ACK] Seq=1 Ack=14793 Win=5840 Len=0 TSval=434 TSecr=434"
"1726","1.740287","0.000000","10.1.2.2","10.3.8.2","TCP","1502","1825","44187 > 50000 [PSH, ACK] Seq=19077 Ack=1 Win=14600 Len=1428 TSval=435 TSecr=434"
"1729","1.740407","0.000000","10.3.8.2","10.1.2.2","TCP","62","730","50000 > 44187 [ACK] Seq=1 Ack=16221 Win=5840 Len=0 TSval=434 TSecr=434"
"1730","1.740454","0.000047","10.1.2.2","10.3.8.2","TCP","1502","1825","44187 > 50000 [PSH, ACK] Seq=20505 Ack=1 Win=14600 Len=1428 TSval=435 TSecr=434"
"1732","1.740528","0.000055","10.3.8.2","10.1.2.2","TCP","62","730","50000 > 44187 [ACK] Seq=1 Ack=17649 Win=5840 Len=0 TSval=434 TSecr=434"
"1734","1.740579","0.000005","10.1.2.2","10.3.8.2","TCP","1502","1825","44187 > 50000 [PSH, ACK] Seq=21933 Ack=1 Win=14600 Len=1428 TSval=435 TSecr=434"
"1739","1.741729","0.000118","10.3.8.2","10.1.2.2","TCP","62","730","50000 > 44187 [ACK] Seq=1 Ack=20505 Win=5840 Len=0 TSval=435 TSecr=434"
"1740","1.741729","0.000000","10.1.2.2","10.3.8.2","TCP","1502","1825","44187 > 50000 [PSH, ACK] Seq=23361 Ack=1 Win=14600 Len=1428 TSval=435 TSecr=435"
"1741","1.741849","0.000120","10.1.2.2","10.3.8.2","TCP","1502","1825","44187 > 50000 [PSH, ACK] Seq=24789 Ack=1 Win=14600 Len=1428 TSval=435 TSecr=435"
"1744","1.742037","0.000005","10.3.8.2","10.1.2.2","TCP","62","730","50000 > 44187 [ACK] Seq=1 Ack=23361 Win=5840 Len=0 TSval=435 TSecr=435"
"1745","1.742037","0.000000","10.1.2.2","10.3.8.2","TCP","1502","1825","44187 > 50000 [PSH, ACK] Seq=26217 Ack=1 Win=14600 Len=1428 TSval=435 TSecr=435"
"1747","1.742157","0.000005","10.1.2.2","10.3.8.2","TCP","1502","1825","44187 > 50000 [PSH, ACK] Seq=27645 Ack=1 Win=14600 Len=1428 TSval=435 TSecr=435"
"1753","1.743367","0.000193","10.3.8.2","10.1.2.2","TCP","62","730","50000 > 44187 [ACK] Seq=1 Ack=26217 Win=5840 Len=0 TSval=435 TSecr=435"
"1754","1.743367","0.000000","10.1.2.2","10.3.8.2","TCP","1502","1825","44187 > 50000 [ACK] Seq=29073 Ack=1 Win=14600 Len=1428 TSval=435 TSecr=435"
"1756","1.743488","0.000010","10.1.2.2","10.3.8.2","TCP","1502","1825","44187 > 50000 [ACK] Seq=30501 Ack=1 Win=14600 Len=1428 TSval=435 TSecr=435"
"1758","1.743728","0.000120","10.3.8.2","10.1.2.2","TCP","62","730","50000 > 44187 [ACK] Seq=1 Ack=29073 Win=5840 Len=0 TSval=435 TSecr=435"
"1759","1.743728","0.000000","10.1.2.2","10.3.8.2","TCP","1502","1825","44187 > 50000 [ACK] Seq=31929 Ack=1 Win=14600 Len=1428 TSval=435 TSecr=435"
"1760","1.743848","0.000120","10.1.2.2","10.3.8.2","TCP","1502","1825","44187 > 50000 [PSH, ACK] Seq=33357 Ack=1 Win=14600 Len=1428 TSval=435 TSecr=435"
"1767","1.745020","0.000020","10.3.8.2","10.1.2.2","TCP","62","730","50000 > 44187 [ACK] Seq=1 Ack=31929 Win=5840 Len=0 TSval=436 TSecr=435"
"1768","1.745020","0.000000","10.1.2.2","10.3.8.2","TCP","1502","1825","44187 > 50000 [ACK] Seq=34785 Ack=1 Win=14600 Len=1428 TSval=436 TSecr=436"
"1769","1.745140","0.000120","10.1.2.2","10.3.8.2","TCP","1502","1825","44187 > 50000 [ACK] Seq=36213 Ack=1 Win=14600 Len=1428 TSval=436 TSecr=436"
"1770","1.745454","0.000314","10.3.8.2","10.1.2.2","TCP","62","730","50000 > 44187 [ACK] Seq=1 Ack=34785 Win=5840 Len=0 TSval=436 TSecr=435"
"1771","1.745454","0.000000","10.1.2.2","10.3.8.2","TCP","1502","1825","44187 > 50000 [ACK] Seq=37641 Ack=1 Win=14600 Len=1428 TSval=436 TSecr=436"
"1773","1.745574","0.000115","10.1.2.2","10.3.8.2","TCP","1502","1825","44187 > 50000 [PSH, ACK] Seq=39069 Ack=1 Win=14600 Len=1428 TSval=436 TSecr=436"
"1779","1.746598","0.000448","10.3.8.2","10.1.2.2","TCP","62","730","50000 > 44187 [ACK] Seq=1 Ack=37641 Win=5840 Len=0 TSval=436 TSecr=436"
"1780","1.746598","0.000000","10.1.2.2","10.3.8.2","TCP","1502","1825","44187 > 50000 [ACK] Seq=40497 Ack=1 Win=14600 Len=1428 TSval=436 TSecr=436"
"1781","1.746718","0.000120","10.1.2.2","10.3.8.2","TCP","1502","1825","44187 > 50000 [ACK] Seq=41925 Ack=1 Win=14600 Len=1428 TSval=436 TSecr=436"
"1786","1.747130","0.000005","10.3.8.2","10.1.2.2","TCP","62","730","50000 > 44187 [ACK] Seq=1 Ack=40497 Win=5840 Len=0 TSval=436 TSecr=436"
"1787","1.747130","0.000000","10.1.2.2","10.3.8.2","TCP","1502","1825","44187 > 50000 [ACK] Seq=43353 Ack=1 Win=14600 Len=1428 TSval=436 TSecr=436"
"1788","1.747250","0.000120","10.1.2.2","10.3.8.2","TCP","1502","1825","44187 > 50000 [PSH, ACK] Seq=44781 Ack=1 Win=14600 Len=1428 TSval=436 TSecr=436"
"1793","1.748119","0.000054","10.3.8.2","10.1.2.2","TCP","62","730","50000 > 44187 [ACK] Seq=1 Ack=43353 Win=5840 Len=0 TSval=436 TSecr=436"
"1794","1.748119","0.000000","10.1.2.2","10.3.8.2","TCP","1502","1825","44187 > 50000 [ACK] Seq=46209 Ack=1 Win=14600 Len=1428 TSval=437 TSecr=436"
"1795","1.748239","0.000120","10.1.2.2","10.3.8.2","TCP","1502","1825","44187 > 50000 [ACK] Seq=47637 Ack=1 Win=14600 Len=1428 TSval=437 TSecr=436"
"1798","1.748697","0.000058","10.3.8.2","10.1.2.2","TCP","62","730","50000 > 44187 [ACK] Seq=1 Ack=46209 Win=5840 Len=0 TSval=437 TSecr=436"
"1799","1.748697","0.000000","10.1.2.2","10.3.8.2","TCP","1502","1825","44187 > 50000 [ACK] Seq=49065 Ack=1 Win=14600 Len=1428 TSval=437 TSecr=437"
"1800","1.748817","0.000120","10.1.2.2","10.3.8.2","TCP","1502","1825","44187 > 50000 [PSH, ACK] Seq=50493 Ack=1 Win=14600 Len=1428 TSval=437 TSecr=437"
"1805","1.749707","0.000410","10.3.8.2","10.1.2.2","TCP","62","730","50000 > 44187 [ACK] Seq=1 Ack=49065 Win=5840 Len=0 TSval=437 TSecr=437"
"1806","1.749707","0.000000","10.1.2.2","10.3.8.2","TCP","1502","1825","44187 > 50000 [ACK] Seq=51921 Ack=1 Win=14600 Len=1428 TSval=437 TSecr=437"
"1808","1.749827","0.000045","10.1.2.2","10.3.8.2","TCP","1502","1825","44187 > 50000 [ACK] Seq=53349 Ack=1 Win=14600 Len=1428 TSval=437 TSecr=437"
"1810","1.750253","0.000064","10.3.8.2","10.1.2.2","TCP","62","730","50000 > 44187 [ACK] Seq=1 Ack=51921 Win=5840 Len=0 TSval=437 TSecr=437"
"1811","1.750253","0.000000","10.1.2.2","10.3.8.2","TCP","1502","1825","44187 > 50000 [ACK] Seq=54777 Ack=1 Win=14600 Len=1428 TSval=437 TSecr=437"
"1812","1.750373","0.000120","10.1.2.2","10.3.8.2","TCP","1502","1825","44187 > 50000 [PSH, ACK] Seq=56205 Ack=1 Win=14600 Len=1428 TSval=437 TSecr=437"
"1813","1.751290","0.000917","10.3.8.2","10.1.2.2","TCP","62","730","50000 > 44187 [ACK] Seq=1 Ack=54777 Win=5840 Len=0 TSval=437 TSecr=437"
"1814","1.751290","0.000000","10.1.2.2","10.3.8.2","TCP","1502","1825","44187 > 50000 [ACK] Seq=57633 Ack=1 Win=14600 Len=1428 TSval=437 TSecr=437"
"1815","1.751411","0.000121","10.1.2.2","10.3.8.2","TCP","1502","1825","44187 > 50000 [ACK] Seq=59061 Ack=1 Win=14600 Len=1428 TSval=437 TSecr=437"
"1816","1.751895","0.000484","10.3.8.2","10.1.2.2","TCP","62","730","50000 > 44187 [ACK] Seq=1 Ack=57633 Win=5840 Len=0 TSval=437 TSecr=437"
"1817","1.751895","0.000000","10.1.2.2","10.3.8.2","TCP","1502","1825","44187 > 50000 [ACK] Seq=60489 Ack=1 Win=14600 Len=1428 TSval=437 TSecr=437"
"1818","1.752015","0.000120","10.1.2.2","10.3.8.2","TCP","1502","1825","44187 > 50000 [PSH, ACK] Seq=61917 Ack=1 Win=14600 Len=1428 TSval=437 TSecr=437"
"1819","1.752916","0.000901","10.3.8.2","10.1.2.2","TCP","62","730","50000 > 44187 [ACK] Seq=1 Ack=60489 Win=5840 Len=0 TSval=438 TSecr=437"
"1820","1.752916","0.000000","10.1.2.2","10.3.8.2","TCP","1502","1825","44187 > 50000 [ACK] Seq=63345 Ack=1 Win=14600 Len=1428 TSval=438 TSecr=438"
"1821","1.753036","0.000120","10.1.2.2","10.3.8.2","TCP","1502","1825","44187 > 50000 [ACK] Seq=64773 Ack=1 Win=14600 Len=1428 TSval=438 TSecr=438"
"1822","1.753477","0.000441","10.3.8.2","10.1.2.2","TCP","62","730","50000 > 44187 [ACK] Seq=1 Ack=63345 Win=5840 Len=0 TSval=438 TSecr=437"
"1823","1.753477","0.000000","10.1.2.2","10.3.8.2","TCP","1502","1825","44187 > 50000 [ACK] Seq=66201 Ack=1 Win=14600 Len=1428 TSval=438 TSecr=438"
"1824","1.753597","0.000120","10.1.2.2","10.3.8.2","TCP","944","1825","44187 > 50000 [PSH, ACK] Seq=67629 Ack=1 Win=14600 Len=870 TSval=438 TSecr=438"
"1825","1.754590","0.000993","10.3.8.2","10.1.2.2","TCP","62","730","50000 > 44187 [ACK] Seq=1 Ack=66201 Win=5840 Len=0 TSval=438 TSecr=438"
"1826","1.754982","0.000392","10.3.8.2","10.1.2.2","TCP","62","730","50000 > 44187 [ACK] Seq=1 Ack=68499 Win=5840 Len=0 TSval=438 TSecr=438"
"1827","1.754982","0.000000","10.1.2.2","10.3.8.2","TCP","62","1825","44187 > 50000 [FIN, ACK] Seq=68499 Ack=1 Win=14600 Len=0 TSval=438 TSecr=438"
"1834","1.792502","0.003259","10.3.8.2","10.1.2.2","TCP","62","730","50000 > 44187 [ACK] Seq=1 Ack=68500 Win=5840 Len=0 TSval=448 TSecr=438"
