"No.","Time","New Column","Source","Destination","Protocol","Length","Window size value","Info"
"6","1.180583","0.000572","10.4.14.2","10.1.2.2","TCP","74","14600","55981 > 50000 [SYN] Seq=0 Win=14600 Len=0 MSS=1460 SACK_PERM=1 TSval=294 TSecr=0 WS=8"
"7","1.180583","0.000000","10.1.2.2","10.4.14.2","TCP","74","14280","50000 > 55981 [SYN, ACK] Seq=0 Ack=1 Win=14280 Len=0 MSS=1460 SACK_PERM=1 TSval=295 TSecr=294 WS=8"
"25","1.181683","0.000077","10.4.14.2","10.1.2.2","TCP","74","1825","55981 > 50000 [ACK] Seq=1 Ack=1 Win=14600 Len=0 TSval=295 TSecr=295"
"27","1.181807","0.000080","10.4.14.2","10.1.2.2","TCP","586","1825","55981 > 50000 [PSH, ACK] Seq=1 Ack=1 Win=14600 Len=512 TSval=295 TSecr=295"
"32","1.182121","0.000101","10.4.14.2","10.1.2.2","TCP","1502","1825","55981 > 50000 [PSH, ACK] Seq=513 Ack=1 Win=14600 Len=1428 TSval=295 TSecr=295"
"35","1.182301","0.000041","10.4.14.2","10.1.2.2","TCP","1502","1825","55981 > 50000 [PSH, ACK] Seq=1941 Ack=1 Win=14600 Len=1428 TSval=295 TSecr=295"
"37","1.182481","0.000101","10.4.14.2","10.1.2.2","TCP","1502","1825","55981 > 50000 [PSH, ACK] Seq=3369 Ack=1 Win=14600 Len=1428 TSval=295 TSecr=295"
"40","1.182661","0.000041","10.4.14.2","10.1.2.2","TCP","1502","1825","55981 > 50000 [PSH, ACK] Seq=4797 Ack=1 Win=14600 Len=1428 TSval=295 TSecr=295"
"42","1.182842","0.000101","10.4.14.2","10.1.2.2","TCP","1502","1825","55981 > 50000 [PSH, ACK] Seq=6225 Ack=1 Win=14600 Len=1428 TSval=295 TSecr=295"
"46","1.183022","0.000035","10.4.14.2","10.1.2.2","TCP","1502","1825","55981 > 50000 [PSH, ACK] Seq=7653 Ack=1 Win=14600 Len=1428 TSval=295 TSecr=295"
"49","1.183202","0.000048","10.4.14.2","10.1.2.2","TCP","1502","1825","55981 > 50000 [PSH, ACK] Seq=9081 Ack=1 Win=14600 Len=1428 TSval=295 TSecr=295"
"51","1.183382","0.000108","10.4.14.2","10.1.2.2","TCP","1502","1825","55981 > 50000 [PSH, ACK] Seq=10509 Ack=1 Win=14600 Len=1428 TSval=295 TSecr=295"
"53","1.183502","0.000108","10.4.14.2","10.1.2.2","TCP","1502","1825","55981 > 50000 [PSH, ACK] Seq=11937 Ack=1 Win=14600 Len=1428 TSval=295 TSecr=295"
"64","1.184115","0.000105","10.1.2.2","10.4.14.2","TCP","62","1919","50000 > 55981 [ACK] Seq=1 Ack=513 Win=15352 Len=0 TSval=295 TSecr=295"
"65","1.184120","0.000005","10.1.2.2","10.4.14.2","TCP","62","2284","50000 > 55981 [ACK] Seq=1 Ack=1941 Win=18272 Len=0 TSval=295 TSecr=295"
"66","1.184125","0.000005","10.1.2.2","10.4.14.2","TCP","62","2649","50000 > 55981 [ACK] Seq=1 Ack=3369 Win=21192 Len=0 TSval=295 TSecr=295"
"68","1.184130","0.000000","10.1.2.2","10.4.14.2","TCP","62","3014","50000 > 55981 [ACK] Seq=1 Ack=4797 Win=24112 Len=0 TSval=295 TSecr=295"
"69","1.184135","0.000005","10.1.2.2","10.4.14.2","TCP","62","3379","50000 > 55981 [ACK] Seq=1 Ack=6225 Win=27032 Len=0 TSval=295 TSecr=295"
"70","1.184140","0.000005","10.1.2.2","10.4.14.2","TCP","62","3744","50000 > 55981 [ACK] Seq=1 Ack=7653 Win=29952 Len=0 TSval=295 TSecr=295"
"71","1.184145","0.000005","10.1.2.2","10.4.14.2","TCP","62","4109","50000 > 55981 [ACK] Seq=1 Ack=9081 Win=32872 Len=0 TSval=295 TSecr=295"
"72","1.184150","0.000005","10.1.2.2","10.4.14.2","TCP","62","4474","50000 > 55981 [ACK] Seq=1 Ack=10509 Win=35792 Len=0 TSval=295 TSecr=295"
"73","1.184155","0.000005","10.1.2.2","10.4.14.2","TCP","62","4839","50000 > 55981 [ACK] Seq=1 Ack=11937 Win=38712 Len=0 TSval=295 TSecr=295"
"74","1.184160","0.000005","10.1.2.2","10.4.14.2","TCP","62","5204","50000 > 55981 [ACK] Seq=1 Ack=13365 Win=41632 Len=0 TSval=295 TSecr=295"
"156","1.187475","0.000038","10.4.14.2","10.1.2.2","TCP","1502","1825","55981 > 50000 [PSH, ACK] Seq=13365 Ack=1 Win=14600 Len=1428 TSval=296 TSecr=295"
"158","1.187655","0.000098","10.4.14.2","10.1.2.2","TCP","1502","1825","55981 > 50000 [PSH, ACK] Seq=14793 Ack=1 Win=14600 Len=1428 TSval=296 TSecr=295"
"162","1.187835","0.000033","10.4.14.2","10.1.2.2","TCP","1502","1825","55981 > 50000 [PSH, ACK] Seq=16221 Ack=1 Win=14600 Len=1428 TSval=296 TSecr=295"
"165","1.188015","0.000088","10.4.14.2","10.1.2.2","TCP","1502","1825","55981 > 50000 [PSH, ACK] Seq=17649 Ack=1 Win=14600 Len=1428 TSval=296 TSecr=295"
"168","1.188196","0.000028","10.4.14.2","10.1.2.2","TCP","1502","1825","55981 > 50000 [PSH, ACK] Seq=19077 Ack=1 Win=14600 Len=1428 TSval=296 TSecr=295"
"170","1.188316","0.000028","10.4.14.2","10.1.2.2","TCP","1502","1825","55981 > 50000 [PSH, ACK] Seq=20505 Ack=1 Win=14600 Len=1428 TSval=296 TSecr=295"
"172","1.188436","0.000028","10.4.14.2","10.1.2.2","TCP","1502","1825","55981 > 50000 [PSH, ACK] Seq=21933 Ack=1 Win=14600 Len=1428 TSval=296 TSecr=295"
"174","1.188556","0.000028","10.4.14.2","10.1.2.2","TCP","1502","1825","55981 > 50000 [PSH, ACK] Seq=23361 Ack=1 Win=14600 Len=1428 TSval=296 TSecr=295"
"176","1.188676","0.000028","10.4.14.2","10.1.2.2","TCP","1502","1825","55981 > 50000 [PSH, ACK] Seq=24789 Ack=1 Win=14600 Len=1428 TSval=296 TSecr=295"
"178","1.188796","0.000028","10.4.14.2","10.1.2.2","TCP","1502","1825","55981 > 50000 [PSH, ACK] Seq=26217 Ack=1 Win=14600 Len=1428 TSval=296 TSecr=295"
"180","1.188917","0.000028","10.4.14.2","10.1.2.2","TCP","1502","1825","55981 > 50000 [PSH, ACK] Seq=27645 Ack=1 Win=14600 Len=1428 TSval=296 TSecr=295"
"182","1.189037","0.000028","10.4.14.2","10.1.2.2","TCP","1502","1825","55981 > 50000 [PSH, ACK] Seq=29073 Ack=1 Win=14600 Len=1428 TSval=296 TSecr=295"
"184","1.189157","0.000028","10.4.14.2","10.1.2.2","TCP","1502","1825","55981 > 50000 [PSH, ACK] Seq=30501 Ack=1 Win=14600 Len=1428 TSval=296 TSecr=295"
"186","1.189277","0.000028","10.4.14.2","10.1.2.2","TCP","1502","1825","55981 > 50000 [PSH, ACK] Seq=31929 Ack=1 Win=14600 Len=1428 TSval=296 TSecr=295"
"188","1.189397","0.000028","10.4.14.2","10.1.2.2","TCP","1502","1825","55981 > 50000 [PSH, ACK] Seq=33357 Ack=1 Win=14600 Len=1428 TSval=296 TSecr=295"
"190","1.189517","0.000028","10.4.14.2","10.1.2.2","TCP","1502","1825","55981 > 50000 [PSH, ACK] Seq=34785 Ack=1 Win=14600 Len=1428 TSval=296 TSecr=295"
"192","1.189638","0.000029","10.4.14.2","10.1.2.2","TCP","1502","1825","55981 > 50000 [PSH, ACK] Seq=36213 Ack=1 Win=14600 Len=1428 TSval=296 TSecr=295"
"195","1.189758","0.000023","10.4.14.2","10.1.2.2","TCP","1502","1825","55981 > 50000 [PSH, ACK] Seq=37641 Ack=1 Win=14600 Len=1428 TSval=296 TSecr=295"
"197","1.189878","0.000023","10.4.14.2","10.1.2.2","TCP","1502","1825","55981 > 50000 [PSH, ACK] Seq=39069 Ack=1 Win=14600 Len=1428 TSval=296 TSecr=295"
"199","1.189998","0.000023","10.4.14.2","10.1.2.2","TCP","1502","1825","55981 > 50000 [PSH, ACK] Seq=40497 Ack=1 Win=14600 Len=1428 TSval=296 TSecr=295"
"259","1.192618","0.000012","10.1.2.2","10.4.14.2","TCP","62","5569","50000 > 55981 [ACK] Seq=1 Ack=14793 Win=44552 Len=0 TSval=296 TSecr=296"
"260","1.192623","0.000005","10.1.2.2","10.4.14.2","TCP","62","5934","50000 > 55981 [ACK] Seq=1 Ack=16221 Win=47472 Len=0 TSval=296 TSecr=296"
"261","1.192628","0.000005","10.1.2.2","10.4.14.2","TCP","62","6299","50000 > 55981 [ACK] Seq=1 Ack=17649 Win=50392 Len=0 TSval=296 TSecr=296"
"262","1.192633","0.000005","10.1.2.2","10.4.14.2","TCP","62","6664","50000 > 55981 [ACK] Seq=1 Ack=19077 Win=53312 Len=0 TSval=297 TSecr=296"
"263","1.192638","0.000005","10.1.2.2","10.4.14.2","TCP","62","7029","50000 > 55981 [ACK] Seq=1 Ack=20505 Win=56232 Len=0 TSval=297 TSecr=296"
"264","1.192643","0.000005","10.1.2.2","10.4.14.2","TCP","62","7394","50000 > 55981 [ACK] Seq=1 Ack=21933 Win=59152 Len=0 TSval=297 TSecr=296"
"265","1.192648","0.000005","10.1.2.2","10.4.14.2","TCP","62","7759","50000 > 55981 [ACK] Seq=1 Ack=23361 Win=62072 Len=0 TSval=297 TSecr=296"
"266","1.192653","0.000005","10.1.2.2","10.4.14.2","TCP","62","8124","50000 > 55981 [ACK] Seq=1 Ack=24789 Win=64992 Len=0 TSval=297 TSecr=296"
"267","1.192658","0.000005","10.1.2.2","10.4.14.2","TCP","62","8489","50000 > 55981 [ACK] Seq=1 Ack=26217 Win=67912 Len=0 TSval=297 TSecr=296"
"268","1.192663","0.000005","10.1.2.2","10.4.14.2","TCP","62","8854","50000 > 55981 [ACK] Seq=1 Ack=27645 Win=70832 Len=0 TSval=297 TSecr=296"
"269","1.192668","0.000005","10.1.2.2","10.4.14.2","TCP","62","9219","50000 > 55981 [ACK] Seq=1 Ack=29073 Win=73752 Len=0 TSval=297 TSecr=296"
"270","1.192673","0.000005","10.1.2.2","10.4.14.2","TCP","62","9584","50000 > 55981 [ACK] Seq=1 Ack=30501 Win=76672 Len=0 TSval=297 TSecr=296"
"271","1.192678","0.000005","10.1.2.2","10.4.14.2","TCP","62","9949","50000 > 55981 [ACK] Seq=1 Ack=31929 Win=79592 Len=0 TSval=297 TSecr=296"
"272","1.192683","0.000005","10.1.2.2","10.4.14.2","TCP","62","10314","50000 > 55981 [ACK] Seq=1 Ack=33357 Win=82512 Len=0 TSval=297 TSecr=296"
"273","1.192688","0.000005","10.1.2.2","10.4.14.2","TCP","62","10679","50000 > 55981 [ACK] Seq=1 Ack=34785 Win=85432 Len=0 TSval=297 TSecr=296"
"274","1.192693","0.000005","10.1.2.2","10.4.14.2","TCP","62","11044","50000 > 55981 [ACK] Seq=1 Ack=36213 Win=88352 Len=0 TSval=297 TSecr=296"
"275","1.192698","0.000005","10.1.2.2","10.4.14.2","TCP","62","11409","50000 > 55981 [ACK] Seq=1 Ack=37641 Win=91272 Len=0 TSval=297 TSecr=296"
"276","1.192703","0.000005","10.1.2.2","10.4.14.2","TCP","62","11774","50000 > 55981 [ACK] Seq=1 Ack=39069 Win=94192 Len=0 TSval=297 TSecr=296"
"277","1.192708","0.000005","10.1.2.2","10.4.14.2","TCP","62","12139","50000 > 55981 [ACK] Seq=1 Ack=40497 Win=97112 Len=0 TSval=297 TSecr=296"
"278","1.192713","0.000005","10.1.2.2","10.4.14.2","TCP","62","12504","50000 > 55981 [ACK] Seq=1 Ack=41925 Win=100032 Len=0 TSval=297 TSecr=296"
"399","1.196015","0.000064","10.4.14.2","10.1.2.2","TCP","1502","1825","55981 > 50000 [PSH, ACK] Seq=41925 Ack=1 Win=14600 Len=1428 TSval=298 TSecr=296"
"402","1.196135","0.000059","10.4.14.2","10.1.2.2","TCP","1502","1825","55981 > 50000 [PSH, ACK] Seq=43353 Ack=1 Win=14600 Len=1428 TSval=298 TSecr=296"
"404","1.196255","0.000059","10.4.14.2","10.1.2.2","TCP","1502","1825","55981 > 50000 [PSH, ACK] Seq=44781 Ack=1 Win=14600 Len=1428 TSval=298 TSecr=296"
"406","1.196375","0.000059","10.4.14.2","10.1.2.2","TCP","1502","1825","55981 > 50000 [PSH, ACK] Seq=46209 Ack=1 Win=14600 Len=1428 TSval=298 TSecr=296"
"408","1.196495","0.000059","10.4.14.2","10.1.2.2","TCP","1502","1825","55981 > 50000 [PSH, ACK] Seq=47637 Ack=1 Win=14600 Len=1428 TSval=298 TSecr=296"
"410","1.196615","0.000058","10.4.14.2","10.1.2.2","TCP","1502","1825","55981 > 50000 [PSH, ACK] Seq=49065 Ack=1 Win=14600 Len=1428 TSval=298 TSecr=296"
"412","1.196735","0.000058","10.4.14.2","10.1.2.2","TCP","1502","1825","55981 > 50000 [PSH, ACK] Seq=50493 Ack=1 Win=14600 Len=1428 TSval=298 TSecr=297"
"414","1.196856","0.000059","10.4.14.2","10.1.2.2","TCP","1502","1825","55981 > 50000 [PSH, ACK] Seq=51921 Ack=1 Win=14600 Len=1428 TSval=298 TSecr=297"
"416","1.196976","0.000059","10.4.14.2","10.1.2.2","TCP","1502","1825","55981 > 50000 [PSH, ACK] Seq=53349 Ack=1 Win=14600 Len=1428 TSval=298 TSecr=297"
"418","1.197096","0.000059","10.4.14.2","10.1.2.2","TCP","1502","1825","55981 > 50000 [PSH, ACK] Seq=54777 Ack=1 Win=14600 Len=1428 TSval=298 TSecr=297"
"420","1.197219","0.000062","10.4.14.2","10.1.2.2","TCP","1502","1825","55981 > 50000 [PSH, ACK] Seq=56205 Ack=1 Win=14600 Len=1428 TSval=298 TSecr=297"
"422","1.197339","0.000061","10.4.14.2","10.1.2.2","TCP","1502","1825","55981 > 50000 [PSH, ACK] Seq=57633 Ack=1 Win=14600 Len=1428 TSval=298 TSecr=297"
"432","1.197459","0.000066","10.4.14.2","10.1.2.2","TCP","1502","1825","55981 > 50000 [PSH, ACK] Seq=59061 Ack=1 Win=14600 Len=1428 TSval=298 TSecr=297"
"434","1.197582","0.000069","10.4.14.2","10.1.2.2","TCP","1502","1825","55981 > 50000 [PSH, ACK] Seq=60489 Ack=1 Win=14600 Len=1428 TSval=298 TSecr=297"
"436","1.197703","0.000070","10.4.14.2","10.1.2.2","TCP","1502","1825","55981 > 50000 [PSH, ACK] Seq=61917 Ack=1 Win=14600 Len=1428 TSval=298 TSecr=297"
"438","1.197823","0.000070","10.4.14.2","10.1.2.2","TCP","1502","1825","55981 > 50000 [PSH, ACK] Seq=63345 Ack=1 Win=14600 Len=1428 TSval=298 TSecr=297"
"440","1.197943","0.000070","10.4.14.2","10.1.2.2","TCP","1502","1825","55981 > 50000 [PSH, ACK] Seq=64773 Ack=1 Win=14600 Len=1428 TSval=298 TSecr=297"
"442","1.198063","0.000070","10.4.14.2","10.1.2.2","TCP","1502","1825","55981 > 50000 [PSH, ACK] Seq=66201 Ack=1 Win=14600 Len=1428 TSval=298 TSecr=297"
"444","1.198139","0.000025","10.4.14.2","10.1.2.2","TCP","944","1825","55981 > 50000 [PSH, ACK] Seq=67629 Ack=1 Win=14600 Len=870 TSval=298 TSecr=297"
"468","1.199631","0.000075","10.1.2.2","10.4.14.2","TCP","62","12869","50000 > 55981 [ACK] Seq=1 Ack=43353 Win=102952 Len=0 TSval=299 TSecr=298"
"469","1.199636","0.000005","10.1.2.2","10.4.14.2","TCP","62","13234","50000 > 55981 [ACK] Seq=1 Ack=44781 Win=105872 Len=0 TSval=299 TSecr=298"
"470","1.199641","0.000005","10.1.2.2","10.4.14.2","TCP","62","13599","50000 > 55981 [ACK] Seq=1 Ack=46209 Win=108792 Len=0 TSval=299 TSecr=298"
"471","1.199646","0.000005","10.1.2.2","10.4.14.2","TCP","62","13964","50000 > 55981 [ACK] Seq=1 Ack=47637 Win=111712 Len=0 TSval=299 TSecr=298"
"472","1.199651","0.000005","10.1.2.2","10.4.14.2","TCP","62","14329","50000 > 55981 [ACK] Seq=1 Ack=49065 Win=114632 Len=0 TSval=299 TSecr=298"
"473","1.199656","0.000005","10.1.2.2","10.4.14.2","TCP","62","14694","50000 > 55981 [ACK] Seq=1 Ack=50493 Win=117552 Len=0 TSval=299 TSecr=298"
"474","1.199661","0.000005","10.1.2.2","10.4.14.2","TCP","62","15059","50000 > 55981 [ACK] Seq=1 Ack=51921 Win=120472 Len=0 TSval=299 TSecr=298"
"475","1.199666","0.000005","10.1.2.2","10.4.14.2","TCP","62","15424","50000 > 55981 [ACK] Seq=1 Ack=53349 Win=123392 Len=0 TSval=299 TSecr=298"
"476","1.199671","0.000005","10.1.2.2","10.4.14.2","TCP","62","15789","50000 > 55981 [ACK] Seq=1 Ack=54777 Win=126312 Len=0 TSval=299 TSecr=298"
"477","1.199676","0.000005","10.1.2.2","10.4.14.2","TCP","62","16154","50000 > 55981 [ACK] Seq=1 Ack=56205 Win=129232 Len=0 TSval=299 TSecr=298"
"478","1.199681","0.000005","10.1.2.2","10.4.14.2","TCP","62","16519","50000 > 55981 [ACK] Seq=1 Ack=57633 Win=132152 Len=0 TSval=299 TSecr=298"
"479","1.199686","0.000005","10.1.2.2","10.4.14.2","TCP","62","16884","50000 > 55981 [ACK] Seq=1 Ack=59061 Win=135072 Len=0 TSval=299 TSecr=298"
"480","1.199691","0.000005","10.1.2.2","10.4.14.2","TCP","62","17249","50000 > 55981 [ACK] Seq=1 Ack=60489 Win=137992 Len=0 TSval=299 TSecr=298"
"482","1.199696","0.000003","10.1.2.2","10.4.14.2","TCP","62","17614","50000 > 55981 [ACK] Seq=1 Ack=61917 Win=140912 Len=0 TSval=299 TSecr=298"
"484","1.199701","0.000001","10.1.2.2","10.4.14.2","TCP","62","17979","50000 > 55981 [ACK] Seq=1 Ack=63345 Win=143832 Len=0 TSval=299 TSecr=298"
"486","1.199705","0.000000","10.1.2.2","10.4.14.2","TCP","62","18344","50000 > 55981 [ACK] Seq=1 Ack=64773 Win=146752 Len=0 TSval=299 TSecr=298"
"488","1.199710","0.000000","10.1.2.2","10.4.14.2","TCP","62","18709","50000 > 55981 [ACK] Seq=1 Ack=66201 Win=149672 Len=0 TSval=299 TSecr=298"
"490","1.199715","0.000000","10.1.2.2","10.4.14.2","TCP","62","19074","50000 > 55981 [ACK] Seq=1 Ack=67629 Win=152592 Len=0 TSval=299 TSecr=298"
"605","1.236000","0.003666","10.1.2.2","10.4.14.2","TCP","62","19439","50000 > 55981 [ACK] Seq=1 Ack=68499 Win=155512 Len=0 TSval=309 TSecr=298"
"606","1.237097","0.001097","10.4.14.2","10.1.2.2","TCP","62","1825","55981 > 50000 [FIN, ACK] Seq=68499 Ack=1 Win=14600 Len=0 TSval=309 TSecr=309"
"616","1.276000","0.003650","10.1.2.2","10.4.14.2","TCP","62","19439","50000 > 55981 [ACK] Seq=1 Ack=68500 Win=155512 Len=0 TSval=319 TSecr=309"
