"No.","Time","D_Time","Source","Destination","Protocol","Length","Sequence num","Ack number","data len","Calculated window size","Info"
"1","0.000000s","0.000000s","192.168.0.41","192.168.0.42","TCP","74","0","","","29200","51213 > 49200 [SYN] Seq=0 Win=29200 Len=0 MSS=1460 SACK_PERM=1 TSval=29524288 TSecr=0 WS=128"
"2","0.000062s","0.000062s","192.168.0.42","192.168.0.41","TCP","74","0","1","","28960","49200 > 51213 [SYN, ACK] Seq=0 Ack=1 Win=28960 Len=0 MSS=1460 SACK_PERM=1 TSval=29546158 TSecr=29524288 WS=128"
"3","0.000228s","0.000166s","192.168.0.41","192.168.0.42","TCP","66","1","1","","29312","51213 > 49200 [ACK] Seq=1 Ack=1 Win=29312 Len=0 TSval=29524288 TSecr=29546158"
"4","0.000402s","0.000174s","192.168.0.42","192.168.0.41","TCP","66","1","1","","29056","49200 > 51213 [FIN, ACK] Seq=1 Ack=1 Win=29056 Len=0 TSval=29546159 TSecr=29524288"
"5","0.002029s","0.001627s","192.168.0.41","192.168.0.42","TCP","66","1","2","","29312","51213 > 49200 [ACK] Seq=1 Ack=2 Win=29312 Len=0 TSval=29524289 TSecr=29546159"
"6","0.013791s","0.011762s","192.168.0.41","192.168.0.42","TCP","74","0","","","29200","36354 > 49201 [SYN] Seq=0 Win=29200 Len=0 MSS=1460 SACK_PERM=1 TSval=29524291 TSecr=0 WS=128"
"7","0.013832s","0.000041s","192.168.0.42","192.168.0.41","TCP","74","0","1","","28960","49201 > 36354 [SYN, ACK] Seq=0 Ack=1 Win=28960 Len=0 MSS=1460 SACK_PERM=1 TSval=29546162 TSecr=29524291 WS=128"
"8","0.014002s","0.000170s","192.168.0.41","192.168.0.42","TCP","66","1","1","","29312","36354 > 49201 [ACK] Seq=1 Ack=1 Win=29312 Len=0 TSval=29524291 TSecr=29546162"
"9","0.014126s","0.000124s","192.168.0.41","192.168.0.42","TCP","1514","1","2","1448","29312","51213 > 49200 [ACK] Seq=1 Ack=2 Win=29312 Len=1448 TSval=29524292 TSecr=29546159"
"10","0.014159s","0.000033s","192.168.0.42","192.168.0.41","TCP","66","1","1","","29056","49201 > 36354 [FIN, ACK] Seq=1 Ack=1 Win=29056 Len=0 TSval=29546162 TSecr=29524291"
"11","0.014165s","0.000006s","192.168.0.42","192.168.0.41","TCP","66","2","1449","","31872","49200 > 51213 [ACK] Seq=2 Ack=1449 Win=31872 Len=0 TSval=29546162 TSecr=29524292"
"12","0.014165s","0.000000s","192.168.0.41","192.168.0.42","TCP","1514","1449","2","1448","29312","51213 > 49200 [ACK] Seq=1449 Ack=2 Win=29312 Len=1448 TSval=29524292 TSecr=29546159"
"13","0.014173s","0.000008s","192.168.0.41","192.168.0.42","TCP","1514","2897","2","2896","29312","51213 > 49200 [ACK] Seq=2897 Ack=2 Win=29312 Len=1448 TSval=29524292 TSecr=29546159"
"14","0.014180s","0.000007s","192.168.0.41","192.168.0.42","TCP","1514","4345","2","4344","29312","51213 > 49200 [ACK] Seq=4345 Ack=2 Win=29312 Len=1448 TSval=29524292 TSecr=29546159"
"15","0.014185s","0.000005s","192.168.0.41","192.168.0.42","TCP","1514","5793","2","5792","29312","51213 > 49200 [ACK] Seq=5793 Ack=2 Win=29312 Len=1448 TSval=29524292 TSecr=29546159"
"16","0.014193s","0.000008s","192.168.0.41","192.168.0.42","TCP","1514","7241","2","7240","29312","51213 > 49200 [ACK] Seq=7241 Ack=2 Win=29312 Len=1448 TSval=29524292 TSecr=29546159"
"17","0.014197s","0.000004s","192.168.0.42","192.168.0.41","TCP","66","2","2897","","34816","49200 > 51213 [ACK] Seq=2 Ack=2897 Win=34816 Len=0 TSval=29546162 TSecr=29524292"
"18","0.014198s","0.000001s","192.168.0.41","192.168.0.42","TCP","1514","8689","2","7240","29312","51213 > 49200 [ACK] Seq=8689 Ack=2 Win=29312 Len=1448 TSval=29524292 TSecr=29546159"
"19","0.014203s","0.000005s","192.168.0.41","192.168.0.42","TCP","1514","10137","2","8688","29312","51213 > 49200 [ACK] Seq=10137 Ack=2 Win=29312 Len=1448 TSval=29524292 TSecr=29546159"
"20","0.014207s","0.000004s","192.168.0.41","192.168.0.42","TCP","1514","11585","2","10136","29312","51213 > 49200 [ACK] Seq=11585 Ack=2 Win=29312 Len=1448 TSval=29524292 TSecr=29546159"
"21","0.014209s","0.000002s","192.168.0.42","192.168.0.41","TCP","66","2","4345","","37760","49200 > 51213 [ACK] Seq=2 Ack=4345 Win=37760 Len=0 TSval=29546162 TSecr=29524292"
"22","0.014212s","0.000003s","192.168.0.41","192.168.0.42","TCP","1514","13033","2","10136","29312","51213 > 49200 [ACK] Seq=13033 Ack=2 Win=29312 Len=1448 TSval=29524292 TSecr=29546159"
"23","0.014217s","0.000005s","192.168.0.42","192.168.0.41","TCP","66","2","5793","","40576","49200 > 51213 [ACK] Seq=2 Ack=5793 Win=40576 Len=0 TSval=29546162 TSecr=29524292"
"24","0.014225s","0.000008s","192.168.0.42","192.168.0.41","TCP","66","2","7241","","43520","49200 > 51213 [ACK] Seq=2 Ack=7241 Win=43520 Len=0 TSval=29546162 TSecr=29524292"
"25","0.014233s","0.000008s","192.168.0.42","192.168.0.41","TCP","66","2","8689","","46336","49200 > 51213 [ACK] Seq=2 Ack=8689 Win=46336 Len=0 TSval=29546162 TSecr=29524292"
"26","0.014242s","0.000009s","192.168.0.42","192.168.0.41","TCP","66","2","10137","","49280","49200 > 51213 [ACK] Seq=2 Ack=10137 Win=49280 Len=0 TSval=29546162 TSecr=29524292"
"27","0.014264s","0.000022s","192.168.0.42","192.168.0.41","TCP","66","2","11585","","52224","49200 > 51213 [ACK] Seq=2 Ack=11585 Win=52224 Len=0 TSval=29546162 TSecr=29524292"
"28","0.014274s","0.000010s","192.168.0.42","192.168.0.41","TCP","66","2","13033","","55040","49200 > 51213 [ACK] Seq=2 Ack=13033 Win=55040 Len=0 TSval=29546162 TSecr=29524292"
"29","0.014284s","0.000010s","192.168.0.42","192.168.0.41","TCP","66","2","14481","","57984","49200 > 51213 [ACK] Seq=2 Ack=14481 Win=57984 Len=0 TSval=29546162 TSecr=29524292"
"30","0.014324s","0.000040s","192.168.0.41","192.168.0.42","TCP","1514","14481","2","1448","29312","51213 > 49200 [PSH, ACK] Seq=14481 Ack=2 Win=29312 Len=1448 TSval=29524292 TSecr=29546162"
"31","0.014336s","0.000012s","192.168.0.41","192.168.0.42","TCP","1514","15929","2","2896","29312","51213 > 49200 [ACK] Seq=15929 Ack=2 Win=29312 Len=1448 TSval=29524292 TSecr=29546162"
"32","0.014342s","0.000006s","192.168.0.41","192.168.0.42","TCP","1514","17377","2","4344","29312","51213 > 49200 [ACK] Seq=17377 Ack=2 Win=29312 Len=1448 TSval=29524292 TSecr=29546162"
"33","0.014344s","0.000002s","192.168.0.42","192.168.0.41","TCP","66","2","15929","","60928","49200 > 51213 [ACK] Seq=2 Ack=15929 Win=60928 Len=0 TSval=29546162 TSecr=29524292"
"34","0.014353s","0.000009s","192.168.0.42","192.168.0.41","TCP","66","2","17377","","63744","49200 > 51213 [ACK] Seq=2 Ack=17377 Win=63744 Len=0 TSval=29546162 TSecr=29524292"
"35","0.014360s","0.000007s","192.168.0.42","192.168.0.41","TCP","66","2","18825","","66688","49200 > 51213 [ACK] Seq=2 Ack=18825 Win=66688 Len=0 TSval=29546162 TSecr=29524292"
"36","0.014603s","0.000243s","192.168.0.41","192.168.0.42","TCP","1514","18825","2","1448","29312","51213 > 49200 [ACK] Seq=18825 Ack=2 Win=29312 Len=1448 TSval=29524292 TSecr=29546162"
"37","0.014637s","0.000034s","192.168.0.42","192.168.0.41","TCP","66","2","20273","","69504","49200 > 51213 [ACK] Seq=2 Ack=20273 Win=69504 Len=0 TSval=29546162 TSecr=29524292"
"38","0.014643s","0.000006s","192.168.0.41","192.168.0.42","TCP","1514","20273","2","1448","29312","51213 > 49200 [ACK] Seq=20273 Ack=2 Win=29312 Len=1448 TSval=29524292 TSecr=29546162"
"39","0.014658s","0.000015s","192.168.0.42","192.168.0.41","TCP","66","2","21721","","72448","49200 > 51213 [ACK] Seq=2 Ack=21721 Win=72448 Len=0 TSval=29546162 TSecr=29524292"
"40","0.014662s","0.000004s","192.168.0.41","192.168.0.42","TCP","1514","21721","2","1448","29312","51213 > 49200 [ACK] Seq=21721 Ack=2 Win=29312 Len=1448 TSval=29524292 TSecr=29546162"
"41","0.014675s","0.000013s","192.168.0.42","192.168.0.41","TCP","66","2","23169","","75392","49200 > 51213 [ACK] Seq=2 Ack=23169 Win=75392 Len=0 TSval=29546162 TSecr=29524292"
"42","0.014678s","0.000003s","192.168.0.41","192.168.0.42","TCP","1514","23169","2","1448","29312","51213 > 49200 [ACK] Seq=23169 Ack=2 Win=29312 Len=1448 TSval=29524292 TSecr=29546162"
"43","0.014690s","0.000012s","192.168.0.42","192.168.0.41","TCP","66","2","24617","","78208","49200 > 51213 [ACK] Seq=2 Ack=24617 Win=78208 Len=0 TSval=29546162 TSecr=29524292"
"44","0.014693s","0.000003s","192.168.0.41","192.168.0.42","TCP","1514","24617","2","1448","29312","51213 > 49200 [ACK] Seq=24617 Ack=2 Win=29312 Len=1448 TSval=29524292 TSecr=29546162"
"45","0.014703s","0.000010s","192.168.0.42","192.168.0.41","TCP","66","2","26065","","81152","49200 > 51213 [ACK] Seq=2 Ack=26065 Win=81152 Len=0 TSval=29546162 TSecr=29524292"
"46","0.014706s","0.000003s","192.168.0.41","192.168.0.42","TCP","1514","26065","2","1448","29312","51213 > 49200 [ACK] Seq=26065 Ack=2 Win=29312 Len=1448 TSval=29524292 TSecr=29546162"
"47","0.014716s","0.000010s","192.168.0.42","192.168.0.41","TCP","66","2","27513","","84096","49200 > 51213 [ACK] Seq=2 Ack=27513 Win=84096 Len=0 TSval=29546162 TSecr=29524292"
"48","0.014718s","0.000002s","192.168.0.41","192.168.0.42","TCP","1514","27513","2","1448","29312","51213 > 49200 [PSH, ACK] Seq=27513 Ack=2 Win=29312 Len=1448 TSval=29524292 TSecr=29546162"
"49","0.014729s","0.000011s","192.168.0.42","192.168.0.41","TCP","66","2","28961","","86912","49200 > 51213 [ACK] Seq=2 Ack=28961 Win=86912 Len=0 TSval=29546162 TSecr=29524292"
"50","0.017091s","0.002362s","192.168.0.41","192.168.0.42","TCP","74","0","","","29200","58643 > 49214 [SYN] Seq=0 Win=29200 Len=0 MSS=1460 SACK_PERM=1 TSval=29524292 TSecr=0 WS=128"
"51","0.017133s","0.000042s","192.168.0.42","192.168.0.41","TCP","74","0","1","","28960","49214 > 58643 [SYN, ACK] Seq=0 Ack=1 Win=28960 Len=0 MSS=1460 SACK_PERM=1 TSval=29546163 TSecr=29524292 WS=128"
"52","0.017301s","0.000168s","192.168.0.41","192.168.0.42","TCP","66","1","1","","29312","58643 > 49214 [ACK] Seq=1 Ack=1 Win=29312 Len=0 TSval=29524292 TSecr=29546163"
"53","0.017435s","0.000134s","192.168.0.42","192.168.0.41","TCP","66","1","1","","29056","49214 > 58643 [FIN, ACK] Seq=1 Ack=1 Win=29056 Len=0 TSval=29546163 TSecr=29524292"
"54","0.018039s","0.000604s","192.168.0.41","192.168.0.42","TCP","66","1","2","","29312","36354 > 49201 [ACK] Seq=1 Ack=2 Win=29312 Len=0 TSval=29524293 TSecr=29546162"
"55","0.018065s","0.000026s","192.168.0.41","192.168.0.42","TCP","66","1","2","","29312","58643 > 49214 [ACK] Seq=1 Ack=2 Win=29312 Len=0 TSval=29524293 TSecr=29546163"
"56","0.018077s","0.000012s","192.168.0.41","192.168.0.42","TCP","1514","28961","2","1448","29312","51213 > 49200 [ACK] Seq=28961 Ack=2 Win=29312 Len=1448 TSval=29524293 TSecr=29546162"
"57","0.018101s","0.000024s","192.168.0.42","192.168.0.41","TCP","66","2","30409","","89856","49200 > 51213 [ACK] Seq=2 Ack=30409 Win=89856 Len=0 TSval=29546163 TSecr=29524293"
"58","0.018106s","0.000005s","192.168.0.41","192.168.0.42","TCP","1514","30409","2","1448","29312","51213 > 49200 [ACK] Seq=30409 Ack=2 Win=29312 Len=1448 TSval=29524293 TSecr=29546162"
"59","0.018120s","0.000014s","192.168.0.42","192.168.0.41","TCP","66","2","31857","","92672","49200 > 51213 [ACK] Seq=2 Ack=31857 Win=92672 Len=0 TSval=29546163 TSecr=29524293"
"60","0.018122s","0.000002s","192.168.0.41","192.168.0.42","TCP","1514","31857","2","1448","29312","51213 > 49200 [ACK] Seq=31857 Ack=2 Win=29312 Len=1448 TSval=29524293 TSecr=29546162"
"61","0.018129s","0.000007s","192.168.0.42","192.168.0.41","TCP","66","2","33305","","95616","49200 > 51213 [ACK] Seq=2 Ack=33305 Win=95616 Len=0 TSval=29546163 TSecr=29524293"
"62","0.018131s","0.000002s","192.168.0.41","192.168.0.42","TCP","1514","33305","2","1448","29312","51213 > 49200 [ACK] Seq=33305 Ack=2 Win=29312 Len=1448 TSval=29524293 TSecr=29546162"
"63","0.018138s","0.000007s","192.168.0.42","192.168.0.41","TCP","66","2","34753","","98560","49200 > 51213 [ACK] Seq=2 Ack=34753 Win=98560 Len=0 TSval=29546163 TSecr=29524293"
"64","0.018139s","0.000001s","192.168.0.41","192.168.0.42","TCP","1514","34753","2","1448","29312","51213 > 49200 [ACK] Seq=34753 Ack=2 Win=29312 Len=1448 TSval=29524293 TSecr=29546162"
"65","0.018145s","0.000006s","192.168.0.42","192.168.0.41","TCP","66","2","36201","","101376","49200 > 51213 [ACK] Seq=2 Ack=36201 Win=101376 Len=0 TSval=29546163 TSecr=29524293"
"66","0.018147s","0.000002s","192.168.0.41","192.168.0.42","TCP","1514","36201","2","1448","29312","51213 > 49200 [ACK] Seq=36201 Ack=2 Win=29312 Len=1448 TSval=29524293 TSecr=29546162"
"67","0.018153s","0.000006s","192.168.0.42","192.168.0.41","TCP","66","2","37649","","104320","49200 > 51213 [ACK] Seq=2 Ack=37649 Win=104320 Len=0 TSval=29546163 TSecr=29524293"
"68","0.018155s","0.000002s","192.168.0.41","192.168.0.42","TCP","1514","37649","2","1448","29312","51213 > 49200 [ACK] Seq=37649 Ack=2 Win=29312 Len=1448 TSval=29524293 TSecr=29546162"
"69","0.018161s","0.000006s","192.168.0.42","192.168.0.41","TCP","66","2","39097","","107264","49200 > 51213 [ACK] Seq=2 Ack=39097 Win=107264 Len=0 TSval=29546163 TSecr=29524293"
"70","0.018163s","0.000002s","192.168.0.41","192.168.0.42","TCP","1514","39097","2","1448","29312","51213 > 49200 [ACK] Seq=39097 Ack=2 Win=29312 Len=1448 TSval=29524293 TSecr=29546162"
"71","0.018169s","0.000006s","192.168.0.42","192.168.0.41","TCP","66","2","40545","","110080","49200 > 51213 [ACK] Seq=2 Ack=40545 Win=110080 Len=0 TSval=29546163 TSecr=29524293"
"72","0.018171s","0.000002s","192.168.0.41","192.168.0.42","TCP","1514","40545","2","1448","29312","51213 > 49200 [ACK] Seq=40545 Ack=2 Win=29312 Len=1448 TSval=29524293 TSecr=29546162"
"73","0.018177s","0.000006s","192.168.0.42","192.168.0.41","TCP","66","2","41993","","113024","49200 > 51213 [ACK] Seq=2 Ack=41993 Win=113024 Len=0 TSval=29546163 TSecr=29524293"
"74","0.018253s","0.000076s","192.168.0.41","192.168.0.42","TCP","1514","41993","2","1448","29312","51213 > 49200 [ACK] Seq=41993 Ack=2 Win=29312 Len=1448 TSval=29524293 TSecr=29546162"
"75","0.018266s","0.000013s","192.168.0.42","192.168.0.41","TCP","66","2","43441","","115840","49200 > 51213 [ACK] Seq=2 Ack=43441 Win=115840 Len=0 TSval=29546163 TSecr=29524293"
"76","0.018268s","0.000002s","192.168.0.41","192.168.0.42","TCP","1514","43441","2","1448","29312","51213 > 49200 [ACK] Seq=43441 Ack=2 Win=29312 Len=1448 TSval=29524293 TSecr=29546162"
"77","0.018275s","0.000007s","192.168.0.42","192.168.0.41","TCP","66","2","44889","","118784","49200 > 51213 [ACK] Seq=2 Ack=44889 Win=118784 Len=0 TSval=29546163 TSecr=29524293"
"78","0.018277s","0.000002s","192.168.0.41","192.168.0.42","TCP","1514","44889","2","1448","29312","51213 > 49200 [ACK] Seq=44889 Ack=2 Win=29312 Len=1448 TSval=29524293 TSecr=29546162"
"79","0.018284s","0.000007s","192.168.0.42","192.168.0.41","TCP","66","2","46337","","121728","49200 > 51213 [ACK] Seq=2 Ack=46337 Win=121728 Len=0 TSval=29546163 TSecr=29524293"
"80","0.018286s","0.000002s","192.168.0.41","192.168.0.42","TCP","1514","46337","2","1448","29312","51213 > 49200 [ACK] Seq=46337 Ack=2 Win=29312 Len=1448 TSval=29524293 TSecr=29546162"
"81","0.018292s","0.000006s","192.168.0.42","192.168.0.41","TCP","66","2","47785","","124544","49200 > 51213 [ACK] Seq=2 Ack=47785 Win=124544 Len=0 TSval=29546163 TSecr=29524293"
"82","0.018294s","0.000002s","192.168.0.41","192.168.0.42","TCP","1514","47785","2","1448","29312","51213 > 49200 [ACK] Seq=47785 Ack=2 Win=29312 Len=1448 TSval=29524293 TSecr=29546162"
"83","0.018300s","0.000006s","192.168.0.42","192.168.0.41","TCP","66","2","49233","","127488","49200 > 51213 [ACK] Seq=2 Ack=49233 Win=127488 Len=0 TSval=29546163 TSecr=29524293"
"84","0.018302s","0.000002s","192.168.0.41","192.168.0.42","TCP","1514","49233","2","1448","29312","51213 > 49200 [ACK] Seq=49233 Ack=2 Win=29312 Len=1448 TSval=29524293 TSecr=29546162"
"85","0.018308s","0.000006s","192.168.0.42","192.168.0.41","TCP","66","2","50681","","130432","49200 > 51213 [ACK] Seq=2 Ack=50681 Win=130432 Len=0 TSval=29546163 TSecr=29524293"
"86","0.018310s","0.000002s","192.168.0.41","192.168.0.42","TCP","1514","50681","2","1448","29312","51213 > 49200 [ACK] Seq=50681 Ack=2 Win=29312 Len=1448 TSval=29524293 TSecr=29546162"
"87","0.018316s","0.000006s","192.168.0.42","192.168.0.41","TCP","66","2","52129","","133248","49200 > 51213 [ACK] Seq=2 Ack=52129 Win=133248 Len=0 TSval=29546163 TSecr=29524293"
"88","0.018318s","0.000002s","192.168.0.41","192.168.0.42","TCP","1514","52129","2","1448","29312","51213 > 49200 [ACK] Seq=52129 Ack=2 Win=29312 Len=1448 TSval=29524293 TSecr=29546162"
"89","0.018324s","0.000006s","192.168.0.42","192.168.0.41","TCP","66","2","53577","","136192","49200 > 51213 [ACK] Seq=2 Ack=53577 Win=136192 Len=0 TSval=29546163 TSecr=29524293"
"90","0.018326s","0.000002s","192.168.0.41","192.168.0.42","TCP","1514","53577","2","1448","29312","51213 > 49200 [ACK] Seq=53577 Ack=2 Win=29312 Len=1448 TSval=29524293 TSecr=29546163"
"91","0.018332s","0.000006s","192.168.0.42","192.168.0.41","TCP","66","2","55025","","139008","49200 > 51213 [ACK] Seq=2 Ack=55025 Win=139008 Len=0 TSval=29546163 TSecr=29524293"
"92","0.018334s","0.000002s","192.168.0.41","192.168.0.42","TCP","1514","55025","2","1448","29312","51213 > 49200 [ACK] Seq=55025 Ack=2 Win=29312 Len=1448 TSval=29524293 TSecr=29546163"
"93","0.018340s","0.000006s","192.168.0.42","192.168.0.41","TCP","66","2","56473","","141952","49200 > 51213 [ACK] Seq=2 Ack=56473 Win=141952 Len=0 TSval=29546163 TSecr=29524293"
"94","0.018342s","0.000002s","192.168.0.41","192.168.0.42","TCP","1514","56473","2","1448","29312","51213 > 49200 [ACK] Seq=56473 Ack=2 Win=29312 Len=1448 TSval=29524293 TSecr=29546163"
"95","0.018348s","0.000006s","192.168.0.42","192.168.0.41","TCP","66","2","57921","","144896","49200 > 51213 [ACK] Seq=2 Ack=57921 Win=144896 Len=0 TSval=29546163 TSecr=29524293"
"96","0.018350s","0.000002s","192.168.0.41","192.168.0.42","TCP","1514","57921","2","1448","29312","51213 > 49200 [ACK] Seq=57921 Ack=2 Win=29312 Len=1448 TSval=29524293 TSecr=29546163"
"97","0.018356s","0.000006s","192.168.0.42","192.168.0.41","TCP","66","2","59369","","147712","49200 > 51213 [ACK] Seq=2 Ack=59369 Win=147712 Len=0 TSval=29546163 TSecr=29524293"
"98","0.018358s","0.000002s","192.168.0.41","192.168.0.42","TCP","1514","59369","2","1448","29312","51213 > 49200 [ACK] Seq=59369 Ack=2 Win=29312 Len=1448 TSval=29524293 TSecr=29546163"
"99","0.018364s","0.000006s","192.168.0.42","192.168.0.41","TCP","66","2","60817","","150656","49200 > 51213 [ACK] Seq=2 Ack=60817 Win=150656 Len=0 TSval=29546163 TSecr=29524293"
"100","0.018366s","0.000002s","192.168.0.41","192.168.0.42","TCP","1514","60817","2","1448","29312","51213 > 49200 [ACK] Seq=60817 Ack=2 Win=29312 Len=1448 TSval=29524293 TSecr=29546163"
"101","0.018372s","0.000006s","192.168.0.42","192.168.0.41","TCP","66","2","62265","","153600","49200 > 51213 [ACK] Seq=2 Ack=62265 Win=153600 Len=0 TSval=29546163 TSecr=29524293"
"102","0.018374s","0.000002s","192.168.0.41","192.168.0.42","TCP","1514","62265","2","1448","29312","51213 > 49200 [ACK] Seq=62265 Ack=2 Win=29312 Len=1448 TSval=29524293 TSecr=29546163"
"103","0.018380s","0.000006s","192.168.0.42","192.168.0.41","TCP","66","2","63713","","156416","49200 > 51213 [ACK] Seq=2 Ack=63713 Win=156416 Len=0 TSval=29546163 TSecr=29524293"
"104","0.018382s","0.000002s","192.168.0.41","192.168.0.42","TCP","1514","63713","2","1448","29312","51213 > 49200 [ACK] Seq=63713 Ack=2 Win=29312 Len=1448 TSval=29524293 TSecr=29546163"
"105","0.018388s","0.000006s","192.168.0.42","192.168.0.41","TCP","66","2","65161","","159360","49200 > 51213 [ACK] Seq=2 Ack=65161 Win=159360 Len=0 TSval=29546163 TSecr=29524293"
"106","0.018507s","0.000119s","192.168.0.41","192.168.0.42","TCP","1514","65161","2","1448","29312","51213 > 49200 [ACK] Seq=65161 Ack=2 Win=29312 Len=1448 TSval=29524293 TSecr=29546163"
"107","0.018517s","0.000010s","192.168.0.42","192.168.0.41","TCP","66","2","66609","","162048","49200 > 51213 [ACK] Seq=2 Ack=66609 Win=162048 Len=0 TSval=29546163 TSecr=29524293"
"108","0.018520s","0.000003s","192.168.0.41","192.168.0.42","TCP","1514","66609","2","1448","29312","51213 > 49200 [ACK] Seq=66609 Ack=2 Win=29312 Len=1448 TSval=29524293 TSecr=29546163"
"109","0.018527s","0.000007s","192.168.0.42","192.168.0.41","TCP","66","2","68057","","161024","49200 > 51213 [ACK] Seq=2 Ack=68057 Win=161024 Len=0 TSval=29546163 TSecr=29524293"
"110","0.018529s","0.000002s","192.168.0.41","192.168.0.42","TCP","1514","68057","2","1448","29312","51213 > 49200 [ACK] Seq=68057 Ack=2 Win=29312 Len=1448 TSval=29524293 TSecr=29546163"
"111","0.018535s","0.000006s","192.168.0.42","192.168.0.41","TCP","66","2","69505","","160128","49200 > 51213 [ACK] Seq=2 Ack=69505 Win=160128 Len=0 TSval=29546163 TSecr=29524293"
"112","0.018537s","0.000002s","192.168.0.41","192.168.0.42","TCP","1514","69505","2","1448","29312","51213 > 49200 [ACK] Seq=69505 Ack=2 Win=29312 Len=1448 TSval=29524293 TSecr=29546163"
"113","0.018543s","0.000006s","192.168.0.42","192.168.0.41","TCP","66","2","70953","","159104","49200 > 51213 [ACK] Seq=2 Ack=70953 Win=159104 Len=0 TSval=29546163 TSecr=29524293"
"114","0.018545s","0.000002s","192.168.0.41","192.168.0.42","TCP","1514","70953","2","1448","29312","51213 > 49200 [ACK] Seq=70953 Ack=2 Win=29312 Len=1448 TSval=29524293 TSecr=29546163"
"115","0.018551s","0.000006s","192.168.0.42","192.168.0.41","TCP","66","2","72401","","158208","49200 > 51213 [ACK] Seq=2 Ack=72401 Win=158208 Len=0 TSval=29546163 TSecr=29524293"
"116","0.018553s","0.000002s","192.168.0.41","192.168.0.42","TCP","1514","72401","2","1448","29312","51213 > 49200 [PSH, ACK] Seq=72401 Ack=2 Win=29312 Len=1448 TSval=29524293 TSecr=29546163"
"117","0.018559s","0.000006s","192.168.0.42","192.168.0.41","TCP","66","2","73849","","157184","49200 > 51213 [ACK] Seq=2 Ack=73849 Win=157184 Len=0 TSval=29546163 TSecr=29524293"
"118","0.018561s","0.000002s","192.168.0.41","192.168.0.42","TCP","1514","73849","2","1448","29312","51213 > 49200 [PSH, ACK] Seq=73849 Ack=2 Win=29312 Len=1448 TSval=29524293 TSecr=29546163"
"119","0.018567s","0.000006s","192.168.0.42","192.168.0.41","TCP","66","2","75297","","156288","49200 > 51213 [ACK] Seq=2 Ack=75297 Win=156288 Len=0 TSval=29546163 TSecr=29524293"
"120","0.019948s","0.001381s","192.168.0.41","192.168.0.42","TCP","74","0","","","29200","57429 > 49216 [SYN] Seq=0 Win=29200 Len=0 MSS=1460 SACK_PERM=1 TSval=29524293 TSecr=0 WS=128"
"121","0.019997s","0.000049s","192.168.0.42","192.168.0.41","TCP","74","0","1","","28960","49216 > 57429 [SYN, ACK] Seq=0 Ack=1 Win=28960 Len=0 MSS=1460 SACK_PERM=1 TSval=29546163 TSecr=29524293 WS=128"
"122","0.020353s","0.000356s","192.168.0.41","192.168.0.42","TCP","66","1","1","","29312","57429 > 49216 [ACK] Seq=1 Ack=1 Win=29312 Len=0 TSval=29524293 TSecr=29546163"
"123","0.020447s","0.000094s","192.168.0.42","192.168.0.41","TCP","66","1","1","","29056","49216 > 57429 [FIN, ACK] Seq=1 Ack=1 Win=29056 Len=0 TSval=29546164 TSecr=29524293"
"124","0.022066s","0.001619s","192.168.0.41","192.168.0.42","TCP","66","1","2","","29312","57429 > 49216 [ACK] Seq=1 Ack=2 Win=29312 Len=0 TSval=29524294 TSecr=29546164"
"125","0.022097s","0.000031s","192.168.0.41","192.168.0.42","TCP","1514","75297","2","1448","29312","51213 > 49200 [ACK] Seq=75297 Ack=2 Win=29312 Len=1448 TSval=29524294 TSecr=29546163"
"126","0.022120s","0.000023s","192.168.0.42","192.168.0.41","TCP","66","2","76745","","165120","49200 > 51213 [ACK] Seq=2 Ack=76745 Win=165120 Len=0 TSval=29546164 TSecr=29524294"
"127","0.022125s","0.000005s","192.168.0.41","192.168.0.42","TCP","1514","76745","2","1448","29312","51213 > 49200 [ACK] Seq=76745 Ack=2 Win=29312 Len=1448 TSval=29524294 TSecr=29546163"
"128","0.022139s","0.000014s","192.168.0.42","192.168.0.41","TCP","66","2","78193","","168064","49200 > 51213 [ACK] Seq=2 Ack=78193 Win=168064 Len=0 TSval=29546164 TSecr=29524294"
"129","0.022141s","0.000002s","192.168.0.41","192.168.0.42","TCP","1514","78193","2","1448","29312","51213 > 49200 [ACK] Seq=78193 Ack=2 Win=29312 Len=1448 TSval=29524294 TSecr=29546163"
"130","0.022153s","0.000012s","192.168.0.42","192.168.0.41","TCP","66","2","79641","","170880","49200 > 51213 [ACK] Seq=2 Ack=79641 Win=170880 Len=0 TSval=29546164 TSecr=29524294"
"131","0.022158s","0.000005s","192.168.0.41","192.168.0.42","TCP","1514","79641","2","1448","29312","51213 > 49200 [ACK] Seq=79641 Ack=2 Win=29312 Len=1448 TSval=29524294 TSecr=29546163"
"132","0.022170s","0.000012s","192.168.0.42","192.168.0.41","TCP","66","2","81089","","173824","49200 > 51213 [ACK] Seq=2 Ack=81089 Win=173824 Len=0 TSval=29546164 TSecr=29524294"
"133","0.022173s","0.000003s","192.168.0.41","192.168.0.42","TCP","1514","81089","2","1448","29312","51213 > 49200 [ACK] Seq=81089 Ack=2 Win=29312 Len=1448 TSval=29524294 TSecr=29546163"
"134","0.022183s","0.000010s","192.168.0.42","192.168.0.41","TCP","66","2","82537","","176768","49200 > 51213 [ACK] Seq=2 Ack=82537 Win=176768 Len=0 TSval=29546164 TSecr=29524294"
"135","0.022185s","0.000002s","192.168.0.41","192.168.0.42","TCP","1514","82537","2","1448","29312","51213 > 49200 [ACK] Seq=82537 Ack=2 Win=29312 Len=1448 TSval=29524294 TSecr=29546163"
"136","0.022196s","0.000011s","192.168.0.42","192.168.0.41","TCP","66","2","83985","","179584","49200 > 51213 [ACK] Seq=2 Ack=83985 Win=179584 Len=0 TSval=29546164 TSecr=29524294"
"137","0.022199s","0.000003s","192.168.0.41","192.168.0.42","TCP","1514","83985","2","1448","29312","51213 > 49200 [ACK] Seq=83985 Ack=2 Win=29312 Len=1448 TSval=29524294 TSecr=29546163"
"138","0.022209s","0.000010s","192.168.0.42","192.168.0.41","TCP","66","2","85433","","181376","49200 > 51213 [ACK] Seq=2 Ack=85433 Win=181376 Len=0 TSval=29546164 TSecr=29524294"
"139","0.022212s","0.000003s","192.168.0.41","192.168.0.42","TCP","1514","85433","2","1448","29312","51213 > 49200 [ACK] Seq=85433 Ack=2 Win=29312 Len=1448 TSval=29524294 TSecr=29546163"
"140","0.022222s","0.000010s","192.168.0.42","192.168.0.41","TCP","66","2","86881","","180352","49200 > 51213 [ACK] Seq=2 Ack=86881 Win=180352 Len=0 TSval=29546164 TSecr=29524294"
"141","0.022224s","0.000002s","192.168.0.41","192.168.0.42","TCP","1514","86881","2","1448","29312","51213 > 49200 [ACK] Seq=86881 Ack=2 Win=29312 Len=1448 TSval=29524294 TSecr=29546163"
"142","0.022237s","0.000013s","192.168.0.42","192.168.0.41","TCP","66","2","88329","","179456","49200 > 51213 [ACK] Seq=2 Ack=88329 Win=179456 Len=0 TSval=29546164 TSecr=29524294"
"143","0.022240s","0.000003s","192.168.0.41","192.168.0.42","TCP","1514","88329","2","1448","29312","51213 > 49200 [ACK] Seq=88329 Ack=2 Win=29312 Len=1448 TSval=29524294 TSecr=29546163"
"144","0.022251s","0.000011s","192.168.0.42","192.168.0.41","TCP","66","2","89777","","178432","49200 > 51213 [ACK] Seq=2 Ack=89777 Win=178432 Len=0 TSval=29546164 TSecr=29524294"
"145","0.022253s","0.000002s","192.168.0.41","192.168.0.42","TCP","1514","89777","2","1448","29312","51213 > 49200 [ACK] Seq=89777 Ack=2 Win=29312 Len=1448 TSval=29524294 TSecr=29546163"
"146","0.022263s","0.000010s","192.168.0.42","192.168.0.41","TCP","66","2","91225","","177536","49200 > 51213 [ACK] Seq=2 Ack=91225 Win=177536 Len=0 TSval=29546164 TSecr=29524294"
"147","0.022266s","0.000003s","192.168.0.41","192.168.0.42","TCP","1514","91225","2","1448","29312","51213 > 49200 [ACK] Seq=91225 Ack=2 Win=29312 Len=1448 TSval=29524294 TSecr=29546163"
"148","0.022275s","0.000009s","192.168.0.41","192.168.0.42","TCP","1514","92673","2","2896","29312","51213 > 49200 [ACK] Seq=92673 Ack=2 Win=29312 Len=1448 TSval=29524294 TSecr=29546163"
"149","0.022282s","0.000007s","192.168.0.41","192.168.0.42","TCP","1514","94121","2","4344","29312","51213 > 49200 [ACK] Seq=94121 Ack=2 Win=29312 Len=1448 TSval=29524294 TSecr=29546163"
"150","0.022287s","0.000005s","192.168.0.41","192.168.0.42","TCP","1514","95569","2","5792","29312","51213 > 49200 [ACK] Seq=95569 Ack=2 Win=29312 Len=1448 TSval=29524294 TSecr=29546163"
"151","0.022306s","0.000019s","192.168.0.41","192.168.0.42","TCP","1514","97017","2","7240","29312","51213 > 49200 [ACK] Seq=97017 Ack=2 Win=29312 Len=1448 TSval=29524294 TSecr=29546163"
"152","0.022311s","0.000005s","192.168.0.41","192.168.0.42","TCP","1514","98465","2","8688","29312","51213 > 49200 [ACK] Seq=98465 Ack=2 Win=29312 Len=1448 TSval=29524294 TSecr=29546163"
"153","0.022314s","0.000003s","192.168.0.42","192.168.0.41","TCP","66","2","97017","","173696","49200 > 51213 [ACK] Seq=2 Ack=97017 Win=173696 Len=0 TSval=29546164 TSecr=29524294"
"154","0.022316s","0.000002s","192.168.0.41","192.168.0.42","TCP","1514","99913","2","4344","29312","51213 > 49200 [ACK] Seq=99913 Ack=2 Win=29312 Len=1448 TSval=29524294 TSecr=29546163"
"155","0.022358s","0.000042s","192.168.0.42","192.168.0.41","TCP","66","2","101361","","170752","49200 > 51213 [ACK] Seq=2 Ack=101361 Win=170752 Len=0 TSval=29546164 TSecr=29524294"
"156","0.022378s","0.000020s","192.168.0.41","192.168.0.42","TCP","1514","101361","2","1448","29312","51213 > 49200 [ACK] Seq=101361 Ack=2 Win=29312 Len=1448 TSval=29524294 TSecr=29546163"
"157","0.022393s","0.000015s","192.168.0.41","192.168.0.42","TCP","1514","102809","2","2896","29312","51213 > 49200 [ACK] Seq=102809 Ack=2 Win=29312 Len=1448 TSval=29524294 TSecr=29546164"
"158","0.022400s","0.000007s","192.168.0.41","192.168.0.42","TCP","1514","104257","2","4344","29312","51213 > 49200 [ACK] Seq=104257 Ack=2 Win=29312 Len=1448 TSval=29524294 TSecr=29546164"
"159","0.022405s","0.000005s","192.168.0.41","192.168.0.42","TCP","1514","105705","2","5792","29312","51213 > 49200 [ACK] Seq=105705 Ack=2 Win=29312 Len=1448 TSval=29524294 TSecr=29546164"
"160","0.022413s","0.000008s","192.168.0.41","192.168.0.42","TCP","1514","107153","2","7240","29312","51213 > 49200 [ACK] Seq=107153 Ack=2 Win=29312 Len=1448 TSval=29524294 TSecr=29546164"
"161","0.022420s","0.000007s","192.168.0.41","192.168.0.42","TCP","1514","108601","2","8688","29312","51213 > 49200 [ACK] Seq=108601 Ack=2 Win=29312 Len=1448 TSval=29524294 TSecr=29546164"
"162","0.022426s","0.000006s","192.168.0.41","192.168.0.42","TCP","1514","110049","2","10136","29312","51213 > 49200 [ACK] Seq=110049 Ack=2 Win=29312 Len=1448 TSval=29524294 TSecr=29546164"
"163","0.022430s","0.000004s","192.168.0.42","192.168.0.41","TCP","66","2","108601","","165888","49200 > 51213 [ACK] Seq=2 Ack=108601 Win=165888 Len=0 TSval=29546164 TSecr=29524294"
"164","0.022431s","0.000001s","192.168.0.41","192.168.0.42","TCP","1514","111497","2","4344","29312","51213 > 49200 [ACK] Seq=111497 Ack=2 Win=29312 Len=1448 TSval=29524294 TSecr=29546164"
"165","0.022470s","0.000039s","192.168.0.42","192.168.0.41","TCP","66","2","112945","","162944","49200 > 51213 [ACK] Seq=2 Ack=112945 Win=162944 Len=0 TSval=29546164 TSecr=29524294"
"166","0.022634s","0.000164s","192.168.0.41","192.168.0.42","TCP","1514","112945","2","1448","29312","51213 > 49200 [ACK] Seq=112945 Ack=2 Win=29312 Len=1448 TSval=29524294 TSecr=29546164"
"167","0.022645s","0.000011s","192.168.0.41","192.168.0.42","TCP","1514","114393","2","2896","29312","51213 > 49200 [ACK] Seq=114393 Ack=2 Win=29312 Len=1448 TSval=29524294 TSecr=29546164"
"168","0.022658s","0.000013s","192.168.0.42","192.168.0.41","TCP","66","2","115841","","178432","49200 > 51213 [ACK] Seq=2 Ack=115841 Win=178432 Len=0 TSval=29546164 TSecr=29524294"
"169","0.022662s","0.000004s","192.168.0.41","192.168.0.42","TCP","1514","115841","2","1448","29312","51213 > 49200 [ACK] Seq=115841 Ack=2 Win=29312 Len=1448 TSval=29524294 TSecr=29546164"
"170","0.022668s","0.000006s","192.168.0.41","192.168.0.42","TCP","1514","117289","2","2896","29312","51213 > 49200 [ACK] Seq=117289 Ack=2 Win=29312 Len=1448 TSval=29524294 TSecr=29546164"
"171","0.022674s","0.000006s","192.168.0.41","192.168.0.42","TCP","1514","118737","2","4344","29312","51213 > 49200 [ACK] Seq=118737 Ack=2 Win=29312 Len=1448 TSval=29524294 TSecr=29546164"
"172","0.022679s","0.000005s","192.168.0.41","192.168.0.42","TCP","1514","120185","2","5792","29312","51213 > 49200 [PSH, ACK] Seq=120185 Ack=2 Win=29312 Len=1448 TSval=29524294 TSecr=29546164"
"173","0.022706s","0.000027s","192.168.0.42","192.168.0.41","TCP","66","2","121633","","174592","49200 > 51213 [ACK] Seq=2 Ack=121633 Win=174592 Len=0 TSval=29546164 TSecr=29524294"
"174","0.026256s","0.003550s","192.168.0.41","192.168.0.42","TCP","1514","121633","2","1448","29312","51213 > 49200 [ACK] Seq=121633 Ack=2 Win=29312 Len=1448 TSval=29524295 TSecr=29546164"
"175","0.026292s","0.000036s","192.168.0.42","192.168.0.41","TCP","66","2","123081","","185344","49200 > 51213 [ACK] Seq=2 Ack=123081 Win=185344 Len=0 TSval=29546165 TSecr=29524295"
"176","0.026298s","0.000006s","192.168.0.41","192.168.0.42","TCP","1514","123081","2","1448","29312","51213 > 49200 [ACK] Seq=123081 Ack=2 Win=29312 Len=1448 TSval=29524295 TSecr=29546164"
"177","0.026314s","0.000016s","192.168.0.42","192.168.0.41","TCP","66","2","124529","","185856","49200 > 51213 [ACK] Seq=2 Ack=124529 Win=185856 Len=0 TSval=29546165 TSecr=29524295"
"178","0.026318s","0.000004s","192.168.0.41","192.168.0.42","TCP","1514","124529","2","1448","29312","51213 > 49200 [ACK] Seq=124529 Ack=2 Win=29312 Len=1448 TSval=29524295 TSecr=29546164"
"179","0.026328s","0.000010s","192.168.0.41","192.168.0.42","TCP","1514","125977","2","2896","29312","51213 > 49200 [ACK] Seq=125977 Ack=2 Win=29312 Len=1448 TSval=29524295 TSecr=29546164"
"180","0.026335s","0.000007s","192.168.0.41","192.168.0.42","TCP","1514","127425","2","4344","29312","51213 > 49200 [ACK] Seq=127425 Ack=2 Win=29312 Len=1448 TSval=29524295 TSecr=29546164"
"181","0.026342s","0.000007s","192.168.0.41","192.168.0.42","TCP","1514","128873","2","5792","29312","51213 > 49200 [ACK] Seq=128873 Ack=2 Win=29312 Len=1448 TSval=29524295 TSecr=29546164"
"182","0.026348s","0.000006s","192.168.0.41","192.168.0.42","TCP","1514","130321","2","7240","29312","51213 > 49200 [ACK] Seq=130321 Ack=2 Win=29312 Len=1448 TSval=29524295 TSecr=29546164"
"183","0.026352s","0.000004s","192.168.0.41","192.168.0.42","TCP","1514","131769","2","8688","29312","51213 > 49200 [ACK] Seq=131769 Ack=2 Win=29312 Len=1448 TSval=29524295 TSecr=29546164"
"184","0.026353s","0.000001s","192.168.0.42","192.168.0.41","TCP","66","2","128873","","183296","49200 > 51213 [ACK] Seq=2 Ack=128873 Win=183296 Len=0 TSval=29546165 TSecr=29524295"
"185","0.026357s","0.000004s","192.168.0.41","192.168.0.42","TCP","1514","133217","2","5792","29312","51213 > 49200 [ACK] Seq=133217 Ack=2 Win=29312 Len=1448 TSval=29524295 TSecr=29546164"
"186","0.026363s","0.000006s","192.168.0.41","192.168.0.42","TCP","1514","134665","2","7240","29312","51213 > 49200 [ACK] Seq=134665 Ack=2 Win=29312 Len=1448 TSval=29524295 TSecr=29546164"
"187","0.026369s","0.000006s","192.168.0.41","192.168.0.42","TCP","1514","136113","2","8688","29312","51213 > 49200 [ACK] Seq=136113 Ack=2 Win=29312 Len=1448 TSval=29524295 TSecr=29546164"
"188","0.026374s","0.000005s","192.168.0.41","192.168.0.42","TCP","1514","137561","2","10136","29312","51213 > 49200 [ACK] Seq=137561 Ack=2 Win=29312 Len=1448 TSval=29524295 TSecr=29546164"
"189","0.026380s","0.000006s","192.168.0.41","192.168.0.42","TCP","1514","139009","2","11584","29312","51213 > 49200 [ACK] Seq=139009 Ack=2 Win=29312 Len=1448 TSval=29524295 TSecr=29546164"
"190","0.026386s","0.000006s","192.168.0.41","192.168.0.42","TCP","1514","140457","2","13032","29312","51213 > 49200 [ACK] Seq=140457 Ack=2 Win=29312 Len=1448 TSval=29524295 TSecr=29546164"
"191","0.026393s","0.000007s","192.168.0.41","192.168.0.42","TCP","1514","141905","2","14480","29312","51213 > 49200 [ACK] Seq=141905 Ack=2 Win=29312 Len=1448 TSval=29524295 TSecr=29546164"
"192","0.026398s","0.000005s","192.168.0.41","192.168.0.42","TCP","1514","143353","2","15928","29312","51213 > 49200 [ACK] Seq=143353 Ack=2 Win=29312 Len=1448 TSval=29524295 TSecr=29546164"
"193","0.026400s","0.000002s","192.168.0.42","192.168.0.41","TCP","66","2","141905","","174592","49200 > 51213 [ACK] Seq=2 Ack=141905 Win=174592 Len=0 TSval=29546165 TSecr=29524295"
"194","0.026413s","0.000013s","192.168.0.41","192.168.0.42","TCP","1514","144801","2","4344","29312","51213 > 49200 [ACK] Seq=144801 Ack=2 Win=29312 Len=1448 TSval=29524295 TSecr=29546164"
"195","0.026419s","0.000006s","192.168.0.41","192.168.0.42","TCP","1514","146249","2","5792","29312","51213 > 49200 [ACK] Seq=146249 Ack=2 Win=29312 Len=1448 TSval=29524295 TSecr=29546164"
"196","0.026427s","0.000008s","192.168.0.41","192.168.0.42","TCP","1514","147697","2","7240","29312","51213 > 49200 [ACK] Seq=147697 Ack=2 Win=29312 Len=1448 TSval=29524295 TSecr=29546164"
"197","0.026433s","0.000006s","192.168.0.41","192.168.0.42","TCP","1514","149145","2","8688","29312","51213 > 49200 [ACK] Seq=149145 Ack=2 Win=29312 Len=1448 TSval=29524295 TSecr=29546164"
"198","0.026439s","0.000006s","192.168.0.41","192.168.0.42","TCP","1514","150593","2","10136","29312","51213 > 49200 [ACK] Seq=150593 Ack=2 Win=29312 Len=1448 TSval=29524295 TSecr=29546165"
"199","0.026443s","0.000004s","192.168.0.42","192.168.0.41","TCP","66","2","149145","","169856","49200 > 51213 [ACK] Seq=2 Ack=149145 Win=169856 Len=0 TSval=29546165 TSecr=29524295"
"200","0.026444s","0.000001s","192.168.0.41","192.168.0.42","TCP","1514","152041","2","4344","29312","51213 > 49200 [ACK] Seq=152041 Ack=2 Win=29312 Len=1448 TSval=29524295 TSecr=29546165"
"201","0.026484s","0.000040s","192.168.0.42","192.168.0.41","TCP","66","2","153489","","166784","49200 > 51213 [ACK] Seq=2 Ack=153489 Win=166784 Len=0 TSval=29546165 TSecr=29524295"
"202","0.026761s","0.000277s","192.168.0.41","192.168.0.42","TCP","1514","153489","2","1448","29312","51213 > 49200 [ACK] Seq=153489 Ack=2 Win=29312 Len=1448 TSval=29524295 TSecr=29546165"
"203","0.026784s","0.000023s","192.168.0.41","192.168.0.42","TCP","1514","154937","2","2896","29312","51213 > 49200 [ACK] Seq=154937 Ack=2 Win=29312 Len=1448 TSval=29524295 TSecr=29546165"
"204","0.026804s","0.000020s","192.168.0.42","192.168.0.41","TCP","66","2","156385","","185216","49200 > 51213 [ACK] Seq=2 Ack=156385 Win=185216 Len=0 TSval=29546165 TSecr=29524295"
"205","0.026809s","0.000005s","192.168.0.41","192.168.0.42","TCP","1514","156385","2","1448","29312","51213 > 49200 [ACK] Seq=156385 Ack=2 Win=29312 Len=1448 TSval=29524295 TSecr=29546165"
"206","0.026819s","0.000010s","192.168.0.41","192.168.0.42","TCP","1514","157833","2","2896","29312","51213 > 49200 [ACK] Seq=157833 Ack=2 Win=29312 Len=1448 TSval=29524295 TSecr=29546165"
"207","0.026826s","0.000007s","192.168.0.41","192.168.0.42","TCP","1514","159281","2","4344","29312","51213 > 49200 [ACK] Seq=159281 Ack=2 Win=29312 Len=1448 TSval=29524295 TSecr=29546165"
"208","0.026833s","0.000007s","192.168.0.41","192.168.0.42","TCP","1514","160729","2","5792","29312","51213 > 49200 [ACK] Seq=160729 Ack=2 Win=29312 Len=1448 TSval=29524295 TSecr=29546165"
"209","0.026839s","0.000006s","192.168.0.41","192.168.0.42","TCP","1514","162177","2","7240","29312","51213 > 49200 [ACK] Seq=162177 Ack=2 Win=29312 Len=1448 TSval=29524295 TSecr=29546165"
"210","0.026846s","0.000007s","192.168.0.41","192.168.0.42","TCP","1514","163625","2","8688","29312","51213 > 49200 [ACK] Seq=163625 Ack=2 Win=29312 Len=1448 TSval=29524295 TSecr=29546165"
"211","0.026853s","0.000007s","192.168.0.41","192.168.0.42","TCP","1514","165073","2","10136","29312","51213 > 49200 [ACK] Seq=165073 Ack=2 Win=29312 Len=1448 TSval=29524295 TSecr=29546165"
"212","0.026858s","0.000005s","192.168.0.41","192.168.0.42","TCP","1514","166521","2","11584","29312","51213 > 49200 [PSH, ACK] Seq=166521 Ack=2 Win=29312 Len=1448 TSval=29524295 TSecr=29546165"
"213","0.026862s","0.000004s","192.168.0.42","192.168.0.41","TCP","66","2","165073","","179456","49200 > 51213 [ACK] Seq=2 Ack=165073 Win=179456 Len=0 TSval=29546165 TSecr=29524295"
"214","0.026904s","0.000042s","192.168.0.42","192.168.0.41","TCP","66","2","167969","","177536","49200 > 51213 [ACK] Seq=2 Ack=167969 Win=177536 Len=0 TSval=29546165 TSecr=29524295"
"215","0.030213s","0.003309s","192.168.0.41","192.168.0.42","TCP","1514","167969","2","1448","29312","51213 > 49200 [ACK] Seq=167969 Ack=2 Win=29312 Len=1448 TSval=29524296 TSecr=29546165"
"216","0.030240s","0.000027s","192.168.0.41","192.168.0.42","TCP","1514","169417","2","2896","29312","51213 > 49200 [ACK] Seq=169417 Ack=2 Win=29312 Len=1448 TSval=29524296 TSecr=29546165"
