"No.","Time","D_Time","Source","Destination","Protocol","Length","Sequence num","Ack number","data len","Calculated window size","Info"
"2","12.242105s","0.000000s","192.168.0.41","192.168.0.42","TCP","74","0","","","29200","33947 > 49200 [SYN] Seq=0 Win=29200 Len=0 MSS=1460 SACK_PERM=1 TSval=127201307 TSecr=0 WS=128"
"3","12.242169s","0.000064s","192.168.0.42","192.168.0.41","TCP","74","0","1","","28960","49200 > 33947 [SYN, ACK] Seq=0 Ack=1 Win=28960 Len=0 MSS=1460 SACK_PERM=1 TSval=4226904 TSecr=127201307 WS=128"
"4","12.242331s","0.000162s","192.168.0.41","192.168.0.42","TCP","66","1","1","","29312","33947 > 49200 [ACK] Seq=1 Ack=1 Win=29312 Len=0 TSval=127201307 TSecr=4226904"
"5","12.242375s","0.000044s","192.168.0.41","192.168.0.42","TCP","1514","1","1","1448","29312","33947 > 49200 [ACK] Seq=1 Ack=1 Win=29312 Len=1448 TSval=127201307 TSecr=4226904"
"6","12.242397s","0.000022s","192.168.0.42","192.168.0.41","TCP","66","1","1449","","31872","49200 > 33947 [ACK] Seq=1 Ack=1449 Win=31872 Len=0 TSval=4226904 TSecr=127201307"
"7","12.242402s","0.000005s","192.168.0.41","192.168.0.42","TCP","1514","1449","1","1448","29312","33947 > 49200 [ACK] Seq=1449 Ack=1 Win=29312 Len=1448 TSval=127201307 TSecr=4226904"
"8","12.242418s","0.000016s","192.168.0.42","192.168.0.41","TCP","66","1","2897","","34816","49200 > 33947 [ACK] Seq=1 Ack=2897 Win=34816 Len=0 TSval=4226904 TSecr=127201307"
"9","12.242420s","0.000002s","192.168.0.41","192.168.0.42","TCP","1514","2897","1","1448","29312","33947 > 49200 [ACK] Seq=2897 Ack=1 Win=29312 Len=1448 TSval=127201307 TSecr=4226904"
"10","12.242431s","0.000011s","192.168.0.42","192.168.0.41","TCP","66","1","4345","","37760","49200 > 33947 [ACK] Seq=1 Ack=4345 Win=37760 Len=0 TSval=4226904 TSecr=127201307"
"11","12.242434s","0.000003s","192.168.0.41","192.168.0.42","TCP","1514","4345","1","1448","29312","33947 > 49200 [ACK] Seq=4345 Ack=1 Win=29312 Len=1448 TSval=127201307 TSecr=4226904"
"12","12.242444s","0.000010s","192.168.0.42","192.168.0.41","TCP","66","1","5793","","40576","49200 > 33947 [ACK] Seq=1 Ack=5793 Win=40576 Len=0 TSval=4226904 TSecr=127201307"
"13","12.242447s","0.000003s","192.168.0.41","192.168.0.42","TCP","1514","5793","1","1448","29312","33947 > 49200 [ACK] Seq=5793 Ack=1 Win=29312 Len=1448 TSval=127201307 TSecr=4226904"
"14","12.242461s","0.000014s","192.168.0.42","192.168.0.41","TCP","66","1","7241","","43520","49200 > 33947 [ACK] Seq=1 Ack=7241 Win=43520 Len=0 TSval=4226904 TSecr=127201307"
"15","12.242465s","0.000004s","192.168.0.41","192.168.0.42","TCP","1514","7241","1","1448","29312","33947 > 49200 [ACK] Seq=7241 Ack=1 Win=29312 Len=1448 TSval=127201307 TSecr=4226904"
"16","12.242475s","0.000010s","192.168.0.42","192.168.0.41","TCP","66","1","8689","","46336","49200 > 33947 [ACK] Seq=1 Ack=8689 Win=46336 Len=0 TSval=4226904 TSecr=127201307"
"17","12.242477s","0.000002s","192.168.0.41","192.168.0.42","TCP","1514","8689","1","1448","29312","33947 > 49200 [ACK] Seq=8689 Ack=1 Win=29312 Len=1448 TSval=127201307 TSecr=4226904"
"18","12.242483s","0.000006s","192.168.0.41","192.168.0.42","TCP","1514","10137","1","2896","29312","33947 > 49200 [ACK] Seq=10137 Ack=1 Win=29312 Len=1448 TSval=127201307 TSecr=4226904"
"19","12.242488s","0.000005s","192.168.0.41","192.168.0.42","TCP","1514","11585","1","4344","29312","33947 > 49200 [ACK] Seq=11585 Ack=1 Win=29312 Len=1448 TSval=127201307 TSecr=4226904"
"20","12.242492s","0.000004s","192.168.0.41","192.168.0.42","TCP","1514","13033","1","5792","29312","33947 > 49200 [ACK] Seq=13033 Ack=1 Win=29312 Len=1448 TSval=127201307 TSecr=4226904"
"21","12.242494s","0.000002s","192.168.0.42","192.168.0.41","TCP","66","1","10137","","49280","49200 > 33947 [ACK] Seq=1 Ack=10137 Win=49280 Len=0 TSval=4226904 TSecr=127201307"
"22","12.242503s","0.000009s","192.168.0.42","192.168.0.41","TCP","66","1","11585","","52224","49200 > 33947 [ACK] Seq=1 Ack=11585 Win=52224 Len=0 TSval=4226904 TSecr=127201307"
"23","12.242511s","0.000008s","192.168.0.42","192.168.0.41","TCP","66","1","13033","","55040","49200 > 33947 [ACK] Seq=1 Ack=13033 Win=55040 Len=0 TSval=4226904 TSecr=127201307"
"24","12.242519s","0.000008s","192.168.0.42","192.168.0.41","TCP","66","1","14481","","57984","49200 > 33947 [ACK] Seq=1 Ack=14481 Win=57984 Len=0 TSval=4226904 TSecr=127201307"
"25","12.242575s","0.000056s","192.168.0.42","192.168.0.41","TCP","66","1","14481","","57984","49200 > 33947 [FIN, ACK] Seq=1 Ack=14481 Win=57984 Len=0 TSval=4226904 TSecr=127201307"
"26","12.242602s","0.000027s","192.168.0.41","192.168.0.42","TCP","1514","14481","1","1448","29312","33947 > 49200 [PSH, ACK] Seq=14481 Ack=1 Win=29312 Len=1448 TSval=127201307 TSecr=4226904"
"27","12.242625s","0.000023s","192.168.0.42","192.168.0.41","TCP","66","2","15929","","60928","49200 > 33947 [ACK] Seq=2 Ack=15929 Win=60928 Len=0 TSval=4226904 TSecr=127201307"
"28","12.242629s","0.000004s","192.168.0.41","192.168.0.42","TCP","1514","15929","1","1448","29312","33947 > 49200 [ACK] Seq=15929 Ack=1 Win=29312 Len=1448 TSval=127201307 TSecr=4226904"
"29","12.242640s","0.000011s","192.168.0.42","192.168.0.41","TCP","66","2","17377","","63744","49200 > 33947 [ACK] Seq=2 Ack=17377 Win=63744 Len=0 TSval=4226904 TSecr=127201307"
"30","12.242642s","0.000002s","192.168.0.41","192.168.0.42","TCP","1514","17377","1","1448","29312","33947 > 49200 [ACK] Seq=17377 Ack=1 Win=29312 Len=1448 TSval=127201307 TSecr=4226904"
"31","12.242654s","0.000012s","192.168.0.42","192.168.0.41","TCP","66","2","18825","","66688","49200 > 33947 [ACK] Seq=2 Ack=18825 Win=66688 Len=0 TSval=4226904 TSecr=127201307"
"32","12.242657s","0.000003s","192.168.0.41","192.168.0.42","TCP","1514","18825","1","1448","29312","33947 > 49200 [ACK] Seq=18825 Ack=1 Win=29312 Len=1448 TSval=127201307 TSecr=4226904"
"33","12.242663s","0.000006s","192.168.0.41","192.168.0.42","TCP","1514","20273","1","2896","29312","33947 > 49200 [ACK] Seq=20273 Ack=1 Win=29312 Len=1448 TSval=127201307 TSecr=4226904"
"34","12.242669s","0.000006s","192.168.0.41","192.168.0.42","TCP","1514","21721","1","4344","29312","33947 > 49200 [ACK] Seq=21721 Ack=1 Win=29312 Len=1448 TSval=127201307 TSecr=4226904"
"35","12.242672s","0.000003s","192.168.0.42","192.168.0.41","TCP","66","2","20273","","69504","49200 > 33947 [ACK] Seq=2 Ack=20273 Win=69504 Len=0 TSval=4226904 TSecr=127201307"
"36","12.242674s","0.000002s","192.168.0.41","192.168.0.42","TCP","1514","23169","1","4344","29312","33947 > 49200 [ACK] Seq=23169 Ack=1 Win=29312 Len=1448 TSval=127201307 TSecr=4226904"
"37","12.242680s","0.000006s","192.168.0.42","192.168.0.41","TCP","66","2","21721","","72448","49200 > 33947 [ACK] Seq=2 Ack=21721 Win=72448 Len=0 TSval=4226904 TSecr=127201307"
"38","12.242689s","0.000009s","192.168.0.42","192.168.0.41","TCP","66","2","23169","","75392","49200 > 33947 [ACK] Seq=2 Ack=23169 Win=75392 Len=0 TSval=4226904 TSecr=127201307"
"39","12.242708s","0.000019s","192.168.0.42","192.168.0.41","TCP","66","2","24617","","78208","49200 > 33947 [ACK] Seq=2 Ack=24617 Win=78208 Len=0 TSval=4226904 TSecr=127201307"
"40","12.242845s","0.000137s","192.168.0.41","192.168.0.42","TCP","1514","24617","1","1448","29312","33947 > 49200 [ACK] Seq=24617 Ack=1 Win=29312 Len=1448 TSval=127201307 TSecr=4226904"
"41","12.242866s","0.000021s","192.168.0.42","192.168.0.41","TCP","66","2","26065","","81152","49200 > 33947 [ACK] Seq=2 Ack=26065 Win=81152 Len=0 TSval=4226904 TSecr=127201307"
"42","12.242869s","0.000003s","192.168.0.41","192.168.0.42","TCP","1514","26065","1","1448","29312","33947 > 49200 [ACK] Seq=26065 Ack=1 Win=29312 Len=1448 TSval=127201307 TSecr=4226904"
"43","12.242881s","0.000012s","192.168.0.42","192.168.0.41","TCP","66","2","27513","","84096","49200 > 33947 [ACK] Seq=2 Ack=27513 Win=84096 Len=0 TSval=4226904 TSecr=127201307"
"44","12.242883s","0.000002s","192.168.0.41","192.168.0.42","TCP","1514","27513","1","1448","29312","33947 > 49200 [PSH, ACK] Seq=27513 Ack=1 Win=29312 Len=1448 TSval=127201307 TSecr=4226904"
"45","12.242896s","0.000013s","192.168.0.42","192.168.0.41","TCP","66","2","28961","","86912","49200 > 33947 [ACK] Seq=2 Ack=28961 Win=86912 Len=0 TSval=4226904 TSecr=127201307"
"46","12.242899s","0.000003s","192.168.0.41","192.168.0.42","TCP","1514","28961","1","1448","29312","33947 > 49200 [ACK] Seq=28961 Ack=1 Win=29312 Len=1448 TSval=127201307 TSecr=4226904"
"47","12.242910s","0.000011s","192.168.0.42","192.168.0.41","TCP","66","2","30409","","89856","49200 > 33947 [ACK] Seq=2 Ack=30409 Win=89856 Len=0 TSval=4226904 TSecr=127201307"
"48","12.242913s","0.000003s","192.168.0.41","192.168.0.42","TCP","1514","30409","1","1448","29312","33947 > 49200 [ACK] Seq=30409 Ack=1 Win=29312 Len=1448 TSval=127201307 TSecr=4226904"
"49","12.242923s","0.000010s","192.168.0.42","192.168.0.41","TCP","66","2","31857","","92672","49200 > 33947 [ACK] Seq=2 Ack=31857 Win=92672 Len=0 TSval=4226904 TSecr=127201307"
"50","12.242926s","0.000003s","192.168.0.41","192.168.0.42","TCP","1514","31857","1","1448","29312","33947 > 49200 [ACK] Seq=31857 Ack=1 Win=29312 Len=1448 TSval=127201307 TSecr=4226904"
"51","12.242932s","0.000006s","192.168.0.41","192.168.0.42","TCP","1514","33305","1","2896","29312","33947 > 49200 [ACK] Seq=33305 Ack=1 Win=29312 Len=1448 TSval=127201307 TSecr=4226904"
"52","12.242937s","0.000005s","192.168.0.41","192.168.0.42","TCP","1514","34753","1","4344","29312","33947 > 49200 [ACK] Seq=34753 Ack=1 Win=29312 Len=1448 TSval=127201307 TSecr=4226904"
"53","12.242942s","0.000005s","192.168.0.42","192.168.0.41","TCP","66","2","33305","","95616","49200 > 33947 [ACK] Seq=2 Ack=33305 Win=95616 Len=0 TSval=4226904 TSecr=127201307"
"54","12.242942s","0.000000s","192.168.0.41","192.168.0.42","TCP","1514","36201","1","4344","29312","33947 > 49200 [ACK] Seq=36201 Ack=1 Win=29312 Len=1448 TSval=127201307 TSecr=4226904"
"55","12.242947s","0.000005s","192.168.0.41","192.168.0.42","TCP","1514","37649","1","5792","29312","33947 > 49200 [ACK] Seq=37649 Ack=1 Win=29312 Len=1448 TSval=127201307 TSecr=4226904"
"56","12.242951s","0.000004s","192.168.0.42","192.168.0.41","TCP","66","2","34753","","98560","49200 > 33947 [ACK] Seq=2 Ack=34753 Win=98560 Len=0 TSval=4226904 TSecr=127201307"
"57","12.242952s","0.000001s","192.168.0.41","192.168.0.42","TCP","1514","39097","1","5792","29312","33947 > 49200 [ACK] Seq=39097 Ack=1 Win=29312 Len=1448 TSval=127201307 TSecr=4226904"
"58","12.242957s","0.000005s","192.168.0.41","192.168.0.42","TCP","1514","40545","1","7240","29312","33947 > 49200 [ACK] Seq=40545 Ack=1 Win=29312 Len=1448 TSval=127201307 TSecr=4226904"
"59","12.242959s","0.000002s","192.168.0.42","192.168.0.41","TCP","66","2","36201","","101376","49200 > 33947 [ACK] Seq=2 Ack=36201 Win=101376 Len=0 TSval=4226904 TSecr=127201307"
"60","12.242962s","0.000003s","192.168.0.41","192.168.0.42","TCP","1514","41993","1","7240","29312","33947 > 49200 [ACK] Seq=41993 Ack=1 Win=29312 Len=1448 TSval=127201307 TSecr=4226904"
"61","12.242967s","0.000005s","192.168.0.41","192.168.0.42","TCP","1514","43441","2","8688","29312","33947 > 49200 [ACK] Seq=43441 Ack=2 Win=29312 Len=1448 TSval=127201307 TSecr=4226904"
"62","12.242967s","0.000000s","192.168.0.42","192.168.0.41","TCP","66","2","37649","","104320","49200 > 33947 [ACK] Seq=2 Ack=37649 Win=104320 Len=0 TSval=4226904 TSecr=127201307"
"63","12.242971s","0.000004s","192.168.0.41","192.168.0.42","TCP","1514","44889","2","8688","29312","33947 > 49200 [ACK] Seq=44889 Ack=2 Win=29312 Len=1448 TSval=127201307 TSecr=4226904"
"64","12.242975s","0.000004s","192.168.0.42","192.168.0.41","TCP","66","2","39097","","107264","49200 > 33947 [ACK] Seq=2 Ack=39097 Win=107264 Len=0 TSval=4226904 TSecr=127201307"
"65","12.242976s","0.000001s","192.168.0.41","192.168.0.42","TCP","1514","46337","2","8688","29312","33947 > 49200 [ACK] Seq=46337 Ack=2 Win=29312 Len=1448 TSval=127201307 TSecr=4226904"
"66","12.242983s","0.000007s","192.168.0.42","192.168.0.41","TCP","66","2","40545","","110080","49200 > 33947 [ACK] Seq=2 Ack=40545 Win=110080 Len=0 TSval=4226904 TSecr=127201307"
"67","12.242992s","0.000009s","192.168.0.42","192.168.0.41","TCP","66","2","41993","","113024","49200 > 33947 [ACK] Seq=2 Ack=41993 Win=113024 Len=0 TSval=4226904 TSecr=127201307"
"68","12.242995s","0.000003s","192.168.0.41","192.168.0.42","TCP","1514","47785","2","7240","29312","33947 > 49200 [ACK] Seq=47785 Ack=2 Win=29312 Len=1448 TSval=127201307 TSecr=4226904"
"69","12.243000s","0.000005s","192.168.0.42","192.168.0.41","TCP","66","2","43441","","115840","49200 > 33947 [ACK] Seq=2 Ack=43441 Win=115840 Len=0 TSval=4226904 TSecr=127201307"
"70","12.243000s","0.000000s","192.168.0.41","192.168.0.42","TCP","1514","49233","2","7240","29312","33947 > 49200 [ACK] Seq=49233 Ack=2 Win=29312 Len=1448 TSval=127201307 TSecr=4226904"
"71","12.243005s","0.000005s","192.168.0.41","192.168.0.42","TCP","1514","50681","2","8688","29312","33947 > 49200 [ACK] Seq=50681 Ack=2 Win=29312 Len=1448 TSval=127201307 TSecr=4226904"
"72","12.243010s","0.000005s","192.168.0.41","192.168.0.42","TCP","1514","52129","2","10136","29312","33947 > 49200 [PSH, ACK] Seq=52129 Ack=2 Win=29312 Len=1448 TSval=127201307 TSecr=4226904"
"73","12.243010s","0.000000s","192.168.0.42","192.168.0.41","TCP","66","2","44889","","118784","49200 > 33947 [ACK] Seq=2 Ack=44889 Win=118784 Len=0 TSval=4226904 TSecr=127201307"
"74","12.243015s","0.000005s","192.168.0.41","192.168.0.42","TCP","1514","53577","2","10136","29312","33947 > 49200 [PSH, ACK] Seq=53577 Ack=2 Win=29312 Len=1448 TSval=127201307 TSecr=4226904"
"75","12.243018s","0.000003s","192.168.0.42","192.168.0.41","TCP","66","2","46337","","121728","49200 > 33947 [ACK] Seq=2 Ack=46337 Win=121728 Len=0 TSval=4226904 TSecr=127201307"
"76","12.243019s","0.000001s","192.168.0.41","192.168.0.42","TCP","1514","55025","2","10136","29312","33947 > 49200 [ACK] Seq=55025 Ack=2 Win=29312 Len=1448 TSval=127201307 TSecr=4226904"
"77","12.243025s","0.000006s","192.168.0.42","192.168.0.41","TCP","66","2","47785","","124544","49200 > 33947 [ACK] Seq=2 Ack=47785 Win=124544 Len=0 TSval=4226904 TSecr=127201307"
"78","12.243025s","0.000000s","192.168.0.41","192.168.0.42","TCP","1514","56473","2","10136","29312","33947 > 49200 [ACK] Seq=56473 Ack=2 Win=29312 Len=1448 TSval=127201307 TSecr=4226904"
"79","12.243030s","0.000005s","192.168.0.41","192.168.0.42","TCP","1514","57921","2","11584","29312","33947 > 49200 [ACK] Seq=57921 Ack=2 Win=29312 Len=1448 TSval=127201307 TSecr=4226904"
"80","12.243032s","0.000002s","192.168.0.42","192.168.0.41","TCP","66","2","49233","","127488","49200 > 33947 [ACK] Seq=2 Ack=49233 Win=127488 Len=0 TSval=4226904 TSecr=127201307"
"81","12.243036s","0.000004s","192.168.0.41","192.168.0.42","TCP","1514","59369","2","11584","29312","33947 > 49200 [PSH, ACK] Seq=59369 Ack=2 Win=29312 Len=1448 TSval=127201307 TSecr=4226904"
"82","12.243041s","0.000005s","192.168.0.42","192.168.0.41","TCP","66","2","50681","","130432","49200 > 33947 [ACK] Seq=2 Ack=50681 Win=130432 Len=0 TSval=4226904 TSecr=127201307"
"83","12.243040s","- 0.000001s","192.168.0.41","192.168.0.42","TCP","1514","60817","2","11584","29312","33947 > 49200 [ACK] Seq=60817 Ack=2 Win=29312 Len=1448 TSval=127201307 TSecr=4226904"
"84","12.243045s","0.000005s","192.168.0.41","192.168.0.42","TCP","1514","62265","2","13032","29312","33947 > 49200 [ACK] Seq=62265 Ack=2 Win=29312 Len=1448 TSval=127201307 TSecr=4226904"
"85","12.243047s","0.000002s","192.168.0.42","192.168.0.41","TCP","66","2","52129","","133248","49200 > 33947 [ACK] Seq=2 Ack=52129 Win=133248 Len=0 TSval=4226904 TSecr=127201307"
"86","12.243050s","0.000003s","192.168.0.41","192.168.0.42","TCP","1514","63713","2","13032","29312","33947 > 49200 [ACK] Seq=63713 Ack=2 Win=29312 Len=1448 TSval=127201307 TSecr=4226904"
"87","12.243054s","0.000004s","192.168.0.42","192.168.0.41","TCP","66","2","53577","","136192","49200 > 33947 [ACK] Seq=2 Ack=53577 Win=136192 Len=0 TSval=4226904 TSecr=127201307"
"88","12.243061s","0.000007s","192.168.0.42","192.168.0.41","TCP","66","2","55025","","139008","49200 > 33947 [ACK] Seq=2 Ack=55025 Win=139008 Len=0 TSval=4226904 TSecr=127201307"
"89","12.243069s","0.000008s","192.168.0.42","192.168.0.41","TCP","66","2","56473","","141952","49200 > 33947 [ACK] Seq=2 Ack=56473 Win=141952 Len=0 TSval=4226904 TSecr=127201307"
"90","12.243077s","0.000008s","192.168.0.42","192.168.0.41","TCP","66","2","57921","","144896","49200 > 33947 [ACK] Seq=2 Ack=57921 Win=144896 Len=0 TSval=4226904 TSecr=127201307"
"91","12.243086s","0.000009s","192.168.0.42","192.168.0.41","TCP","66","2","59369","","147712","49200 > 33947 [ACK] Seq=2 Ack=59369 Win=147712 Len=0 TSval=4226904 TSecr=127201307"
"92","12.243095s","0.000009s","192.168.0.41","192.168.0.42","TCP","1514","65161","2","7240","29312","33947 > 49200 [ACK] Seq=65161 Ack=2 Win=29312 Len=1448 TSval=127201307 TSecr=4226904"
"93","12.243097s","0.000002s","192.168.0.42","192.168.0.41","TCP","66","2","60817","","150656","49200 > 33947 [ACK] Seq=2 Ack=60817 Win=150656 Len=0 TSval=4226904 TSecr=127201307"
"94","12.243102s","0.000005s","192.168.0.41","192.168.0.42","TCP","1514","66609","2","7240","29312","33947 > 49200 [ACK] Seq=66609 Ack=2 Win=29312 Len=1448 TSval=127201307 TSecr=4226904"
"95","12.243103s","0.000001s","192.168.0.42","192.168.0.41","TCP","66","2","62265","","153600","49200 > 33947 [ACK] Seq=2 Ack=62265 Win=153600 Len=0 TSval=4226904 TSecr=127201307"
"96","12.243108s","0.000005s","192.168.0.41","192.168.0.42","TCP","1514","68057","2","7240","29312","33947 > 49200 [ACK] Seq=68057 Ack=2 Win=29312 Len=1448 TSval=127201307 TSecr=4226904"
"97","12.243111s","0.000003s","192.168.0.42","192.168.0.41","TCP","66","2","63713","","156416","49200 > 33947 [ACK] Seq=2 Ack=63713 Win=156416 Len=0 TSval=4226904 TSecr=127201307"
"98","12.243112s","0.000001s","192.168.0.41","192.168.0.42","TCP","1514","69505","2","7240","29312","33947 > 49200 [ACK] Seq=69505 Ack=2 Win=29312 Len=1448 TSval=127201307 TSecr=4226904"
"99","12.243117s","0.000005s","192.168.0.41","192.168.0.42","TCP","1514","70953","2","8688","29312","33947 > 49200 [ACK] Seq=70953 Ack=2 Win=29312 Len=1448 TSval=127201307 TSecr=4226904"
"100","12.243119s","0.000002s","192.168.0.42","192.168.0.41","TCP","66","2","65161","","159360","49200 > 33947 [ACK] Seq=2 Ack=65161 Win=159360 Len=0 TSval=4226904 TSecr=127201307"
"101","12.243122s","0.000003s","192.168.0.41","192.168.0.42","TCP","1514","72401","2","8688","29312","33947 > 49200 [ACK] Seq=72401 Ack=2 Win=29312 Len=1448 TSval=127201307 TSecr=4226904"
"102","12.243126s","0.000004s","192.168.0.42","192.168.0.41","TCP","66","2","66609","","160128","49200 > 33947 [ACK] Seq=2 Ack=66609 Win=160128 Len=0 TSval=4226904 TSecr=127201307"
"103","12.243134s","0.000008s","192.168.0.42","192.168.0.41","TCP","66","2","68057","","159104","49200 > 33947 [ACK] Seq=2 Ack=68057 Win=159104 Len=0 TSval=4226904 TSecr=127201307"
"104","12.243147s","0.000013s","192.168.0.42","192.168.0.41","TCP","66","2","69505","","158208","49200 > 33947 [ACK] Seq=2 Ack=69505 Win=158208 Len=0 TSval=4226904 TSecr=127201307"
"105","12.243158s","0.000011s","192.168.0.42","192.168.0.41","TCP","66","2","70953","","157184","49200 > 33947 [ACK] Seq=2 Ack=70953 Win=157184 Len=0 TSval=4226904 TSecr=127201307"
"106","12.243168s","0.000010s","192.168.0.42","192.168.0.41","TCP","66","2","72401","","156288","49200 > 33947 [ACK] Seq=2 Ack=72401 Win=156288 Len=0 TSval=4226904 TSecr=127201307"
"107","12.243180s","0.000012s","192.168.0.42","192.168.0.41","TCP","66","2","73849","","155264","49200 > 33947 [ACK] Seq=2 Ack=73849 Win=155264 Len=0 TSval=4226904 TSecr=127201307"
"108","12.243346s","0.000166s","192.168.0.41","192.168.0.42","TCP","1514","73849","2","1448","29312","33947 > 49200 [ACK] Seq=73849 Ack=2 Win=29312 Len=1448 TSval=127201307 TSecr=4226904"
"109","12.243365s","0.000019s","192.168.0.42","192.168.0.41","TCP","66","2","75297","","154368","49200 > 33947 [ACK] Seq=2 Ack=75297 Win=154368 Len=0 TSval=4226904 TSecr=127201307"
"110","12.243369s","0.000004s","192.168.0.41","192.168.0.42","TCP","1514","75297","2","1448","29312","33947 > 49200 [ACK] Seq=75297 Ack=2 Win=29312 Len=1448 TSval=127201307 TSecr=4226904"
"111","12.243379s","0.000010s","192.168.0.42","192.168.0.41","TCP","66","2","76745","","153344","49200 > 33947 [ACK] Seq=2 Ack=76745 Win=153344 Len=0 TSval=4226904 TSecr=127201307"
"112","12.243382s","0.000003s","192.168.0.41","192.168.0.42","TCP","1514","76745","2","1448","29312","33947 > 49200 [ACK] Seq=76745 Ack=2 Win=29312 Len=1448 TSval=127201307 TSecr=4226904"
"113","12.243392s","0.000010s","192.168.0.42","192.168.0.41","TCP","66","2","78193","","152448","49200 > 33947 [ACK] Seq=2 Ack=78193 Win=152448 Len=0 TSval=4226904 TSecr=127201307"
"114","12.243395s","0.000003s","192.168.0.41","192.168.0.42","TCP","1514","78193","2","1448","29312","33947 > 49200 [ACK] Seq=78193 Ack=2 Win=29312 Len=1448 TSval=127201307 TSecr=4226904"
"115","12.243403s","0.000008s","192.168.0.41","192.168.0.42","TCP","1514","79641","2","2896","29312","33947 > 49200 [ACK] Seq=79641 Ack=2 Win=29312 Len=1448 TSval=127201307 TSecr=4226904"
"116","12.243409s","0.000006s","192.168.0.41","192.168.0.42","TCP","1514","81089","2","4344","29312","33947 > 49200 [ACK] Seq=81089 Ack=2 Win=29312 Len=1448 TSval=127201307 TSecr=4226904"
"117","12.243416s","0.000007s","192.168.0.41","192.168.0.42","TCP","1514","82537","2","5792","29312","33947 > 49200 [ACK] Seq=82537 Ack=2 Win=29312 Len=1448 TSval=127201307 TSecr=4226904"
"118","12.243423s","0.000007s","192.168.0.41","192.168.0.42","TCP","1514","83985","2","7240","29312","33947 > 49200 [ACK] Seq=83985 Ack=2 Win=29312 Len=1448 TSval=127201307 TSecr=4226904"
"119","12.243429s","0.000006s","192.168.0.41","192.168.0.42","TCP","1514","85433","2","8688","29312","33947 > 49200 [ACK] Seq=85433 Ack=2 Win=29312 Len=1448 TSval=127201307 TSecr=4226904"
"120","12.243433s","0.000004s","192.168.0.41","192.168.0.42","TCP","1514","86881","2","10136","29312","33947 > 49200 [ACK] Seq=86881 Ack=2 Win=29312 Len=1448 TSval=127201307 TSecr=4226904"
"121","12.243435s","0.000002s","192.168.0.42","192.168.0.41","TCP","66","2","83985","","148480","49200 > 33947 [ACK] Seq=2 Ack=83985 Win=148480 Len=0 TSval=4226904 TSecr=127201307"
"122","12.243438s","0.000003s","192.168.0.41","192.168.0.42","TCP","1514","88329","2","5792","29312","33947 > 49200 [ACK] Seq=88329 Ack=2 Win=29312 Len=1448 TSval=127201307 TSecr=4226904"
"123","12.243444s","0.000006s","192.168.0.41","192.168.0.42","TCP","1514","89777","2","7240","29312","33947 > 49200 [ACK] Seq=89777 Ack=2 Win=29312 Len=1448 TSval=127201307 TSecr=4226904"
"124","12.243449s","0.000005s","192.168.0.41","192.168.0.42","TCP","1514","91225","2","8688","29312","33947 > 49200 [ACK] Seq=91225 Ack=2 Win=29312 Len=1448 TSval=127201307 TSecr=4226904"
"125","12.243455s","0.000006s","192.168.0.41","192.168.0.42","TCP","1514","92673","2","10136","29312","33947 > 49200 [ACK] Seq=92673 Ack=2 Win=29312 Len=1448 TSval=127201307 TSecr=4226904"
"126","12.243461s","0.000006s","192.168.0.41","192.168.0.42","TCP","1514","94121","2","11584","29312","33947 > 49200 [ACK] Seq=94121 Ack=2 Win=29312 Len=1448 TSval=127201307 TSecr=4226904"
"127","12.243467s","0.000006s","192.168.0.41","192.168.0.42","TCP","1514","95569","2","13032","29312","33947 > 49200 [ACK] Seq=95569 Ack=2 Win=29312 Len=1448 TSval=127201307 TSecr=4226904"
"128","12.243479s","0.000012s","192.168.0.42","192.168.0.41","TCP","66","2","95569","","158208","49200 > 33947 [ACK] Seq=2 Ack=95569 Win=158208 Len=0 TSval=4226904 TSecr=127201307"
"129","12.243479s","0.000000s","192.168.0.41","192.168.0.42","TCP","1514","97017","2","2896","29312","33947 > 49200 [ACK] Seq=97017 Ack=2 Win=29312 Len=1448 TSval=127201307 TSecr=4226904"
"130","12.243486s","0.000007s","192.168.0.41","192.168.0.42","TCP","1514","98465","2","4344","29312","33947 > 49200 [ACK] Seq=98465 Ack=2 Win=29312 Len=1448 TSval=127201307 TSecr=4226904"
"131","12.243492s","0.000006s","192.168.0.41","192.168.0.42","TCP","1514","99913","2","5792","29312","33947 > 49200 [PSH, ACK] Seq=99913 Ack=2 Win=29312 Len=1448 TSval=127201307 TSecr=4226904"
"132","12.243497s","0.000005s","192.168.0.41","192.168.0.42","TCP","1514","101361","2","7240","29312","33947 > 49200 [PSH, ACK] Seq=101361 Ack=2 Win=29312 Len=1448 TSval=127201307 TSecr=4226904"
"133","12.243502s","0.000005s","192.168.0.41","192.168.0.42","TCP","1514","102809","2","8688","29312","33947 > 49200 [ACK] Seq=102809 Ack=2 Win=29312 Len=1448 TSval=127201307 TSecr=4226904"
"134","12.243509s","0.000007s","192.168.0.41","192.168.0.42","TCP","1514","104257","2","10136","29312","33947 > 49200 [ACK] Seq=104257 Ack=2 Win=29312 Len=1448 TSval=127201307 TSecr=4226904"
"135","12.243515s","0.000006s","192.168.0.41","192.168.0.42","TCP","1514","105705","2","11584","29312","33947 > 49200 [ACK] Seq=105705 Ack=2 Win=29312 Len=1448 TSval=127201307 TSecr=4226904"
"136","12.243519s","0.000004s","192.168.0.41","192.168.0.42","TCP","1514","107153","2","13032","29312","33947 > 49200 [ACK] Seq=107153 Ack=2 Win=29312 Len=1448 TSval=127201307 TSecr=4226904"
"137","12.243520s","0.000001s","192.168.0.42","192.168.0.41","TCP","66","2","104257","","152448","49200 > 33947 [ACK] Seq=2 Ack=104257 Win=152448 Len=0 TSval=4226904 TSecr=127201307"
"138","12.243524s","0.000004s","192.168.0.41","192.168.0.42","TCP","1514","108601","2","5792","29312","33947 > 49200 [ACK] Seq=108601 Ack=2 Win=29312 Len=1448 TSval=127201307 TSecr=4226904"
"139","12.243530s","0.000006s","192.168.0.41","192.168.0.42","TCP","1514","110049","2","7240","29312","33947 > 49200 [ACK] Seq=110049 Ack=2 Win=29312 Len=1448 TSval=127201307 TSecr=4226904"
"140","12.243536s","0.000006s","192.168.0.41","192.168.0.42","TCP","1514","111497","2","8688","29312","33947 > 49200 [ACK] Seq=111497 Ack=2 Win=29312 Len=1448 TSval=127201307 TSecr=4226904"
"141","12.243542s","0.000006s","192.168.0.41","192.168.0.42","TCP","1514","112945","2","10136","29312","33947 > 49200 [ACK] Seq=112945 Ack=2 Win=29312 Len=1448 TSval=127201307 TSecr=4226904"
"142","12.243548s","0.000006s","192.168.0.41","192.168.0.42","TCP","1514","114393","2","11584","29312","33947 > 49200 [ACK] Seq=114393 Ack=2 Win=29312 Len=1448 TSval=127201307 TSecr=4226904"
"143","12.243553s","0.000005s","192.168.0.41","192.168.0.42","TCP","1514","115841","2","13032","29312","33947 > 49200 [ACK] Seq=115841 Ack=2 Win=29312 Len=1448 TSval=127201307 TSecr=4226904"
"144","12.243553s","0.000000s","192.168.0.42","192.168.0.41","TCP","66","2","114393","","145536","49200 > 33947 [ACK] Seq=2 Ack=114393 Win=145536 Len=0 TSval=4226904 TSecr=127201307"
"145","12.243590s","0.000037s","192.168.0.42","192.168.0.41","TCP","66","2","117289","","143616","49200 > 33947 [ACK] Seq=2 Ack=117289 Win=143616 Len=0 TSval=4226904 TSecr=127201307"
"146","12.243596s","0.000006s","192.168.0.41","192.168.0.42","TCP","1514","117289","2","1448","29312","33947 > 49200 [ACK] Seq=117289 Ack=2 Win=29312 Len=1448 TSval=127201307 TSecr=4226904"
"147","12.243613s","0.000017s","192.168.0.41","192.168.0.42","TCP","1514","118737","2","2896","29312","33947 > 49200 [ACK] Seq=118737 Ack=2 Win=29312 Len=1448 TSval=127201307 TSecr=4226904"
"148","12.243620s","0.000007s","192.168.0.41","192.168.0.42","TCP","1514","120185","2","4344","29312","33947 > 49200 [ACK] Seq=120185 Ack=2 Win=29312 Len=1448 TSval=127201307 TSecr=4226904"
"149","12.243625s","0.000005s","192.168.0.41","192.168.0.42","TCP","1514","121633","2","5792","29312","33947 > 49200 [ACK] Seq=121633 Ack=2 Win=29312 Len=1448 TSval=127201307 TSecr=4226904"
"150","12.243630s","0.000005s","192.168.0.41","192.168.0.42","TCP","1514","123081","2","7240","29312","33947 > 49200 [ACK] Seq=123081 Ack=2 Win=29312 Len=1448 TSval=127201307 TSecr=4226904"
"151","12.243637s","0.000007s","192.168.0.41","192.168.0.42","TCP","1514","124529","2","8688","29312","33947 > 49200 [ACK] Seq=124529 Ack=2 Win=29312 Len=1448 TSval=127201307 TSecr=4226904"
"152","12.243643s","0.000006s","192.168.0.41","192.168.0.42","TCP","1514","125977","2","10136","29312","33947 > 49200 [ACK] Seq=125977 Ack=2 Win=29312 Len=1448 TSval=127201307 TSecr=4226904"
"153","12.243648s","0.000005s","192.168.0.41","192.168.0.42","TCP","1514","127425","2","11584","29312","33947 > 49200 [PSH, ACK] Seq=127425 Ack=2 Win=29312 Len=1448 TSval=127201307 TSecr=4226904"
"154","12.243653s","0.000005s","192.168.0.41","192.168.0.42","TCP","1514","128873","2","13032","29312","33947 > 49200 [ACK] Seq=128873 Ack=2 Win=29312 Len=1448 TSval=127201307 TSecr=4226904"
"155","12.243654s","0.000001s","192.168.0.42","192.168.0.41","TCP","66","2","125977","","162176","49200 > 33947 [ACK] Seq=2 Ack=125977 Win=162176 Len=0 TSval=4226905 TSecr=127201307"
"156","12.243663s","0.000009s","192.168.0.42","192.168.0.41","TCP","66","2","127425","","165120","49200 > 33947 [ACK] Seq=2 Ack=127425 Win=165120 Len=0 TSval=4226905 TSecr=127201307"
"157","12.243670s","0.000007s","192.168.0.42","192.168.0.41","TCP","66","2","128873","","168064","49200 > 33947 [ACK] Seq=2 Ack=128873 Win=168064 Len=0 TSval=4226905 TSecr=127201307"
"158","12.243678s","0.000008s","192.168.0.42","192.168.0.41","TCP","66","2","130321","","170880","49200 > 33947 [ACK] Seq=2 Ack=130321 Win=170880 Len=0 TSval=4226905 TSecr=127201307"
"159","12.243845s","0.000167s","192.168.0.41","192.168.0.42","TCP","1514","130321","2","1448","29312","33947 > 49200 [ACK] Seq=130321 Ack=2 Win=29312 Len=1448 TSval=127201307 TSecr=4226904"
"160","12.243862s","0.000017s","192.168.0.42","192.168.0.41","TCP","66","2","131769","","173824","49200 > 33947 [ACK] Seq=2 Ack=131769 Win=173824 Len=0 TSval=4226905 TSecr=127201307"
"161","12.243865s","0.000003s","192.168.0.41","192.168.0.42","TCP","1514","131769","2","1448","29312","33947 > 49200 [ACK] Seq=131769 Ack=2 Win=29312 Len=1448 TSval=127201307 TSecr=4226904"
"162","12.243877s","0.000012s","192.168.0.42","192.168.0.41","TCP","66","2","133217","","176768","49200 > 33947 [ACK] Seq=2 Ack=133217 Win=176768 Len=0 TSval=4226905 TSecr=127201307"
"163","12.243879s","0.000002s","192.168.0.41","192.168.0.42","TCP","1514","133217","2","1448","29312","33947 > 49200 [ACK] Seq=133217 Ack=2 Win=29312 Len=1448 TSval=127201307 TSecr=4226904"
"164","12.243889s","0.000010s","192.168.0.42","192.168.0.41","TCP","66","2","134665","","179584","49200 > 33947 [ACK] Seq=2 Ack=134665 Win=179584 Len=0 TSval=4226905 TSecr=127201307"
"165","12.243891s","0.000002s","192.168.0.41","192.168.0.42","TCP","1514","134665","2","1448","29312","33947 > 49200 [ACK] Seq=134665 Ack=2 Win=29312 Len=1448 TSval=127201307 TSecr=4226904"
"166","12.243902s","0.000011s","192.168.0.42","192.168.0.41","TCP","66","2","136113","","182528","49200 > 33947 [ACK] Seq=2 Ack=136113 Win=182528 Len=0 TSval=4226905 TSecr=127201307"
"167","12.243905s","0.000003s","192.168.0.41","192.168.0.42","TCP","1514","136113","2","1448","29312","33947 > 49200 [ACK] Seq=136113 Ack=2 Win=29312 Len=1448 TSval=127201307 TSecr=4226904"
"168","12.243916s","0.000011s","192.168.0.42","192.168.0.41","TCP","66","2","137561","","185344","49200 > 33947 [ACK] Seq=2 Ack=137561 Win=185344 Len=0 TSval=4226905 TSecr=127201307"
"169","12.243918s","0.000002s","192.168.0.41","192.168.0.42","TCP","1514","137561","2","1448","29312","33947 > 49200 [ACK] Seq=137561 Ack=2 Win=29312 Len=1448 TSval=127201307 TSecr=4226904"
"170","12.243927s","0.000009s","192.168.0.42","192.168.0.41","TCP","66","2","139009","","188288","49200 > 33947 [ACK] Seq=2 Ack=139009 Win=188288 Len=0 TSval=4226905 TSecr=127201307"
"171","12.243929s","0.000002s","192.168.0.41","192.168.0.42","TCP","1514","139009","2","1448","29312","33947 > 49200 [ACK] Seq=139009 Ack=2 Win=29312 Len=1448 TSval=127201307 TSecr=4226904"
"172","12.243939s","0.000010s","192.168.0.42","192.168.0.41","TCP","66","2","140457","","191232","49200 > 33947 [ACK] Seq=2 Ack=140457 Win=191232 Len=0 TSval=4226905 TSecr=127201307"
"173","12.243941s","0.000002s","192.168.0.41","192.168.0.42","TCP","1514","140457","2","1448","29312","33947 > 49200 [ACK] Seq=140457 Ack=2 Win=29312 Len=1448 TSval=127201308 TSecr=4226904"
"174","12.243953s","0.000012s","192.168.0.42","192.168.0.41","TCP","66","2","141905","","194048","49200 > 33947 [ACK] Seq=2 Ack=141905 Win=194048 Len=0 TSval=4226905 TSecr=127201308"
"175","12.243955s","0.000002s","192.168.0.41","192.168.0.42","TCP","1514","141905","2","1448","29312","33947 > 49200 [ACK] Seq=141905 Ack=2 Win=29312 Len=1448 TSval=127201308 TSecr=4226904"
"176","12.243964s","0.000009s","192.168.0.42","192.168.0.41","TCP","66","2","143353","","196992","49200 > 33947 [ACK] Seq=2 Ack=143353 Win=196992 Len=0 TSval=4226905 TSecr=127201308"
"177","12.243967s","0.000003s","192.168.0.41","192.168.0.42","TCP","1514","143353","2","1448","29312","33947 > 49200 [ACK] Seq=143353 Ack=2 Win=29312 Len=1448 TSval=127201308 TSecr=4226904"
"178","12.243975s","0.000008s","192.168.0.42","192.168.0.41","TCP","66","2","144801","","199936","49200 > 33947 [ACK] Seq=2 Ack=144801 Win=199936 Len=0 TSval=4226905 TSecr=127201308"
"179","12.243978s","0.000003s","192.168.0.41","192.168.0.42","TCP","1514","144801","2","1448","29312","33947 > 49200 [ACK] Seq=144801 Ack=2 Win=29312 Len=1448 TSval=127201308 TSecr=4226904"
"180","12.243989s","0.000011s","192.168.0.42","192.168.0.41","TCP","66","2","146249","","202752","49200 > 33947 [ACK] Seq=2 Ack=146249 Win=202752 Len=0 TSval=4226905 TSecr=127201308"
"181","12.243991s","0.000002s","192.168.0.41","192.168.0.42","TCP","1514","146249","2","1448","29312","33947 > 49200 [ACK] Seq=146249 Ack=2 Win=29312 Len=1448 TSval=127201308 TSecr=4226904"
"182","12.244001s","0.000010s","192.168.0.42","192.168.0.41","TCP","66","2","147697","","205696","49200 > 33947 [ACK] Seq=2 Ack=147697 Win=205696 Len=0 TSval=4226905 TSecr=127201308"
"183","12.244003s","0.000002s","192.168.0.41","192.168.0.42","TCP","1514","147697","2","1448","29312","33947 > 49200 [ACK] Seq=147697 Ack=2 Win=29312 Len=1448 TSval=127201308 TSecr=4226904"
"184","12.244013s","0.000010s","192.168.0.42","192.168.0.41","TCP","66","2","149145","","208512","49200 > 33947 [ACK] Seq=2 Ack=149145 Win=208512 Len=0 TSval=4226905 TSecr=127201308"
"185","12.244015s","0.000002s","192.168.0.41","192.168.0.42","TCP","1514","149145","2","1448","29312","33947 > 49200 [ACK] Seq=149145 Ack=2 Win=29312 Len=1448 TSval=127201308 TSecr=4226904"
"186","12.244025s","0.000010s","192.168.0.42","192.168.0.41","TCP","66","2","150593","","211456","49200 > 33947 [ACK] Seq=2 Ack=150593 Win=211456 Len=0 TSval=4226905 TSecr=127201308"
"187","12.244027s","0.000002s","192.168.0.41","192.168.0.42","TCP","1514","150593","2","1448","29312","33947 > 49200 [PSH, ACK] Seq=150593 Ack=2 Win=29312 Len=1448 TSval=127201308 TSecr=4226904"
"188","12.244036s","0.000009s","192.168.0.42","192.168.0.41","TCP","66","2","152041","","214400","49200 > 33947 [ACK] Seq=2 Ack=152041 Win=214400 Len=0 TSval=4226905 TSecr=127201308"
"189","12.244038s","0.000002s","192.168.0.41","192.168.0.42","TCP","1514","152041","2","1448","29312","33947 > 49200 [ACK] Seq=152041 Ack=2 Win=29312 Len=1448 TSval=127201308 TSecr=4226904"
"190","12.244047s","0.000009s","192.168.0.42","192.168.0.41","TCP","66","2","153489","","217216","49200 > 33947 [ACK] Seq=2 Ack=153489 Win=217216 Len=0 TSval=4226905 TSecr=127201308"
"191","12.244059s","0.000012s","192.168.0.41","192.168.0.42","TCP","1514","153489","2","1448","29312","33947 > 49200 [ACK] Seq=153489 Ack=2 Win=29312 Len=1448 TSval=127201308 TSecr=4226904"
"192","12.244075s","0.000016s","192.168.0.42","192.168.0.41","TCP","66","2","154937","","220160","49200 > 33947 [ACK] Seq=2 Ack=154937 Win=220160 Len=0 TSval=4226905 TSecr=127201308"
"193","12.244078s","0.000003s","192.168.0.41","192.168.0.42","TCP","1514","154937","2","1448","29312","33947 > 49200 [ACK] Seq=154937 Ack=2 Win=29312 Len=1448 TSval=127201308 TSecr=4226904"
"194","12.244089s","0.000011s","192.168.0.42","192.168.0.41","TCP","66","2","156385","","223104","49200 > 33947 [ACK] Seq=2 Ack=156385 Win=223104 Len=0 TSval=4226905 TSecr=127201308"
"195","12.244091s","0.000002s","192.168.0.41","192.168.0.42","TCP","1514","156385","2","1448","29312","33947 > 49200 [ACK] Seq=156385 Ack=2 Win=29312 Len=1448 TSval=127201308 TSecr=4226904"
"196","12.244102s","0.000011s","192.168.0.42","192.168.0.41","TCP","66","2","157833","","225920","49200 > 33947 [ACK] Seq=2 Ack=157833 Win=225920 Len=0 TSval=4226905 TSecr=127201308"
"197","12.244104s","0.000002s","192.168.0.41","192.168.0.42","TCP","1514","157833","2","1448","29312","33947 > 49200 [ACK] Seq=157833 Ack=2 Win=29312 Len=1448 TSval=127201308 TSecr=4226904"
"198","12.244114s","0.000010s","192.168.0.42","192.168.0.41","TCP","66","2","159281","","228864","49200 > 33947 [ACK] Seq=2 Ack=159281 Win=228864 Len=0 TSval=4226905 TSecr=127201308"
"199","12.244117s","0.000003s","192.168.0.41","192.168.0.42","TCP","1514","159281","2","1448","29312","33947 > 49200 [ACK] Seq=159281 Ack=2 Win=29312 Len=1448 TSval=127201308 TSecr=4226904"
"200","12.244127s","0.000010s","192.168.0.42","192.168.0.41","TCP","66","2","160729","","231680","49200 > 33947 [ACK] Seq=2 Ack=160729 Win=231680 Len=0 TSval=4226905 TSecr=127201308"
"201","12.244129s","0.000002s","192.168.0.41","192.168.0.42","TCP","1514","160729","2","1448","29312","33947 > 49200 [ACK] Seq=160729 Ack=2 Win=29312 Len=1448 TSval=127201308 TSecr=4226904"
"202","12.244137s","0.000008s","192.168.0.42","192.168.0.41","TCP","66","2","162177","","234624","49200 > 33947 [ACK] Seq=2 Ack=162177 Win=234624 Len=0 TSval=4226905 TSecr=127201308"
"203","12.244140s","0.000003s","192.168.0.41","192.168.0.42","TCP","1514","162177","2","1448","29312","33947 > 49200 [ACK] Seq=162177 Ack=2 Win=29312 Len=1448 TSval=127201308 TSecr=4226904"
"204","12.244152s","0.000012s","192.168.0.42","192.168.0.41","TCP","66","2","163625","","237568","49200 > 33947 [ACK] Seq=2 Ack=163625 Win=237568 Len=0 TSval=4226905 TSecr=127201308"
"205","12.244154s","0.000002s","192.168.0.41","192.168.0.42","TCP","1514","163625","2","1448","29312","33947 > 49200 [ACK] Seq=163625 Ack=2 Win=29312 Len=1448 TSval=127201308 TSecr=4226904"
"206","12.244164s","0.000010s","192.168.0.42","192.168.0.41","TCP","66","2","165073","","240256","49200 > 33947 [ACK] Seq=2 Ack=165073 Win=240256 Len=0 TSval=4226905 TSecr=127201308"
"207","12.244166s","0.000002s","192.168.0.41","192.168.0.42","TCP","1514","165073","2","1448","29312","33947 > 49200 [ACK] Seq=165073 Ack=2 Win=29312 Len=1448 TSval=127201308 TSecr=4226904"
"208","12.244172s","0.000006s","192.168.0.41","192.168.0.42","TCP","1514","166521","2","2896","29312","33947 > 49200 [ACK] Seq=166521 Ack=2 Win=29312 Len=1448 TSval=127201308 TSecr=4226904"
"209","12.244180s","0.000008s","192.168.0.41","192.168.0.42","TCP","1514","167969","2","4344","29312","33947 > 49200 [ACK] Seq=167969 Ack=2 Win=29312 Len=1448 TSval=127201308 TSecr=4226904"
"210","12.244186s","0.000006s","192.168.0.41","192.168.0.42","TCP","1514","169417","2","5792","29312","33947 > 49200 [ACK] Seq=169417 Ack=2 Win=29312 Len=1448 TSval=127201308 TSecr=4226904"
"211","12.244191s","0.000005s","192.168.0.41","192.168.0.42","TCP","1514","170865","2","7240","29312","33947 > 49200 [ACK] Seq=170865 Ack=2 Win=29312 Len=1448 TSval=127201308 TSecr=4226905"
"212","12.244193s","0.000002s","192.168.0.42","192.168.0.41","TCP","66","2","169417","","237312","49200 > 33947 [ACK] Seq=2 Ack=169417 Win=237312 Len=0 TSval=4226905 TSecr=127201308"
"213","12.244195s","0.000002s","192.168.0.41","192.168.0.42","TCP","1514","172313","2","4344","29312","33947 > 49200 [ACK] Seq=172313 Ack=2 Win=29312 Len=1448 TSval=127201308 TSecr=4226905"
"214","12.244202s","0.000007s","192.168.0.41","192.168.0.42","TCP","1514","173761","2","5792","29312","33947 > 49200 [ACK] Seq=173761 Ack=2 Win=29312 Len=1448 TSval=127201308 TSecr=4226905"
"215","12.244207s","0.000005s","192.168.0.41","192.168.0.42","TCP","1514","175209","2","7240","29312","33947 > 49200 [ACK] Seq=175209 Ack=2 Win=29312 Len=1448 TSval=127201308 TSecr=4226905"
"216","12.244217s","0.000010s","192.168.0.41","192.168.0.42","TCP","1514","176657","2","8688","29312","33947 > 49200 [ACK] Seq=176657 Ack=2 Win=29312 Len=1448 TSval=127201308 TSecr=4226905"
